Code,Product,Quantity on Hand,Reserved,Available
00011,Wardah C-defense DD Cream Light 20 ml (Pc(s)),21528.0,21528.0,0.0
00012,Wardah C-defense DD Cream Natural 20 ml (Pc(s)),7308.0,7308.0,0.0
00013,Wardah C-defense Serum 17 ml (Pc(s)),15960.0,0.0,15960.0
00071,Wardah EyeXpert Aqua Lash Mascara 6 gr (Pc(s)),2160.0,432.0,1728.0
00076,Wardah EyeXpert Optimum Hi-Black Liner 1 gr (Pc(s)),6000.0,400.0,5600.0
00077,Wardah EyeXpert Perfectcurl Mascara 7 gr (Pc(s)),4464.0,4464.0,0.0
00079,"Wardah Eyexpert Staylast Liquid Eyeliner 3,5 gr (Pc(s))",1296.0,864.0,432.0
00080,Wardah Lightening BB Cream Light 15 ml (pc(s)),5280.0,336.0,4944.0
00119,Wardah Blush On C 4 gr,1560.0,1560.0,0.0
00127,Wardah Everyday BB Cream Light 30 ml (Pc(s)),3492.0,3474.0,18.0
00172,Wardah Lip Palette Chocoaholic 10 g (Pc(s)),390.0,0.0,390.0
00173,Wardah Lip Palette Perfect Red 10 g (pc(s)),78.0,0.0,78.0
00174,Wardah Lip Palette Pinky Peach 10 g (pc(s)),780.0,0.0,780.0
00290,Wardah White Secret Day Cream 30 gr (pc(s)),216.0,0.0,216.0
00781,Emina Cheek Lit Pressed Blush Sugarcane 3.5 gr (Pc(s)),480.0,480.0,0.0
00782,Emina Cheek Lit Pressed Blush Violet Berry 3.5 gr (Pc(s)),240.0,240.0,0.0
00903,Wardah Eye Brow Brown,400.0,0.0,400.0
00942,Wardah Exclusive Matte Lip Cream 01 Red-dicted 4 gr (Pc(s)),720.0,720.0,0.0
00943,Wardah Exclusive Matte Lip Cream 02 Fuschionately 4 gr (Pc(s)),288.0,288.0,0.0
00944,Wardah Exclusive Matte Lip Cream 03 See You Latte 4 gr (Pc(s)),1152.0,1152.0,0.0
00945,Wardah Exclusive Matte Lip Cream 04 Pink Me 4 gr (Pc(s)),144.0,144.0,0.0
00946,Wardah Exclusive Matte Lip Cream 05 Speachless 4 gr (Pc(s)),1152.0,1152.0,0.0
00947,Wardah Exclusive Matte Lip Cream 06 Feeling Red 4 gr (Pc(s)),3312.0,3312.0,0.0
00948,Wardah Eye Liner Black,3200.0,1200.0,2000.0
00957,Emina Sugar Rush Lip Scrub 4.2 gr (Pc(s)),5904.0,5184.0,720.0
01016,Emina Dirt-less In Sight Make UP Remover 50 ml (Pc(s)),56.0,0.0,56.0
01057,Wardah Exclusive Matte Lip Cream 08 Pinkcredible 4 gr (Pc(S)),144.0,144.0,0.0
01065,Wardah Exclusive Matte Lip Cream 07 Hello Ruby 4 gr (Pc(s)),864.0,864.0,0.0
01075,Wardah Exclusive Matte Lip Cream 09 Mauve On 4 gr (Pc(S)),2448.0,2448.0,0.0
01076,Wardah Exclusive Matte Lip Cream 10 Berry Pretty 4 gr (Pc(s)),2304.0,2304.0,0.0
01077,Wardah Exclusive Matte Lip Cream 11 Oh So Nude 4 gr (Pc(s)),4176.0,4176.0,0.0
01078,Wardah Exclusive Matte Lip Cream 12 Plum It Up 4 gr (Pc(s)),432.0,432.0,0.0
01101,Emina Creamatte 04 Frostbite 5.5 gr (Pc(s)),288.0,288.0,0.0
01105,Wardah Lipstick Longlasting 01 Fabulous Peach 2.3 g (Pc(s)),240.0,0.0,240.0
01115,Wardah Lipstick Longlasting 11 Cherrie Glam 2.3 g (Pc(s)),240.0,0.0,240.0
01117,Wardah Lipstick Longlasting 13 Classic Brown 2.3 g (Pc(s)),240.0,0.0,240.0
01123,Wardah Intense Matte Lipstick 05 Easy Brownie 2.3 g (Pc(s)),480.0,0.0,480.0
01124,Wardah Intense Matte Lipstick 06 Blooming Pink 2.3 g (Pc(s)),720.0,0.0,720.0
01221,Wardah Exclusive Matte Lip Cream 14 My Honey Bee 4 gr (Pc(s)),4176.0,4176.0,0.0
01222,Wardah Exclusive Matte Lip Cream 15 Pinky Plumise 4 gr (Pc(s)),3312.0,3312.0,0.0
01224,Wardah Exclusive Matte Lip Cream 17 Rosy Cheek 4 gr (Pc(s)),432.0,432.0,0.0
01225,Wardah Exclusive Matte Lip Cream 18 Saturdate Night 4 gr (Pc(s)),288.0,288.0,0.0
01524,Wardah Perfect Bright Peel Off Mask 60 ml,1080.0,1080.0,0.0
01528,Wardah Everyday Fruity Sheer Lip Balm Strawberry 4 g,3984.0,3984.0,0.0
01529,Wardah Everyday Fruity Sheer Lip Balm Grape 4 g,4416.0,4416.0,0.0
01530,Wardah Everyday Moisture Lip Nutrition Honey 4 g,624.0,624.0,0.0
01531,Wardah Everyday Moisture Lip Nutrition Green Tea 4 g,1488.0,1488.0,0.0
01532,"Wardah Everyday Cheek and Lip Tint 01 Red, Set, Glow! 5.5 g",17280.0,17280.0,0.0
01554,Wardah Nature Daily Seaweed Cleansing Micellar Water 100 ml,784.0,784.0,0.0
01555,Wardah Nature Daily Seaweed Cleansing Micellar Water 240 ml,64.0,0.0,64.0
01571,Wardah EyeXpert The Volume Expert Mascara 7 gr (Pc(s)),4320.0,4320.0,0.0
01572,Wardah Acnederm Pure Foaming Cleanser 60 ml (Pc(s)),36.0,0.0,36.0
01574,Wardah Acnederm Day Moisturizer 40 ml (Pc(s)),12060.0,0.0,12060.0
01575,Wardah Acnederm Acne Spot Treatment Gel 15 ml (Pc(s)),5040.0,5040.0,0.0
01578,Wardah Acnederm Night Treatment Moisturizer 40 ml (Pc(s)),22500.0,0.0,22500.0
01606,Wardah Nature Daily Aloe Hydramild Moisturizer Cream 40 ml,2490.0,2490.0,0.0
01610,Wardah Nature Daily Seaweed Balancing Facial Scrub 60 ml ,756.0,0.0,756.0
01617,Wardah Nature Daily Aloe Hydramild Multifunction Gel 100 ml ,690.0,690.0,0.0
01620,Wardah Nature Daily Aloe Hydramild Facial Wash 100 ml ,840.0,840.0,0.0
01642,Emina Cheek Lit Cream Blush Violet 10 ml ,1470.0,1470.0,0.0
01643,Emina Cheek Lit Cream Blush Nudie Brown 10 ml ,70.0,70.0,0.0
01644,Emina Creamatte 08 Pumpkin Spice 5.5 gr ,288.0,288.0,0.0
01648,Emina Aqua Infused Sleeping Mask 30 g,32.0,0.0,32.0
01668,Wardah Lipstick Longlasting 17 Passionate Red 2.3 g,1680.0,0.0,1680.0
01670,Wardah Lipstick Longlasting 19 Sunrise Nude 2.3 g,720.0,0.0,720.0
01755,Wardah Instaperfect MATTESETTER Lip Matte Paint 04. VIBE 5.5 g,132.0,0.0,132.0
01803,Wardah Instaperfect HYPERGETIC Precise Black Liner 1 g,1440.0,1440.0,0.0
01887,Emina Ms. Pimple Acne Solution Spot Gel 15 ml,714.0,0.0,714.0
01917,Emina Lip Cushion 02. Be Cherry 9 g,288.0,0.0,288.0
01967,Emina Bright Stuff Face Wash 100 ml,6460.0,0.0,6460.0
02025,Wardah Perfect Bright Tone Up Micellar Water 100 ml,700.0,0.0,700.0
02031,Emina Oh So Kissable Tinted Balm Stick Pink Bonbons 3.4 g,1024.0,0.0,1024.0
02032,Emina Oh So Kissable Tinted Balm Stick Plum Candy 3.4 g,384.0,0.0,384.0
02033,Emina Aloe Vera Gel 60 ml,6732.0,0.0,6732.0
02035,Wardah Exclusive Liquid Foundation 02 Sheer Pink 20 ml,588.0,588.0,0.0
02037,Wardah Exclusive Liquid Foundation 04 Natural 20 ml,5432.0,5432.0,0.0
02038,Wardah Exclusive Liquid Foundation 05 Coffee Beige 20 ml,924.0,924.0,0.0
02078,Wardah Exclusive Blush On 01 Rosy Pink 6.5 g ,480.0,480.0,0.0
02079,Wardah Exclusive Blush On 02 Coral Peach 6.5 g,2544.0,2544.0,0.0
02080,Wardah Exclusive Eyeshadow Palette 01 Sunset Brown 10 g,810.0,810.0,0.0
02112,Wardah Colorfit Velvet Matte Lip Mousse 01 Brown Dreamer 4 g,4224.0,4224.0,0.0
02113,Wardah Colorfit Velvet Matte Lip Mousse 02 Joyful Orange 4 g,768.0,768.0,0.0
02114,Wardah Colorfit Velvet Matte Lip Mousse 03 Rose Ballerina 4 g,768.0,768.0,0.0
02115,Wardah Colorfit Velvet Matte Lip Mousse 04 Pink Sweetheart 4 g,4224.0,4224.0,0.0
02116,Wardah Colorfit Velvet Matte Lip Mousse 05 Artisan Mauve 4 g,5952.0,5952.0,0.0
02117,Wardah Colorfit Velvet Matte Lip Mousse 06 Fuchsia Lover 4 g,3072.0,3072.0,0.0
02118,Wardah Colorfit Velvet Matte Lip Mousse 07 Red Pioneer 4 g,768.0,768.0,0.0
02119,Wardah Colorfit Velvet Matte Lip Mousse 08 Brown Creator 4 g,4416.0,4416.0,0.0
02161,Wardah Colorfit Ultralight Matte Lipstick 01 Parfait Pink 3.6 g,2160.0,2160.0,0.0
02164,Wardah Colorfit Ultralight Matte Lipstick 04 Mocca Brown 3.6 g,2160.0,2160.0,0.0
02166,Wardah Colorfit Ultralight Matte Lipstick 06 Punch Fuchsia 3.6 g,1152.0,1152.0,0.0
02167,Wardah Colorfit Ultralight Matte Lipstick 07 Crimson Red 3.6 g,2448.0,2448.0,0.0
02170,Wardah Crystallure Supreme Activating Overnight Cream 50 g,648.0,0.0,648.0
02174,Crystallure Supreme Revitalizing Oil Serum 30 ml,451.0,0.0,451.0
02175,Wardah Crystallure Supreme Advanced Hydra Gel 50 g,816.0,0.0,816.0
02216,Wardah Perfect Bright BB Powder 50 g,1500.0,1500.0,0.0
02317,Emina Magic Potion 05 Summer 5.5 ml,264.0,264.0,0.0
02334,Wardah Lightening Oil-Infused Micellar Water 100 ml,1204.0,1204.0,0.0
02355,Wardah Colorfit Velvet Matte Lip Mousse 10 Lively Coral 4 g,1152.0,1152.0,0.0
02356,Wardah Colorfit Velvet Matte Lip Mousse 11 Cherish Marmalade 4 g,768.0,768.0,0.0
02357,Wardah Colorfit Velvet Matte Lip Mousse 12 Chic Terracotta 4 g,384.0,384.0,0.0
02359,Wardah Colorfit Velvet Matte Lip Mousse 14 Dainty Caramel 4 g,384.0,384.0,0.0
02363,Emina Lip Cushion 06. Coffee Please 9 g,576.0,0.0,576.0
02369,Wardah Lightening Powder Foundation Light Feel 01 Light Beige 12 g,2808.0,2808.0,0.0
02372,Wardah Lightening Powder Foundation Light Feel 04 Natural 12 g,10368.0,10368.0,0.0
02373,Wardah Lightening Powder Foundation Light Feel 05 Beige 12 g,144.0,36.0,108.0
02394,Wardah Lightening Whip Facial Foam 100 ml,9520.0,0.0,9520.0
02414,Wardah Lightening Day Cream Advanced Niacinamide 30 g,8136.0,0.0,8136.0
02418,Wardah Lightening Liquid Foundation 01. Light Beige 25 ml (Blister),3438.0,3438.0,0.0
02419,Wardah Lightening Liquid Foundation 02. Beige 25 ml (Blister),5634.0,5634.0,0.0
02420,Wardah Lightening Liquid Foundation 03. Ivory 25 ml (Blister),2412.0,2412.0,0.0
02421,Wardah Lightening Liquid Foundation 04. Natural 25 ml (Blister),3060.0,3060.0,0.0
02425,Wardah Exclusive Glowing Highlighter 6.5 g,240.0,240.0,0.0
02426,Wardah Lightening Blue Clay Mask 50 g,4000.0,4000.0,0.0
02427,Wardah Lightening Essence Sheet Mask 20 ml,80.0,0.0,80.0
02459,Wardah Instaperfect Everlast Intense Matte Liquid 01 EXCEPTIONAL 4.2 g,264.0,264.0,0.0
02460,Wardah Instaperfect Everlast Intense Matte Liquid 02 TIMELESS 4.2 g,396.0,396.0,0.0
02469,Wardah UV Shield Aqua Fresh Essence SPF 50 30 ml,20.0,0.0,20.0
02470,Wardah UV Shield Active Protection Serum SPF 50 35 ml,27258.0,0.0,27258.0
02473,Emina Clay Mask Brightening 60 ml,6372.0,6372.0,0.0
02475,Emina Clay Mask Soothe & Smooth 60 ml,1440.0,1440.0,0.0
02480,Wardah Lightening Serum Ampoule 5x5 ml,36.0,0.0,36.0
02526,Wardah Hydra Rose Gel to Foam Cleanser 100 ml,3420.0,3420.0,0.0
02808,Kahf Invigorating Waterfall Eau de Toilette 35 ml,352.0,0.0,352.0
02809,Kahf Humbling Forest Eau de Toilette 35 ml,396.0,0.0,396.0
02810,Kahf True Brotherhood Eau de Toilette 35 ml,308.0,0.0,308.0
02811,Kahf Revered Oud Eau de Toilette 35 ml,440.0,0.0,440.0
02812,Kahf Skin Energizing and Brightening Face Wash 100 ml,750.0,0.0,750.0
02813,Kahf Oil and Acne Care Face Wash 100 ml,855.0,0.0,855.0
02837,Emina Skin Buddy Bubble Up Face Wash 60 ml,360.0,0.0,360.0
02847,Emina Bright Stuff Face Toner 100 ml,3375.0,0.0,3375.0
02848,Wardah Lightening Face Mist 60 ml,1905.0,0.0,1905.0
02849,Wardah Colorfit Mattifying Powder 22N Light Ivory 15 g,2304.0,2304.0,0.0
02850,Wardah Colorfit Mattifying Powder 23W Warm Ivory 15 g,1920.0,1920.0,0.0
02851,Wardah Colorfit Mattifying Powder 32N Neutral Beige 15 g,960.0,960.0,0.0
02852,Wardah Colorfit Mattifying Powder 43W Golden Sand 15 g,720.0,720.0,0.0
02854,Wardah Colorfit Matte Foundation 22N Light Ivory 25 ml,186.0,186.0,0.0
02858,Wardah Colorfit Matte Foundation 43W Golden Sand 25 ml,992.0,992.0,0.0
02860,Wardah Colorfit Matte Foundation 52N Almond 25 ml,558.0,558.0,0.0
02861,Wardah Colorfit Velvet Powder Foundation 11C Pink Fair 11 g,1548.0,1548.0,0.0
02862,Wardah Colorfit Velvet Powder Foundation 22N Light Ivory 11 g,1188.0,1188.0,0.0
02863,Wardah Colorfit Velvet Powder Foundation 23W Warm Ivory 11 g,2124.0,2124.0,0.0
02864,Wardah Colorfit Velvet Powder Foundation 32N Neutral Beige 11 g,2412.0,2412.0,0.0
02866,Wardah Colorfit Velvet Powder Foundation 43W Golden Sand 11 g,756.0,756.0,0.0
02867,Wardah Colorfit Velvet Powder Foundation 42N Neutral Sand 11 g,72.0,72.0,0.0
02874,Emina Sun Battle SPF 45 PA+++ 30 ml,270.0,270.0,0.0
02875,Emina Sun Battle SPF 30 PA+++ 60 ml,6.0,0.0,6.0
02897,Wardah Lightening Serum Ampoule 8 ml,1776.0,0.0,1776.0
02906,Emina Squeeze Me Up Mascara 8 g,38.0,0.0,38.0
02920,Emina Bright Stuff Face Serum 30 ml,3168.0,3168.0,0.0
02921,Emina Bright Stuff Face Scrub 50 ml,1100.0,0.0,1100.0
02926,Wardah C-Defense Mousse Moisturizer 30 g,3888.0,1752.0,2136.0
02931,Wardah Colorfit Last All Day Lip Paint 12 Berry Lasting 4.2 g,1296.0,288.0,1008.0
02932,Wardah Colorfit Last All Day Lip Paint 11 Everlast Pink 4.2 g,576.0,576.0,0.0
02933,Wardah Colorfit Last All Day Lip Paint 10 Forever Mauve 4.2 g,1728.0,1584.0,144.0
02934,Wardah Colorfit Last All Day Lip Paint 03 Stick To Latte 4.2 g,864.0,576.0,288.0
02935,Wardah Colorfit Last All Day Lip Paint 08 Red Repeat 4.2 g,1008.0,576.0,432.0
02936,Wardah Colorfit Last All Day Lip Paint 07 Brick On 4.2 g,2304.0,576.0,1728.0
02937,Wardah Colorfit Last All Day Lip Paint 01 Peach Till Drop 4.2 g,1440.0,576.0,864.0
02938,Wardah Colorfit Last All Day Lip Paint 04 Brownderlast 4.2 g,3456.0,864.0,2592.0
02939,Wardah Colorfit Last All Day Lip Paint 09 Timeless Rose 4.2 g,2448.0,288.0,2160.0
02940,Wardah Colorfit Last All Day Lip Paint 06 Infinite Coral 4.2 g,1008.0,576.0,432.0
02941,Wardah Colorfit Last All Day Lip Paint 02 Eternal Sunset 4.2 g,2736.0,2736.0,0.0
02942,Wardah Colorfit Last All Day Lip Paint 05 Stay Russet 4.2 g,1584.0,1440.0,144.0
02966,Kahf Gentle Exfoliating Face Scrub 100 ml,690.0,0.0,690.0
02967,Kahf Triple Protection Sunscreen Moisturizer 30 ml,684.0,0.0,684.0
03099,Emina Lip Mask 9 gr (Blister Version),288.0,288.0,0.0
03102,Emina Poppin’ Matte 01 Lowkey 4.5 g,1992.0,0.0,1992.0
03103,Emina Poppin’ Matte 02 To Be Honest 4.5 g,2018.0,0.0,2018.0
03104,Emina Poppin’ Matte 03 Game On 4.5 g,840.0,0.0,840.0
03105,Emina Poppin’ Matte 04 Snatched 4.5 g,72.0,0.0,72.0
03106,Emina Poppin’ Matte 05 Easy Peasy 4.5 g,1992.0,0.0,1992.0
03124,Emina Lip Mask Vanilla Pretzel 9 g,2400.0,360.0,2040.0
03125,Emina Lip Mask Milky Matcha 9 g,2688.0,288.0,2400.0
03126,Emina Lip Mask Orange Squash 9 g,2904.0,120.0,2784.0
03140,Wardah Crystal Secret Pure Treatment Essence 30 ml,800.0,800.0,0.0
03144,Wardah Crystal Secret Foaming Cleanser with Natural AHA+PHA 100 ml,1950.0,0.0,1950.0
03405,Wardah Colorfit Perfect Glow Cushion 42N Neutral Sand 15 g,288.0,288.0,0.0
03406,Wardah Colorfit Perfect Glow Cushion 43W Golden Sand 15 g,528.0,0.0,528.0
03436,Wardah Crystal Secret Radiant Skin Starter Kit,760.0,8.0,752.0
03445,Wardah EyeXpert Eyebrow Pencil Black 1.14 g (Blister),16.0,0.0,16.0
03448,Wardah EyeXpert Matic Brow Definer 01 LIGHT BROWN 0.25 g,2079.0,2079.0,0.0
03449,Wardah EyeXpert Matic Brow Definer 02 DARK BROWN 0.25 g,3537.0,3537.0,0.0
03450,Wardah EyeXpert Matic Brow Definer 03 DARK GREY 0.25 g,1512.0,1512.0,0.0
03476,Wardah EYEXPERT Liftlast Waterproof Mascara 8 ml,4080.0,4080.0,0.0
03489,Wardah Nature Daily Aloe Hydramild Essence Toner 100 ml,16850.0,16850.0,0.0
03535,Emina Watercolor Lip Serum 01 Dawn 2 g,720.0,720.0,0.0
03537,Emina Watercolor Lip Serum 03 Dusk 2 g,144.0,144.0,0.0
03662,Malaysia Wardah Crystal Secret Brightening Day Cream 30 g,3912.0,0.0,3912.0
03733,Crystallure Moisture Rich Cleansing Foam 100 ml,140.0,0.0,140.0
04164,Kahf Advancing Beard & Hair Serum 30 ml,48.0,48.0,0.0
04571,Malaysia Wardah Lightening Hampers Ramadan Untuk Mencerahkan,1068.0,0.0,1068.0
04572,Malaysia Wardah Colorfit Series Hampers,1068.0,0.0,1068.0
N130,GWP Wardah Malaysia Reed Diffuser 2022,2850.0,0.0,2850.0
