Code,Product,Quantity on Hand,Reserved,Available
4,Acne Perfecting Moisurizer Gel Wardah 40 ml (Pc(s)),7,0,7
9,Wardah Roll On For Her 60 ml,4257,0,4257
11,Wardah C-defense DD Cream Light 20 ml (Pc(s)),252,0,252
12,Wardah C-defense DD Cream Natural 20 ml (Pc(s)),36,0,36
13,Wardah C-defense Serum 17 ml (Pc(s)),12763,0,12763
41,"Wardah Lipstick Exclusive 36 Sugary Pink 3,8 gr",2,0,2
59,Wardah Exclusive Liquid Foundation 04 Natural 20 ml,1,0,1
76,Wardah EyeXpert Optimum Hi-Black Liner 1 gr (Pc(s)),549,0,549
77,Wardah EyeXpert Perfectcurl Mascara 7 gr (Pc(s)),40500,0,40500
79,"Wardah Eyexpert Staylast Liquid Eyeliner 3,5 gr (Pc(s))",12132,0,12132
80,Wardah Lightening BB Cream Light 15 ml (pc(s)),11237,0,11237
95,Wardah Lightening Milk Cleanser 150 ml,16,0,16
117,Wardah Blush On A 4 gr,9,0,9
118,Wardah Blush On B 4 gr,56,0,56
119,Wardah Blush On C 4 gr,5637,0,5637
120,Wardah Blush On D 4 gr,88,0,88
125,"Wardah Double Function Kit 4,5 gr",9,0,9
126,Wardah Everyday BB Cream Light 15 ml (pc(s)),21048,0,21048
127,Wardah Everyday BB Cream Light 30 ml (Pc(s)),13,0,13
128,Wardah Everyday BB Cream Natural 15 ml (Pc(s)),56784,0,56784
129,Wardah Everyday BB Cream Natural 30 ml (Pc(s)),12,0,12
133,"Wardah Evd Lum Creamy Foundation Extra Cover 04 Natural 8,5 g (Pc(s))",28,0,28
135,Wardah Evd Lum Creamy Foundation Light Feel 02 Light Beige 11 g (Pc(s)),20,0,20
138,Wardah Evd Lum Face Powder 01 Light Beige 30 g (Pc(s)),5862,0,5862
139,Wardah Evd Lum Face Powder 02 Beige 30 g (Pc(s)),16166,0,16166
140,Wardah Evd Lum Face Powder 03 Ivory 30 g (Pc(s)),6897,0,6897
141,Wardah Evd Lum Face Powder 04 Natural 30 g (Pc(s)),8236,0,8236
146,Wardah Evd Lum Two Way Cake 01 Light Beige 12 g (Pc(s)),4,0,4
147,Wardah Evd Lum Two Way Cake 02 Beige 12 g (Pc(s)),37,0,37
148,Wardah Evd Lum Two Way Cake 03 Ivory 12 g (Pc(s)),24,0,24
149,Wardah Evd Lum Two Way Cake 04 Light Ivory 12 g (Pc(s)),293,0,293
174,Wardah Lip Palette Pinky Peach 10 g (pc(s)),78,0,78
217,Wardah Refill Evd Lum Two Way Cake 01 Light Beige 12 g (Pc(s)),1380,0,1380
218,Wardah Refill Evd Lum Two Way Cake 02 Beige 12 g (Pc(s)),1158,0,1158
219,Wardah Refill Evd Lum Two Way Cake 03 Ivory 12 g (Pc(s)),169,0,169
220,Wardah Refill Evd Lum Two Way Cake 04 Light Ivory 12 g (Pc(s)),142,0,142
264,Wardah Creamy Body Butter With Lavender & Ginger 50 ml (Pc(s)),20,0,20
265,Wardah Creamy Body Butter With Milk & Pearl 50 ml (Pc(s)),24,0,24
266,Wardah Creamy Body Butter With Olive 50 ml (pc(s)),84,0,84
267,Wardah Creamy Body Butter With Passion Fruit 50 ml (Pc(s)),4,0,4
268,Wardah Creamy Body Butter With Rose 50 ml (pc(s)),24,0,24
269,Wardah Creamy Body Butter With Strawberry 50 ml (Pc(s)),15,0,15
276,Wardah Creamy Body Butter With Lavender & Ginger 150 ml (Pc(s)),12,0,12
278,Wardah Creamy Body Butter With Olive 150 ml (Pc(s)),2892,0,2892
279,Wardah Creamy Body Butter With Passion Fruit 150 ml (Pc(s)),323,0,323
282,Wardah Olive Oil For Massage 150 ml,1896,0,1896
283,Wardah Pure Olive Oil 50 ml,3705,0,3705
284,Wardah Soft Body Scrub With Olive 150 ml (Pc(s)),99,0,99
285,Wardah Soft Body Scrub With Olive 240 ml (Pc(s)),1048,0,1048
286,Wardah Soft Body Scrub With Passion Fruit 150 ml (Pc(s)),288,0,288
287,Wardah Soft Body Scrub With Strawberry 150 ml (Pc(s)),624,0,624
289,Wardah White Secret Day Cream 17 ml (pc(s)),93,0,93
294,Wardah White Secret Facial Wash with AHA 100 ml (Pc(s)),3,0,3
297,Wardah White Secret Night Cream 30 gr (Pc(s)),863,0,863
299,Wardah White Secret Exfoliating Scrub 50 ml (Pc(s)),1476,0,1476
301,"Hair Tonic Ginseng, 200 ml",9627,0,9627
303,"Hair Tonic Ginseng, 450 ml",2060,0,2060
304,"Hair Tonic Ginseng, 2 L",8,0,8
305,"Hair Tonic Normal Hair (Yellow), 200 ml",1632,0,1632
307,"Hair Tonic Normal Hair (Yellow), 450 ml",214,0,214
309,"Hair Tonic Normal to Oily Hair (Green), 200 ml",19279,0,19279
310,"Hair Tonic Normal to Oily Hair (Green), 200 mld",10,0,10
311,"Hair Tonic Normal to Oily Hair (Green), 450 ml",1988,0,1988
312,"Hair Tonic Normal to Oily Hair (Green), 2 L",93,0,93
314,Putri Natural Candlenut Oil 100 ML (Pc(s)),81,0,81
315,Putri Natural Creambath Aloe Vera 240 ML (Pc(s)),12,0,12
316,Putri Natural Creambath Aloe Vera 720 ML (Pc(s)),45,0,45
317,Putri Natural Creambath Avocado 240 ML (Pc(s)),24,0,24
323,Putri Natural Creambath Candlenut 240 ML (Pc(s)),12,0,12
324,Putri Natural Creambath Candlenut 720 ML (Pc(s)),156,0,156
330,Putri Platinum Deep Moisturizer Spray 200 ML (Pc(s)),70,0,70
334,Putri Platinum Neutralizer Step 2 720 ML (Pc(s)),2280,0,2280
336,Putri Platinum Pustreite Step 1 720 ML (Pc(s)),1140,0,1140
339,Putri Cold Wave 450 ML (Pc(s)),160,0,160
343,Putri Neutralizer Lotion 450 ML (Pc(s)),6,0,6
347,Putri Pustreite Step 1 720 ML (Pc(s)),483,0,483
349,Putri Pustreite Step 2 720 ML (Pc(s)),6,0,6
350,Putri Pure Clean Hair Conditioner Apple 200 ML (Pc(s)),4631,0,4631
351,Putri Pure Clean Hair Conditioner Apple 450 ML (Pc(s)),303,0,303
353,Putri Pure Clean Hair Conditioner Apple 5 L (Pc(s)),747,0,747
354,Putri Pure Clean Hair Conditioner Apple 20 L (Pc(s)),122,0,122
355,Putri Pure Clean Hair Conditioner Floral 200 ML (Pc(s)),264,0,264
356,Putri Pure Clean Hair Conditioner Floral 450 ML (Pc(s)),1508,0,1508
357,Putri Pure Clean Hair Conditioner Floral 2 L (Pc(s)),27,0,27
360,Putri Pure Clean Shampoo Apple 200 ML (Pc(s)),1296,0,1296
361,Putri Pure Clean Shampoo Apple 450 ML (Pc(s)),1327,0,1327
362,Putri Pure Clean Shampoo Apple 2 L (Pc(s)),1,0,1
365,Putri Pure Clean Shampoo Lemon 200 ML (Pc(s)),588,0,588
366,Putri Pure Clean Shampoo Lemon 450 ML (Pc(s)),900,0,900
368,Putri Pure Clean Shampoo Lemon 5 L (Pc(s)),3,0,3
370,Putri Shampoo Ginseng 200 ML (Pc(s)),837,0,837
374,Putri SPA Series Relaxing Creambath 720 ml (pc(s)),1,0,1
375,Putri SPA Series Hair Mask 240 ml (Pc(s)),1,0,1
376,Putri SPA Series Hair Mask 720 ml (pc(s)),4,0,4
379,"Hair Tonic SPA Relaxing Lavender, 200 ml",202,0,202
381,Putri Massage Cream 1 KG (Pc(s)),3,0,3
382,Putri Olive Body Scrub 150 ML (Pc(s)),30,0,30
384,Putri Olive Body Scrub 720 ML (Pc(s)),4,0,4
388,Putri SPA Energizing Shampoo (Lemon) 200 ML (Pc(s)),7,0,7
389,Putri SPA Energizing Shampoo (Lemon) 450 ML (Pc(s)),7,0,7
392,Putri Hair Spray Non Aerosol Normal (Biru) 200 ML (Pc(s)),72,0,72
394,Putri Hair Spray Non Aerosol Normal (Biru) 450 ML (Pc(s)),128,0,128
395,Putri Hair Spray Non Aerosol Strong (Hijau) 200 ML (Pc(s)),540,0,540
397,Putri Hair Spray Non Aerosol Strong (Hijau) 450 ML (Pc(s)),180,0,180
398,Putri Styling Glaze 200 ML (Pc(s)),35,0,35
400,Putri Wet Jelly 100 ML (Pc(s)),20,0,20
514,MAKE OVER Corrective Base Make Up 02 Greenish 40 ml (Pc(s)),0,0,0
515,MAKE OVER Hydration Serum 33 ml (Pc(s)),1222,0,1222
518,MAKE OVER Perfect Cover Creamy Foundation 01 Rich Almond 12 g (Pc(s)),0,0,0
524,MAKE OVER Perfect Cover Creamy Foundation 07 Frosted White 12 g (Pc(s)),0,0,0
526,MAKE OVER Ultra Cover Liquid Matt Foundation 01 Ochre 33 ml (Pc(s)),2527,0,2527
527,MAKE OVER Ultra Cover Liquid Matt Foundation 02 Pink Shade 33 ml (pc(s)),953,0,953
528,MAKE OVER Ultra Cover Liquid Matt Foundation 03 Nude Silk 33 ml (pc(s)),420,0,420
529,MAKE OVER Ultra Cover Liquid Matt Foundation 04 Amber Rose 33 ml (Pc(s)),416,0,416
530,MAKE OVER Ultra Cover Liquid Matt Foundation 05 Velvet Nude 33 ml (pc(s)),2856,0,2856
531,MAKE OVER Ultra Cover Liquid Matt Foundation 06 Beige Blast 33 ml (pc(s)),11,0,11
533,Make Over Ultra Cover Liquid Matt Foundation 08 Pearl 33 ml (Pc(s)),20,0,20
534,MAKE OVER Ultra Cover Liquid Matt Foundation 09 Crème Rose 33 ml (pc(s)),13,0,13
535,"Perfect Cover TWC 01 Lace, 14 gr",10,0,10
537,"Perfect Cover TWC 03 Maple, 14 gr",7,0,7
538,"Perfect Cover TWC 04 Desert, 14 gr",8,0,8
551,"Refill Perfect Cov. TWC 08 Honey, 14 gr",9,0,9
557,MAKE OVER Silky Smooth Translucent Powder 01 Porcelain 35 g (Pc(s)),231,0,231
558,MAKE OVER Silky Smooth Translucent Powder 02 Rosy 35 g (Pc(s)),1224,0,1224
561,MAKE OVER Silky Smooth Translucent Powder 05 Snow 35 g (Pc(s)),1115,0,1115
584,MAKE OVER Powder Eye Shadow Frozen Pink 2 g (Pc(s)),240,0,240
585,MAKE OVER Powder Eye Shadow Gold Knight 2 g (Pc(s)),102,0,102
586,MAKE OVER Powder Eye Shadow Golden Attack 2 g (Pc(s)),91,0,91
601,"MAKE OVER SGES Brown Vegas Refill Pack 3,5 g (Pc(s))",17,0,17
622,MAKE OVER Sparkling Powder Silver 2 g (Pc(s)),2,0,2
623,MAKE OVER Trivia Eye Shadow Black Goddiva 6 g (Pc(s)),1,0,1
629,MAKE OVER Trivia Eye Shadow Skycrapping Blue 6 g (Pc(s)),1,0,1
635,MAKE OVER Trivia Eye Shadow Dolly Crush 6 g (Pc(s)),5,0,5
636,MAKE OVER Trivia Eye Shadow Magical Fairy Tale 6 g (Pc(s)),185,0,185
637,"MAKE OVER Eyebrow Pencil Black Lines 1,14 g (Pc(s))",570,0,570
638,"MAKE OVER Eyebrow Pencil Brown To Earth 1,14 g (Pc(s))",286,0,286
640,"MAKE OVER Eye Liner Pencil Black Jack 1,2 g (Pc(s))",18352,0,18352
641,"MAKE OVER Eye Liner Pencil Brown Latte 1,2 g (Pc(s))",11160,0,11160
642,"MAKE OVER Eye Liner Pencil Navy Blue 1,2 g (Pc(s))",3729,0,3729
643,"MAKE OVER Eye Liner Pencil White Techno 1,2 g (Pc(s))",4221,0,4221
649,"MAKE OVER Eye Liner Pencil Silver Lines 1,2 g (Pc(s))",4548,0,4548
650,"MAKE OVER Eye Liner Pencil Nude Sleek 1,2 g (Pc(s))",3137,0,3137
652,MAKE OVER Eye Liner Pencil Package Black Jack (Pc(s)),453,0,453
656,MAKE OVER BO Single 01 Pink Fantasist 6 g (Pc(s)),162,0,162
658,MAKE OVER BO Single 03 Promiscious Peach 6g (Pc(s)),3045,0,3045
661,MAKE OVER BO Single 06 Caribbean Sunset 6 g (Pc(s)),40,0,40
662,MAKE OVER BO Single 07 Scarlet Sheen 6 g (Pc(s)),23,0,23
663,MAKE OVER BO Single 08 Cruise Coral 6 g (Pc(s)),36,0,36
664,MAKE OVER BO Single 09 Summer Twist 6 g (Pc(s)),30,0,30
665,"MAKE OVER BO 01 Pink Fantasist Refill Pack 3,5 g (pc(s))",190,0,190
667,"MAKE OVER BO 03 Promiscious Peach Refill Pack 3,5 g (Pc(s))",39,0,39
673,MAKE OVER BO 09 Summer Twist Refill Pack 3.5 g (Pc(s)),385,0,385
674,MAKE OVER Cheek Marbles 20 g (Pc(s)),14,0,14
675,"MAKE OVER Perfect Shade Blush On Palette 8X3,5 g (Pc(s))",2,0,2
691,"MAKE OVER Lip Color Palette Peplum Pink 02 5x1,7 g (Pc(s))",0,0,0
748,"MAKE OVER Lipbalm Lip Nutrition Melon Crazy 3,8 g (Pc(s))",264,0,264
758,MAKE OVER Make Up Remover 100 ml (Pc(s)),1890,0,1890
759,MAKE OVER Toner 100 ml (Pc(s)),2,0,2
764,MAKE OVER Small Sharpener (Pc(s)),598,0,598
775,Emina Cheek Lit Cream Blush Pink 10 ml (Pc(s)),35,0,35
776,Emina Cheek Lit Cream Blush Peach 10 ml (Pc(s)),40,0,40
778,Emina Cheek Lit Pressed Blush Cherry Blossoms 3.5 gr (Pc(s)),2,0,2
779,Emina Cheek Lit Pressed Blush Cotton Candy 3.5 gr (Pc(s)),37,0,37
780,Emina Cheek Lit Pressed Blush Marshmallow Lady 3.5 gr (Pc(s)),4354,0,4354
781,Emina Cheek Lit Pressed Blush Sugarcane 3.5 gr (Pc(s)),874,0,874
783,Emina City Chic CC Cake Meringue 12 gr (Pc(s)),11,0,11
785,Emina City Chic CC Cake Butterscotch 12 gr (Pc(s)),20,0,20
794,Emina Liquid Lip Shine Wineberry 4.5 ml (Pc(s)),22,0,22
795,Emina Liquid Lip Shine Carnation Pink 4.5 ml (Pc(s)),1,0,1
796,Emina Liquid Lip Shine Buttery Nude 4.5 ml (Pc(s)),208,0,208
810,Emina Pop Rouge Pressed Eye Shadow Blue 3.3 gr (Pc(s)),108,0,108
811,Emina Pop Rouge Pressed Eye Shadow Gelato 3.3 gr (Pc(s)),36,0,36
814,Emina Pop Rouge Pressed Eye Shadow Nude 3.3 gr (Pc(s)),45,0,45
816,Emina Eye Do! Pencil Eye Liner Brown 1 gr (Pc(s)),31,0,31
822,Emina Star Lash Aqua Mascara 5 gr (Pc(s)),358,0,358
824,Emina Double Agent Eyebrow Black 0.3 gr (Pc(s)),405,0,405
825,Emina Double Agent Eyebrow Brown 0.3 gr (Pc(s)),5211,0,5211
827,Emina Eye Do! Crayon Pour Les Yeux Black 0.2 gr (Pc(s)),56,0,56
886,MAKE OVER Perfect Cover TWC 01 Lace 12 g (Pc(s)),1234,0,1234
887,MAKE OVER Perfect Cover TWC 02 Coral 12 g (Pc(s)),1519,0,1519
889,MAKE OVER Perfect Cover TWC 04 Desert 12 g (Pc(s)),14,0,14
890,MAKE OVER Perfect Cover TWC 05 Cinnamon 12 g (Pc(s)),1897,0,1897
891,MAKE OVER Perfect Cover TWC 07 Espresso 12 g (Pc(s)),8,0,8
892,MAKE OVER Perfect Cover TWC 06 Cappuccino 12 g (Pc(s)),288,0,288
893,MAKE OVER Perfect Cover Refill TWC 01 Lace 12 g (Pc(s)),1136,0,1136
894,MAKE OVER Perfect Cover Refill TWC 02 Coral 12 g (Pc(s)),70,0,70
896,MAKE OVER Perfect Cover Refill TWC 04 Desert 12 g (Pc(s)),2,0,2
897,MAKE OVER Perfect Cover Refill TWC 05 Cinnamon 12 g (Pc(s)),654,0,654
900,MAKE OVER Perfect Cover TWC 08 Honey 12 g (Pc(s)),7346,0,7346
901,MAKE OVER Perfect Cover Refill TWC 08 Honey 12 g (Pc(s)),4087,0,4087
902,Wardah Eye Brow Black,35,0,35
903,Wardah Eye Brow Brown,6,0,6
927,"Wardah Eye Shadow I 3,3 gr (pc(s))",120,0,120
928,"Wardah Eye Shadow J 3,3 gr (pc(s))",39,0,39
930,"Wardah Eye Shadow L 3,3 gr (pc(s))",45,0,45
938,"Wardah Eye Shadow F 3,3 gr (pc(s))",37,0,37
939,"Wardah Eye Shadow G 3,3 gr (pc(s))",105,0,105
941,"Wardah EyeXpert Eyeshadow Passionate 3,3 gr",2039,0,2039
942,Wardah Exclusive Matte Lip Cream 01 Red-dicted 4 gr (Pc(s)),7520,0,7520
943,Wardah Exclusive Matte Lip Cream 02 Fuschionately 4 gr (Pc(s)),1340,0,1340
944,Wardah Exclusive Matte Lip Cream 03 See You Latte 4 gr (Pc(s)),20516,0,20516
945,Wardah Exclusive Matte Lip Cream 04 Pink Me 4 gr (Pc(s)),144,0,144
946,Wardah Exclusive Matte Lip Cream 05 Speachless 4 gr (Pc(s)),27393,0,27393
947,Wardah Exclusive Matte Lip Cream 06 Feeling Red 4 gr (Pc(s)),14868,0,14868
948,Wardah Eye Liner Black,110734,0,110734
980,"MAKE OVER Intense Matte Lip Cream 002 Heiress 6,5 g (Pc(s))",346,0,346
981,"MAKE OVER Intense Matte Lip Cream 003 Secret 6,5 g (Pc(s))",192,0,192
982,"MAKE OVER Intense Matte Lip Cream 004 Vanity 6,5 g (Pc(s))",252,0,252
983,"MAKE OVER Intense Matte Lip Cream 005 Impulse 6,5 g (Pc(s))",69,0,69
985,"MAKE OVER Intense Matte Lip Cream 007 Scarlet 6,5 g (Pc(s))",5,0,5
987,MAKE OVER BO Single 10 Passion Pink 6 g (Pc(s)),279,0,279
1014,Emina Beauty Bliss BB Cream Caramel 20 ml (Pc(s)),2,0,2
1016,Emina Dirt-less In Sight Make UP Remover 50 ml (Pc(s)),178,0,178
1018,Emina Top Secret Eyebrow 2.9 gr (Pc(s)),93,0,93
1021,Emina Moist In a Bottle 50 ml (Pc(s)),6426,0,6426
1039,Emina Creamy Milk Cleansing Lotion 50 ml (Pc(s)),2634,0,2634
1041,Wardah C-Defense Face Mist 55 ml (pc(s)),5236,0,5236
1042,Emina Smoochies Lip Balm Cucumber Juice 3.7 gr (pc(s)),11,0,11
1045,Emina Green Tea Latte Face Mask 60 ml (Pc(s)),12,0,12
1051,MAKE OVER TWC Palette 3X12 g (Pc(s)),8,0,8
1057,Wardah Exclusive Matte Lip Cream 08 Pinkcredible 4 gr (Pc(S)),18540,0,18540
1065,Wardah Exclusive Matte Lip Cream 07 Hello Ruby 4 gr (Pc(s)),1032,0,1032
1075,Wardah Exclusive Matte Lip Cream 09 Mauve On 4 gr (Pc(S)),12600,0,12600
1076,Wardah Exclusive Matte Lip Cream 10 Berry Pretty 4 gr (Pc(s)),280,0,280
1077,Wardah Exclusive Matte Lip Cream 11 Oh So Nude 4 gr (Pc(s)),3168,0,3168
1078,Wardah Exclusive Matte Lip Cream 12 Plum It Up 4 gr (Pc(s)),24903,0,24903
1081,Emina Creamatte 02 Fuzzy Wuzzy 5.5 gr (Pc(s)),3448,0,3448
1100,Emina Creamatte 01 Chocolava 5.5 gr (Pc(s)),228,0,228
1101,Emina Creamatte 04 Frostbite 5.5 gr (Pc(s)),36,0,36
1103,Emina Creamatte 06 Jelly Bean 5.5 gr (Pc(s)),1788,0,1788
1104,Emina Creamatte 07 Tumbleweed 5.5 gr (Pc(s)),2532,0,2532
1105,Wardah Lipstick Longlasting 01 Fabulous Peach 2.3 g (Pc(s)),24,0,24
1107,Wardah Lipstick Longlasting 03 Simply Brown 2.3 g (Pc(s)),224,0,224
1112,Wardah Lipstick Longlasting 08 Red Velvet 2.3 g (Pc(s)),483,0,483
1113,Wardah Lipstick Longlasting 09 Vibrant Red 2.3 g (Pc(s)),389,0,389
1114,Wardah Lipstick Longlasting 10 Stylish Mocca 2.3 g (Pc(s)),337,0,337
1128,Wardah Intense Matte Lipstick 10 Miss Terracotta 2.3 g (Pc(s)),5,0,5
1129,Wardah Intense Matte Lipstick 11 Choco Town 2.3 g (Pc(s)),4,0,4
1131,MAKE OVER Ultra Hi-Matte Lipstick 001 King of Pink 2.3 g (Pc(s)),1,0,1
1135,MAKE OVER Ultra Hi-Matte Lipstick 005 Champagne Rose 2.3 g (Pc(s)),1,0,1
1136,MAKE OVER Ultra Hi-Matte Lipstick 006 Silky Blonde 2.3 g (Pc(s)),2,0,2
1142,MAKE OVER Ultra Hi-Matte Lipstick 012 Envy 2.3 g (Pc(s)),2,0,2
1150,Wardah C-Defense Energizing Creamy Wash 100 ml (Pc(s)),4476,0,4476
1204,MAKE OVER Velvet Mattifying Primer 20 ml,3640,0,3640
1211,Emina Brush Set (Set),5,0,5
1219,"MAKE OVER Liquid Eye Liner Black 1,7 ml (Pc(s))",9353,0,9353
1220,Wardah Exclusive Matte Lip Cream 13 Fruit Punch 4 gr (Pc(s)),30402,0,30402
1221,Wardah Exclusive Matte Lip Cream 14 My Honey Bee 4 gr (Pc(s)),84,0,84
1222,Wardah Exclusive Matte Lip Cream 15 Pinky Plumise 4 gr (Pc(s)),1,0,1
1223,Wardah Exclusive Matte Lip Cream 16 Heartbeet 4 gr (Pc(s)),36,0,36
1224,Wardah Exclusive Matte Lip Cream 17 Rosy Cheek 4 gr (Pc(s)),12665,0,12665
1225,Wardah Exclusive Matte Lip Cream 18 Saturdate Night 4 gr (Pc(s)),5325,0,5325
1226,Wardah C-Defense Energizing Creamy Wash 60 ml (Pc(s)),18330,0,18330
1251,Emina Apricot Jam Face Scrub 60 ml (Pc(s)),3118,0,3118
1255,"MAKE OVER Intense Matte Lip Cream 016 Pixie 6,5 g (Pc(s))",1920,0,1920
1256,"MAKE OVER Intense Matte Lip Cream 017 Savvy 6,5 g (Pc(s))",183,0,183
1258,"MAKE OVER Intense Matte Lip Cream 019 Vogue 6,5 g (Pc(s))",93,0,93
1262,MAKE OVER Eye Shadow Palette Smokey 10 g (Pc(s)),3,0,3
1266,Emina Grape Seed Olive Face Mask 60 ml (Pc(s)),27,0,27
1284,"MAKE OVER Intense Matte Lip Cream 012 Couture 6,5 g (Pc(s))",321,0,321
1407,Malaysia Wardah Nude Colours Eyeshadow Passionate 3.3 g (Pc(s)),120,0,120
1424,"MAKE OVER Intense Matte Lip Cream 010 Lux 6,5 g (Pc(s))",138,0,138
1439,Wardah Intense Matte Lipstick 16 Pecan Pie 2.3 g (Pc(s)),1,0,1
1442,Wardah Tester Intense Matte Lipstick 15 Out of Red! 2.3 g (Pc(s)),0,0,0
1443,Wardah Tester Intense Matte Lipstick 16 Pecan Pie 2.3 g (Pc(s)),0,0,0
1444,"MAKE OVER Intense Matte Lip Cream 009 Posh 6,5 g (Pc(s))",864,0,864
1445,"MAKE OVER Intense Matte Lip Cream 011 Pompous 6,5 g (Pc(s))",48,0,48
1463,MAKE OVER Micellar Water 185 ml,1260,0,1260
1491,"MAKE OVER Intense Matte Lip Cream 013 Dainty 6,5 g (Pc(s))",300,0,300
1492,"MAKE OVER Intense Matte Lip Cream 014 Coco 6,5 g (Pc(s))",195,0,195
1499,MAKE OVER Hyperblack Superstay Liner 1 g ,14648,0,14648
1507,MAKE OVER Brow Styler Eye Definer Mocha 0.13 g,8366,0,8366
1519,Wardah Perfect Bright Creamy Foam Brightening + Smoothing 100 ml (Pc(s)),27,0,27
1520,Wardah Perfect Bright Creamy Foam Brightening + Oil Control 60 ml (Pc(s)),0,0,0
1524,Wardah Perfect Bright Peel Off Mask 60 ml,3519,0,3519
1525,Wardah Nature Daily Mineral+ Clarifying Clay Mask 60 ml,25236,0,25236
1528,Wardah Everyday Fruity Sheer Lip Balm Strawberry 4 g,3666,96,3570
1530,Wardah Everyday Moisture Lip Nutrition Honey 4 g,1,0,1
1531,Wardah Everyday Moisture Lip Nutrition Green Tea 4 g,4207,0,4207
1532,"Wardah Everyday Cheek and Lip Tint 01 Red, Set, Glow! 5.5 g",24,0,24
1534,Wardah Everyday Cheek and Lip Tint 03 Pink on Point! 5.5 g,10824,0,10824
1554,Wardah Nature Daily Seaweed Cleansing Micellar Water 100 ml,29988,0,29988
1555,Wardah Nature Daily Seaweed Cleansing Micellar Water 240 ml,2062,0,2062
1558,MAKE OVER Color Stick Matte Crayon 103 Harper 2.6 g,30,0,30
1559,MAKE OVER Color Stick Matte Crayon 104 Blake 2.6 g,73,0,73
1560,MAKE OVER Color Stick Matte Crayon 105 Skye 2.6 g,127,0,127
1571,Wardah EyeXpert The Volume Expert Mascara 7 gr (Pc(s)),151,0,151
1572,Wardah Acnederm Pure Foaming Cleanser 60 ml (Pc(s)),43527,0,43527
1573,Wardah Acnederm Pore Refining Toner 100 ml (Pc(s)),24988,0,24988
1574,Wardah Acnederm Day Moisturizer 40 ml (Pc(s)),22926,0,22926
1575,Wardah Acnederm Acne Spot Treatment Gel 15 ml (Pc(s)),34591,0,34591
1576,Wardah Acnederm Pore Blackhead Balm 20 g (Pc(s)),11356,0,11356
1577,Wardah Acnederm Face Powder 20 g (Pc(s)),13418,0,13418
1578,Wardah Acnederm Night Treatment Moisturizer 40 ml (Pc(s)),6088,0,6088
1579,MAKE OVER Powerstay Weightless Liquid Foundation N10 Marble 33 ml,20,0,20
1580,MAKE OVER Powerstay Weightless Liquid Foundation W22 Warm Ivory 33 ml,1,0,1
1581,MAKE OVER Powerstay Weightless Liquid Foundation C21 Pink Ivory 33 ml,25,0,25
1582,MAKE OVER Powerstay Weightless Liquid Foundation W33 Honey Beige 33 ml,18,0,18
1586,MAKE OVER Powerstay Weightless Liquid Foundation C62 Rich Cocoa 33 ml,25,0,25
1587,MAKE OVER Powerstay Matte Powder Foundation N10 Marble 12 g,23,0,23
1588,MAKE OVER Powerstay Matte Powder Foundation W22 Warm Ivory 12 g,4136,0,4136
1590,MAKE OVER Powerstay Matte Powder Foundation W33 Honey Beige 12 g,452,0,452
1591,MAKE OVER Powerstay Matte Powder Foundation N30 Natural Beige 12 g,6,0,6
1593,MAKE OVER Powerstay Matte Powder Foundation W41 Coral Sand 12 g,9,0,9
1595,MAKE OVER Powerstay Mattifying Transparent Powder 11 g,884,0,884
1606,Wardah Nature Daily Aloe Hydramild Moisturizer Cream 40 ml,15199,0,15199
1607,Wardah Nature Daily Witch Hazel Purifying Moisturizer Gel 40 ml ,12108,0,12108
1608,Wardah Nature Daily Seaweed Balancing Facial Wash 60 ml ,19198,0,19198
1610,Wardah Nature Daily Seaweed Balancing Facial Scrub 60 ml ,9625,0,9625
1615,Wardah Renew You Hydrafirm Sleeping Mask 30 g,1,0,1
1617,Wardah Nature Daily Aloe Hydramild Multifunction Gel 100 ml ,1656,0,1656
1619,Wardah Nature Daily Aloe Hydramild Facial Wash 60 ml ,34920,0,34920
1620,Wardah Nature Daily Aloe Hydramild Facial Wash 100 ml ,11449,0,11449
1621,Wardah Nature Daily Mineral+ Clarifying Facial Foam 60 ml ,12574,0,12574
1623,MAKE OVER Cliquematte Lip Stylo 202 Hollywood 2 g,4012,0,4012
1624,MAKE OVER Cliquematte Lip Stylo 203 Crush 2 g,11296,0,11296
1626,MAKE OVER Cliquematte Lip Stylo 205 Jetsetter 2 g,5631,0,5631
1627,MAKE OVER Cliquematte Lip Stylo 206 Grandiose 2 g,2523,0,2523
1629,MAKE OVER Cliquematte Lip Stylo 208 Spotlight 2 g,2,0,2
1631,Wardah Nature Daily Mineral+ Clarifying Facial Foam 100 ml ,959,0,959
1632,Wardah Lightening Day Cream 30 g (Pc(s)),3,0,3
1638,Wardah Perfect Bright Moisturizer SPF 28 20 ml,288,288,0
1639,Emina Magic Potion 01 Scarlet 5.5 ml,24,0,24
1641,Emina Magic Potion 03 Smitten 5.5 ml,7188,0,7188
1644,Emina Creamatte 08 Pumpkin Spice 5.5 gr ,600,0,600
1645,Emina Creamatte 09 Baby Fox 5.5 gr ,156,0,156
1646,Emina Creamatte 10 Starfish 5.5 gr ,2575,0,2575
1648,Emina Aqua Infused Sleeping Mask 30 g,11689,0,11689
1649,Emina Cranberry Juice Face Mask 60 ml ,4935,0,4935
1650,Emina Avocado Honey Face Mask 60 ml ,36,0,36
1651,MAKE OVER Silky Smooth Translucent Powder 06 Buttermilk 35 g,16,0,16
1652,MAKE OVER Silky Smooth Translucent Powder 07 Vanilla 35 g,1,0,1
1668,Wardah Lipstick Longlasting 17 Passionate Red 2.3 g,235,0,235
1673,MAKE OVER Powerstay Precision Liquid Liner Jet Black 2.7 g,608,0,608
1678,Emina Creamatte 13 Beet Bites 5.5 gr,65,0,65
1689,Wardah Instaperfect MATTE FIT Powder Foundation 13. Beige 13 g,5,0,5
1692,Wardah Instaperfect GLOSS CHIC Lip Crayon 01 Rhythm 2.7 g,10,0,10
1694,Wardah Instaperfect GLOSS CHIC Lip Crayon 03 Mind 2.7 g,61,0,61
1699,Wardah Instaperfect MATTECENTRIC Lip Crayon 05 Sense 3 g,5,0,5
1700,Wardah Instaperfect MATTECENTRIC Lip Crayon 06 Soul 3 g,2,0,2
1705,Wardah Hair Fall Treatment Conditioner 170 ml (Pc(s)),767,0,767
1706,Wardah Nutri Shine Conditioner 170 ml (Pc(s)),672,0,672
1707,Wardah EyeXpert Eyebrow Kit 3 g (Pc(s)),7060,0,7060
1753,Wardah Instaperfect MATTESETTER Lip Matte Paint 02. DEAR 5.5 g,11,0,11
1755,Wardah Instaperfect MATTESETTER Lip Matte Paint 04. VIBE 5.5 g,11,0,11
1759,Wardah Instaperfect MINERALIGHT MATTE BB Cushion 13. BEIGE 15 g,2864,0,2864
1761,Wardah Instaperfect CITY BLUSH Blusher Click 01. Bliss 5.6 g,9889,0,9889
1762,Wardah Instaperfect CITY BLUSH Blusher Click 02. Adore 5.6 g,11101,0,11101
1763,MAKE OVER Riche Glow Face Highlighter 13 g,1611,0,1611
1770,MAKE OVER Lip Amplify Contour Liner 01 Exposed 0.2 g,4486,0,4486
1771,MAKE OVER Lip Amplify Contour Liner 02 Flatter 0.2 g,4880,0,4880
1774,MAKE OVER Lip Amplify Contour Liner 05 Pin Up 0.2 g,5078,0,5078
1775,Wardah Scentsation Bliss Body Mist 100 ml (Pc(s)),9802,0,9802
1776,Wardah Scentsation Joyful Body Mist 100 ml (Pc(s)),8986,0,8986
1777,Wardah Scentsation Peaceful Body Mist 100 ml (Pc(s)),13159,0,13159
1778,Wardah Scentsation Passion Body Mist 100 ml (Pc(s)),6640,0,6640
1779,Wardah Scentsation Bliss Eau De Toilette 35 ml (Pc(s)),7440,0,7440
1780,Wardah Scentsation Joyful Eau De Toilette 35 ml (Pc(s)),16,0,16
1781,Wardah Scentsation Peaceful Eau De Toilette 35 ml (Pc(s)),6040,0,6040
1782,Wardah Scentsation Passion Eau De Toilette 35 ml (Pc(s)),3079,0,3079
1793,Emina Masquerade Face Mask Rice 23 g,42042,0,42042
1794,Emina Masquerade Face Mask Pomegranate 23 g,76681,0,76681
1797,Emina Masquerade Face Mask Tea Tree Oil 23 g,79779,0,79779
1803,Wardah Instaperfect HYPERGETIC Precise Black Liner 1 g,2167,0,2167
1804,Emina Lip Tint Eraser 10 ml,61,0,61
1811,"Malaysia Wardah Double Function Kit 4,5 gr",84,0,84
1839,Emina Bare With Me Mineral Cushion 01 Light 15 g,21,0,21
1840,Emina Bare With Me Mineral Cushion 02 Natural 15 g,1451,0,1451
1841,Emina Bare With Me Mineral Cushion 03 Caramel 15 g,27,0,27
1842,Wardah Instaperfect SPOTLIGHT Chromatic Eye Palette 10 g,45,0,45
1843,Emina Micellar Water Drop Cleanser – Bright Stuff 100 ml,17,0,17
1858,Wardah Instaperfect MATTETITUDE Matte Stain Lipstick 04. BUZZ 3.5 g,7,0,7
1880,Emina Bright Stuff Moisturizing Cream 20 ml,57588,0,57588
1881,Emina Bright Stuff Face Wash 50 ml,19079,1,19078
1883,Wardah Scentsation Purity Body Mist 100 ml (Pc(s)),4148,0,4148
1884,Wardah Scentsation Purity Eau De Toilette 35 ml (Pc(s)),2016,0,2016
1887,Emina Ms. Pimple Acne Solution Spot Gel 15 ml,1685,0,1685
1888,Emina Bare With Me Mineral Loose Powder 01 Fair 8 g,2091,0,2091
1889,Emina Bare With Me Mineral Loose Powder 02 Light Beige 8 g,8,0,8
1890,Emina Bare With Me Mineral Loose Powder 03 Amber 8 g,53,0,53
1891,Emina Bare With Me Mineral Loose Powder 04 Ebony 8 g,60,0,60
1894,Wardah Perfect Bright Tone Up Cream 20 ml,34,0,34
1895,Emina Daily Matte Loose Powder 01 Light Beige 20 g,5140,0,5140
1896,Emina Daily Matte Loose Powder 02 Natural Beige 20 g,824,0,824
1909,Emina Ms. Pimple Acne Solution Moisturizing Gel 20 ml,18939,0,18939
1911,Wardah Instaperfect BROWFESSIONAL 3D Brow Mascara 01. BROWN 5.5 g,140,0,140
1912,Wardah Instaperfect BROWFESSIONAL 3D Brow Mascara 02. DEEP GREY 5.5 g,471,0,471
1913,Emina Ms. Pimple Acne Solution Face Wash 50 ml,47508,0,47508
1916,Emina Lip Cushion 01. Let It Peach 9 g,3,0,3
1917,Emina Lip Cushion 02. Be Cherry 9 g,511,0,511
1918,MAKE OVER Shimmering Powder Bronzed 13 gr,1,0,1
1920,MAKE OVER Shimmering Powder Goldinx 13 gr,1,0,1
1922,MAKE OVER Powerstay Ultra Glow Highlighter 3 x 3.5 g ,14,0,14
