Code,Product,Quantity on Hand,Reserved,Available
00004,Acne Perfecting Moisurizer Gel Wardah 40 ml (Pc(s)),7.0,0.0,7.0
00009,Wardah Roll On For Her 60 ml,4047.0,510.0,3537.0
00011,Wardah C-defense DD Cream Light 20 ml (Pc(s)),22536.0,4284.0,18252.0
00012,Wardah C-defense DD Cream Natural 20 ml (Pc(s)),40356.0,0.0,40356.0
00013,Wardah C-defense Serum 17 ml (Pc(s)),12403.0,330.0,12073.0
00041,"Wardah Lipstick Exclusive 36 Sugary Pink 3,8 gr",2.0,0.0,2.0
00059,Wardah Exclusive Liquid Foundation 04 Natural 20 ml,1.0,0.0,1.0
00076,Wardah EyeXpert Optimum Hi-Black Liner 1 gr (Pc(s)),549.0,0.0,549.0
00077,Wardah EyeXpert Perfectcurl Mascara 7 gr (Pc(s)),40836.0,1584.0,39252.0
00079,"Wardah Eyexpert Staylast Liquid Eyeliner 3,5 gr (Pc(s))",29700.0,720.0,28980.0
00080,Wardah Lightening BB Cream Light 15 ml (pc(s)),11237.0,3456.0,7781.0
00082,Wardah Lightening BB Cream Natural 15 ml (pc(s)),56784.0,5184.0,51600.0
00095,Wardah Lightening Milk Cleanser 150 ml,16.0,0.0,16.0
00117,Wardah Blush On A 4 gr,9.0,0.0,9.0
00118,Wardah Blush On B 4 gr,56.0,0.0,56.0
00119,Wardah Blush On C 4 gr,5397.0,480.0,4917.0
00120,Wardah Blush On D 4 gr,88.0,0.0,88.0
00125,"Wardah Double Function Kit 4,5 gr",9.0,0.0,9.0
00126,Wardah Everyday BB Cream Light 15 ml (pc(s)),20136.0,864.0,19272.0
00127,Wardah Everyday BB Cream Light 30 ml (Pc(s)),13.0,0.0,13.0
00128,Wardah Everyday BB Cream Natural 15 ml (Pc(s)),57360.0,11760.0,45600.0
00129,Wardah Everyday BB Cream Natural 30 ml (Pc(s)),12.0,0.0,12.0
00133,"Wardah Evd Lum Creamy Foundation Extra Cover 04 Natural 8,5 g (Pc(s))",28.0,0.0,28.0
00135,Wardah Evd Lum Creamy Foundation Light Feel 02 Light Beige 11 g (Pc(s)),20.0,0.0,20.0
00138,Wardah Evd Lum Face Powder 01 Light Beige 30 g (Pc(s)),5478.0,480.0,4998.0
00139,Wardah Evd Lum Face Powder 02 Beige 30 g (Pc(s)),15686.0,240.0,15446.0
00140,Wardah Evd Lum Face Powder 03 Ivory 30 g (Pc(s)),6321.0,192.0,6129.0
00141,Wardah Evd Lum Face Powder 04 Natural 30 g (Pc(s)),10588.0,192.0,10396.0
00146,Wardah Evd Lum Two Way Cake 01 Light Beige 12 g (Pc(s)),4.0,0.0,4.0
00147,Wardah Evd Lum Two Way Cake 02 Beige 12 g (Pc(s)),37.0,0.0,37.0
00148,Wardah Evd Lum Two Way Cake 03 Ivory 12 g (Pc(s)),24.0,0.0,24.0
00149,Wardah Evd Lum Two Way Cake 04 Light Ivory 12 g (Pc(s)),185.0,36.0,149.0
00174,Wardah Lip Palette Pinky Peach 10 g (pc(s)),78.0,78.0,0.0
00217,Wardah Refill Evd Lum Two Way Cake 01 Light Beige 12 g (Pc(s)),1380.0,288.0,1092.0
00218,Wardah Refill Evd Lum Two Way Cake 02 Beige 12 g (Pc(s)),438.0,0.0,438.0
00219,Wardah Refill Evd Lum Two Way Cake 03 Ivory 12 g (Pc(s)),169.0,0.0,169.0
00220,Wardah Refill Evd Lum Two Way Cake 04 Light Ivory 12 g (Pc(s)),142.0,0.0,142.0
00264,Wardah Creamy Body Butter With Lavender & Ginger 50 ml (Pc(s)),20.0,0.0,20.0
00265,Wardah Creamy Body Butter With Milk & Pearl 50 ml (Pc(s)),24.0,0.0,24.0
00266,Wardah Creamy Body Butter With Olive 50 ml (pc(s)),84.0,0.0,84.0
00267,Wardah Creamy Body Butter With Passion Fruit 50 ml (Pc(s)),4.0,0.0,4.0
00268,Wardah Creamy Body Butter With Rose 50 ml (pc(s)),24.0,0.0,24.0
00269,Wardah Creamy Body Butter With Strawberry 50 ml (Pc(s)),15.0,0.0,15.0
00276,Wardah Creamy Body Butter With Lavender & Ginger 150 ml (Pc(s)),12.0,0.0,12.0
00278,Wardah Creamy Body Butter With Olive 150 ml (Pc(s)),2892.0,0.0,2892.0
00279,Wardah Creamy Body Butter With Passion Fruit 150 ml (Pc(s)),299.0,36.0,263.0
00282,Wardah Olive Oil For Massage 150 ml,1848.0,144.0,1704.0
00283,Wardah Pure Olive Oil 50 ml,6197.0,140.0,6057.0
00284,Wardah Soft Body Scrub With Olive 150 ml (Pc(s)),75.0,0.0,75.0
00285,Wardah Soft Body Scrub With Olive 240 ml (Pc(s)),1032.0,0.0,1032.0
00286,Wardah Soft Body Scrub With Passion Fruit 150 ml (Pc(s)),276.0,24.0,252.0
00287,Wardah Soft Body Scrub With Strawberry 150 ml (Pc(s)),600.0,12.0,588.0
00289,Wardah White Secret Day Cream 17 ml (pc(s)),93.0,0.0,93.0
00294,Wardah White Secret Facial Wash with AHA 100 ml (Pc(s)),3.0,0.0,3.0
00297,Wardah White Secret Night Cream 30 gr (Pc(s)),863.0,0.0,863.0
00299,Wardah White Secret Exfoliating Scrub 50 ml (Pc(s)),1476.0,0.0,1476.0
00301,"Hair Tonic Ginseng, 200 ml",9627.0,0.0,9627.0
00303,"Hair Tonic Ginseng, 450 ml",2060.0,0.0,2060.0
00304,"Hair Tonic Ginseng, 2 L",8.0,0.0,8.0
00305,"Hair Tonic Normal Hair (Yellow), 200 ml",1632.0,0.0,1632.0
00307,"Hair Tonic Normal Hair (Yellow), 450 ml",214.0,0.0,214.0
00309,"Hair Tonic Normal to Oily Hair (Green), 200 ml",19255.0,0.0,19255.0
00310,"Hair Tonic Normal to Oily Hair (Green), 200 mld",10.0,0.0,10.0
00311,"Hair Tonic Normal to Oily Hair (Green), 450 ml",1988.0,0.0,1988.0
00312,"Hair Tonic Normal to Oily Hair (Green), 2 L",606.0,0.0,606.0
00314,Putri Natural Candlenut Oil 100 ML (Pc(s)),81.0,0.0,81.0
00315,Putri Natural Creambath Aloe Vera 240 ML (Pc(s)),12.0,0.0,12.0
00316,Putri Natural Creambath Aloe Vera 720 ML (Pc(s)),45.0,0.0,45.0
00317,Putri Natural Creambath Avocado 240 ML (Pc(s)),24.0,0.0,24.0
00323,Putri Natural Creambath Candlenut 240 ML (Pc(s)),12.0,0.0,12.0
00324,Putri Natural Creambath Candlenut 720 ML (Pc(s)),156.0,0.0,156.0
00330,Putri Platinum Deep Moisturizer Spray 200 ML (Pc(s)),70.0,0.0,70.0
00334,Putri Platinum Neutralizer Step 2 720 ML (Pc(s)),2280.0,0.0,2280.0
00336,Putri Platinum Pustreite Step 1 720 ML (Pc(s)),1140.0,0.0,1140.0
00339,Putri Cold Wave 450 ML (Pc(s)),160.0,0.0,160.0
00343,Putri Neutralizer Lotion 450 ML (Pc(s)),6.0,0.0,6.0
00347,Putri Pustreite Step 1 720 ML (Pc(s)),1347.0,0.0,1347.0
00349,Putri Pustreite Step 2 720 ML (Pc(s)),6.0,0.0,6.0
00350,Putri Pure Clean Hair Conditioner Apple 200 ML (Pc(s)),6095.0,0.0,6095.0
00351,Putri Pure Clean Hair Conditioner Apple 450 ML (Pc(s)),303.0,0.0,303.0
00353,Putri Pure Clean Hair Conditioner Apple 5 L (Pc(s)),747.0,0.0,747.0
00354,Putri Pure Clean Hair Conditioner Apple 20 L (Pc(s)),122.0,0.0,122.0
00355,Putri Pure Clean Hair Conditioner Floral 200 ML (Pc(s)),264.0,0.0,264.0
00356,Putri Pure Clean Hair Conditioner Floral 450 ML (Pc(s)),1496.0,0.0,1496.0
00357,Putri Pure Clean Hair Conditioner Floral 2 L (Pc(s)),27.0,0.0,27.0
00360,Putri Pure Clean Shampoo Apple 200 ML (Pc(s)),6024.0,0.0,6024.0
00361,Putri Pure Clean Shampoo Apple 450 ML (Pc(s)),1327.0,0.0,1327.0
00362,Putri Pure Clean Shampoo Apple 2 L (Pc(s)),1.0,0.0,1.0
00365,Putri Pure Clean Shampoo Lemon 200 ML (Pc(s)),300.0,0.0,300.0
00366,Putri Pure Clean Shampoo Lemon 450 ML (Pc(s)),900.0,0.0,900.0
00368,Putri Pure Clean Shampoo Lemon 5 L (Pc(s)),3.0,0.0,3.0
00370,Putri Shampoo Ginseng 200 ML (Pc(s)),837.0,0.0,837.0
00374,Putri SPA Series Relaxing Creambath 720 ml (pc(s)),1.0,0.0,1.0
00375,Putri SPA Series Hair Mask 240 ml (Pc(s)),1.0,0.0,1.0
00376,Putri SPA Series Hair Mask 720 ml (pc(s)),4.0,0.0,4.0
00378,"Hair Tonic SPA Energizing Lemon, 450 ml",192.0,0.0,192.0
00379,"Hair Tonic SPA Relaxing Lavender, 200 ml",202.0,0.0,202.0
00381,Putri Massage Cream 1 KG (Pc(s)),249.0,0.0,249.0
00382,Putri Olive Body Scrub 150 ML (Pc(s)),30.0,0.0,30.0
00384,Putri Olive Body Scrub 720 ML (Pc(s)),4.0,0.0,4.0
00388,Putri SPA Energizing Shampoo (Lemon) 200 ML (Pc(s)),7.0,0.0,7.0
00389,Putri SPA Energizing Shampoo (Lemon) 450 ML (Pc(s)),7.0,0.0,7.0
00392,Putri Hair Spray Non Aerosol Normal (Biru) 200 ML (Pc(s)),72.0,0.0,72.0
00394,Putri Hair Spray Non Aerosol Normal (Biru) 450 ML (Pc(s)),128.0,0.0,128.0
00395,Putri Hair Spray Non Aerosol Strong (Hijau) 200 ML (Pc(s)),516.0,0.0,516.0
00397,Putri Hair Spray Non Aerosol Strong (Hijau) 450 ML (Pc(s)),180.0,0.0,180.0
00398,Putri Styling Glaze 200 ML (Pc(s)),35.0,0.0,35.0
00400,Putri Wet Jelly 100 ML (Pc(s)),20.0,0.0,20.0
00514,MAKE OVER Corrective Base Make Up 02 Greenish 40 ml (Pc(s)),0.0,0.0,0.0
00515,MAKE OVER Hydration Serum 33 ml (Pc(s)),1062.0,340.0,722.0
00517,MAKE OVER Face Contour Kit 14 g (Pc(s)),1440.0,240.0,1200.0
00518,MAKE OVER Perfect Cover Creamy Foundation 01 Rich Almond 12 g (Pc(s)),0.0,0.0,0.0
00524,MAKE OVER Perfect Cover Creamy Foundation 07 Frosted White 12 g (Pc(s)),0.0,0.0,0.0
00526,MAKE OVER Ultra Cover Liquid Matt Foundation 01 Ochre 33 ml (Pc(s)),2327.0,0.0,2327.0
00527,MAKE OVER Ultra Cover Liquid Matt Foundation 02 Pink Shade 33 ml (pc(s)),833.0,40.0,793.0
00528,MAKE OVER Ultra Cover Liquid Matt Foundation 03 Nude Silk 33 ml (pc(s)),160.0,0.0,160.0
00529,MAKE OVER Ultra Cover Liquid Matt Foundation 04 Amber Rose 33 ml (Pc(s)),416.0,40.0,376.0
00530,MAKE OVER Ultra Cover Liquid Matt Foundation 05 Velvet Nude 33 ml (pc(s)),2596.0,140.0,2456.0
00531,MAKE OVER Ultra Cover Liquid Matt Foundation 06 Beige Blast 33 ml (pc(s)),11.0,0.0,11.0
00533,Make Over Ultra Cover Liquid Matt Foundation 08 Pearl 33 ml (Pc(s)),20.0,20.0,0.0
00534,MAKE OVER Ultra Cover Liquid Matt Foundation 09 Crème Rose 33 ml (pc(s)),13.0,0.0,13.0
00535,"Perfect Cover TWC 01 Lace, 14 gr",10.0,0.0,10.0
00537,"Perfect Cover TWC 03 Maple, 14 gr",7.0,0.0,7.0
00538,"Perfect Cover TWC 04 Desert, 14 gr",8.0,0.0,8.0
00551,"Refill Perfect Cov. TWC 08 Honey, 14 gr",9.0,0.0,9.0
00557,MAKE OVER Silky Smooth Translucent Powder 01 Porcelain 35 g (Pc(s)),2849.0,0.0,2849.0
00558,MAKE OVER Silky Smooth Translucent Powder 02 Rosy 35 g (Pc(s)),1224.0,34.0,1190.0
00560,MAKE OVER Silky Smooth Translucent Powder 04 Toffee 35 g (Pc(s)),510.0,34.0,476.0
00561,MAKE OVER Silky Smooth Translucent Powder 05 Snow 35 g (Pc(s)),367.0,34.0,333.0
00584,MAKE OVER Powder Eye Shadow Frozen Pink 2 g (Pc(s)),240.0,0.0,240.0
00585,MAKE OVER Powder Eye Shadow Gold Knight 2 g (Pc(s)),102.0,51.0,51.0
00586,MAKE OVER Powder Eye Shadow Golden Attack 2 g (Pc(s)),91.0,6.0,85.0
00601,"MAKE OVER SGES Brown Vegas Refill Pack 3,5 g (Pc(s))",17.0,0.0,17.0
00622,MAKE OVER Sparkling Powder Silver 2 g (Pc(s)),2.0,0.0,2.0
00623,MAKE OVER Trivia Eye Shadow Black Goddiva 6 g (Pc(s)),1.0,0.0,1.0
00629,MAKE OVER Trivia Eye Shadow Skycrapping Blue 6 g (Pc(s)),1.0,0.0,1.0
00635,MAKE OVER Trivia Eye Shadow Dolly Crush 6 g (Pc(s)),5.0,0.0,5.0
00636,MAKE OVER Trivia Eye Shadow Magical Fairy Tale 6 g (Pc(s)),185.0,0.0,185.0
00637,"MAKE OVER Eyebrow Pencil Black Lines 1,14 g (Pc(s))",9663.0,320.0,9343.0
00638,"MAKE OVER Eyebrow Pencil Brown To Earth 1,14 g (Pc(s))",286.0,0.0,286.0
00640,"MAKE OVER Eye Liner Pencil Black Jack 1,2 g (Pc(s))",18352.0,47.0,18305.0
00641,"MAKE OVER Eye Liner Pencil Brown Latte 1,2 g (Pc(s))",11111.0,108.0,11003.0
00642,"MAKE OVER Eye Liner Pencil Navy Blue 1,2 g (Pc(s))",3618.0,41.0,3577.0
00643,"MAKE OVER Eye Liner Pencil White Techno 1,2 g (Pc(s))",4201.0,405.0,3796.0
00649,"MAKE OVER Eye Liner Pencil Silver Lines 1,2 g (Pc(s))",4528.0,110.0,4418.0
00650,"MAKE OVER Eye Liner Pencil Nude Sleek 1,2 g (Pc(s))",3077.0,50.0,3027.0
00652,MAKE OVER Eye Liner Pencil Package Black Jack (Pc(s)),953.0,153.0,800.0
00656,MAKE OVER BO Single 01 Pink Fantasist 6 g (Pc(s)),126.0,36.0,90.0
00658,MAKE OVER BO Single 03 Promiscious Peach 6g (Pc(s)),2973.0,72.0,2901.0
00661,MAKE OVER BO Single 06 Caribbean Sunset 6 g (Pc(s)),40.0,0.0,40.0
00662,MAKE OVER BO Single 07 Scarlet Sheen 6 g (Pc(s)),23.0,0.0,23.0
00663,MAKE OVER BO Single 08 Cruise Coral 6 g (Pc(s)),36.0,0.0,36.0
00664,MAKE OVER BO Single 09 Summer Twist 6 g (Pc(s)),30.0,0.0,30.0
00665,"MAKE OVER BO 01 Pink Fantasist Refill Pack 3,5 g (pc(s))",190.0,18.0,172.0
00667,"MAKE OVER BO 03 Promiscious Peach Refill Pack 3,5 g (Pc(s))",33.0,0.0,33.0
00673,MAKE OVER BO 09 Summer Twist Refill Pack 3.5 g (Pc(s)),379.0,6.0,373.0
00674,MAKE OVER Cheek Marbles 20 g (Pc(s)),14.0,0.0,14.0
00675,"MAKE OVER Perfect Shade Blush On Palette 8X3,5 g (Pc(s))",2.0,0.0,2.0
00691,"MAKE OVER Lip Color Palette Peplum Pink 02 5x1,7 g (Pc(s))",0.0,0.0,0.0
00748,"MAKE OVER Lipbalm Lip Nutrition Melon Crazy 3,8 g (Pc(s))",219.0,3.0,216.0
00758,MAKE OVER Make Up Remover 100 ml (Pc(s)),1866.0,72.0,1794.0
00759,MAKE OVER Toner 100 ml (Pc(s)),2.0,0.0,2.0
00764,MAKE OVER Small Sharpener (Pc(s)),598.0,160.0,438.0
00775,Emina Cheek Lit Cream Blush Pink 10 ml (Pc(s)),35.0,0.0,35.0
00776,Emina Cheek Lit Cream Blush Peach 10 ml (Pc(s)),40.0,0.0,40.0
00778,Emina Cheek Lit Pressed Blush Cherry Blossoms 3.5 gr (Pc(s)),2.0,0.0,2.0
00779,Emina Cheek Lit Pressed Blush Cotton Candy 3.5 gr (Pc(s)),37.0,0.0,37.0
00780,Emina Cheek Lit Pressed Blush Marshmallow Lady 3.5 gr (Pc(s)),7439.0,720.0,6719.0
00781,Emina Cheek Lit Pressed Blush Sugarcane 3.5 gr (Pc(s)),874.0,0.0,874.0
00783,Emina City Chic CC Cake Meringue 12 gr (Pc(s)),11.0,0.0,11.0
00785,Emina City Chic CC Cake Butterscotch 12 gr (Pc(s)),20.0,0.0,20.0
00794,Emina Liquid Lip Shine Wineberry 4.5 ml (Pc(s)),22.0,0.0,22.0
00795,Emina Liquid Lip Shine Carnation Pink 4.5 ml (Pc(s)),1.0,0.0,1.0
00796,Emina Liquid Lip Shine Buttery Nude 4.5 ml (Pc(s)),208.0,120.0,88.0
00810,Emina Pop Rouge Pressed Eye Shadow Blue 3.3 gr (Pc(s)),108.0,0.0,108.0
00811,Emina Pop Rouge Pressed Eye Shadow Gelato 3.3 gr (Pc(s)),36.0,0.0,36.0
00814,Emina Pop Rouge Pressed Eye Shadow Nude 3.3 gr (Pc(s)),45.0,0.0,45.0
00816,Emina Eye Do! Pencil Eye Liner Brown 1 gr (Pc(s)),31.0,0.0,31.0
00822,Emina Star Lash Aqua Mascara 5 gr (Pc(s)),358.0,0.0,358.0
00824,Emina Double Agent Eyebrow Black 0.3 gr (Pc(s)),405.0,0.0,405.0
00825,Emina Double Agent Eyebrow Brown 0.3 gr (Pc(s)),5211.0,105.0,5106.0
00827,Emina Eye Do! Crayon Pour Les Yeux Black 0.2 gr (Pc(s)),5109.0,360.0,4749.0
00886,MAKE OVER Perfect Cover TWC 01 Lace 12 g (Pc(s)),754.0,120.0,634.0
00887,MAKE OVER Perfect Cover TWC 02 Coral 12 g (Pc(s)),1327.0,96.0,1231.0
00888,MAKE OVER Perfect Cover TWC 03 Maple 12 g (Pc(s)),1728.0,216.0,1512.0
00889,MAKE OVER Perfect Cover TWC 04 Desert 12 g (Pc(s)),1814.0,0.0,1814.0
00890,MAKE OVER Perfect Cover TWC 05 Cinnamon 12 g (Pc(s)),1705.0,216.0,1489.0
00891,MAKE OVER Perfect Cover TWC 07 Espresso 12 g (Pc(s)),8.0,0.0,8.0
00892,MAKE OVER Perfect Cover TWC 06 Cappuccino 12 g (Pc(s)),285.0,51.0,234.0
00893,MAKE OVER Perfect Cover Refill TWC 01 Lace 12 g (Pc(s)),2353.0,288.0,2065.0
00894,MAKE OVER Perfect Cover Refill TWC 02 Coral 12 g (Pc(s)),1489.0,504.0,985.0
00896,MAKE OVER Perfect Cover Refill TWC 04 Desert 12 g (Pc(s)),2.0,0.0,2.0
00897,MAKE OVER Perfect Cover Refill TWC 05 Cinnamon 12 g (Pc(s)),1878.0,153.0,1725.0
00900,MAKE OVER Perfect Cover TWC 08 Honey 12 g (Pc(s)),578.0,0.0,578.0
00901,MAKE OVER Perfect Cover Refill TWC 08 Honey 12 g (Pc(s)),3871.0,216.0,3655.0
00902,Wardah Eye Brow Black,35.0,10.0,25.0
00903,Wardah Eye Brow Brown,6.0,0.0,6.0
00927,"Wardah Eye Shadow I 3,3 gr (pc(s))",120.0,120.0,0.0
00928,"Wardah Eye Shadow J 3,3 gr (pc(s))",39.0,0.0,39.0
00930,"Wardah Eye Shadow L 3,3 gr (pc(s))",45.0,0.0,45.0
00938,"Wardah Eye Shadow F 3,3 gr (pc(s))",37.0,0.0,37.0
00939,"Wardah Eye Shadow G 3,3 gr (pc(s))",105.0,0.0,105.0
00941,"Wardah EyeXpert Eyeshadow Passionate 3,3 gr",2039.0,720.0,1319.0
00942,Wardah Exclusive Matte Lip Cream 01 Red-dicted 4 gr (Pc(s)),7232.0,576.0,6656.0
00943,Wardah Exclusive Matte Lip Cream 02 Fuschionately 4 gr (Pc(s)),332.0,144.0,188.0
00944,Wardah Exclusive Matte Lip Cream 03 See You Latte 4 gr (Pc(s)),19652.0,144.0,19508.0
00945,Wardah Exclusive Matte Lip Cream 04 Pink Me 4 gr (Pc(s)),10315.0,720.0,9595.0
00946,Wardah Exclusive Matte Lip Cream 05 Speachless 4 gr (Pc(s)),36080.0,144.0,35936.0
00947,Wardah Exclusive Matte Lip Cream 06 Feeling Red 4 gr (Pc(s)),14724.0,0.0,14724.0
00948,Wardah Eye Liner Black,110254.0,360.0,109894.0
00957,Emina Sugar Rush Lip Scrub 4.2 gr (Pc(s)),8640.0,1296.0,7344.0
00980,"MAKE OVER Intense Matte Lip Cream 002 Heiress 6,5 g (Pc(s))",334.0,0.0,334.0
00981,"MAKE OVER Intense Matte Lip Cream 003 Secret 6,5 g (Pc(s))",192.0,0.0,192.0
00982,"MAKE OVER Intense Matte Lip Cream 004 Vanity 6,5 g (Pc(s))",2076.0,96.0,1980.0
00983,"MAKE OVER Intense Matte Lip Cream 005 Impulse 6,5 g (Pc(s))",69.0,0.0,69.0
00985,"MAKE OVER Intense Matte Lip Cream 007 Scarlet 6,5 g (Pc(s))",2021.0,492.0,1529.0
00987,MAKE OVER BO Single 10 Passion Pink 6 g (Pc(s)),171.0,0.0,171.0
01014,Emina Beauty Bliss BB Cream Caramel 20 ml (Pc(s)),2.0,0.0,2.0
01016,Emina Dirt-less In Sight Make UP Remover 50 ml (Pc(s)),178.0,0.0,178.0
01018,Emina Top Secret Eyebrow 2.9 gr (Pc(s)),93.0,0.0,93.0
01021,Emina Moist In a Bottle 50 ml (Pc(s)),6426.0,112.0,6314.0
01039,Emina Creamy Milk Cleansing Lotion 50 ml (Pc(s)),2634.0,112.0,2522.0
01041,Wardah C-Defense Face Mist 55 ml (pc(s)),32116.0,520.0,31596.0
01042,Emina Smoochies Lip Balm Cucumber Juice 3.7 gr (pc(s)),11.0,0.0,11.0
01045,Emina Green Tea Latte Face Mask 60 ml (Pc(s)),12.0,0.0,12.0
01051,MAKE OVER TWC Palette 3X12 g (Pc(s)),8.0,0.0,8.0
01057,Wardah Exclusive Matte Lip Cream 08 Pinkcredible 4 gr (Pc(S)),25164.0,576.0,24588.0
01065,Wardah Exclusive Matte Lip Cream 07 Hello Ruby 4 gr (Pc(s)),456.0,144.0,312.0
01075,Wardah Exclusive Matte Lip Cream 09 Mauve On 4 gr (Pc(S)),21322.0,432.0,20890.0
01076,Wardah Exclusive Matte Lip Cream 10 Berry Pretty 4 gr (Pc(s)),280.0,0.0,280.0
01077,Wardah Exclusive Matte Lip Cream 11 Oh So Nude 4 gr (Pc(s)),2880.0,144.0,2736.0
01078,Wardah Exclusive Matte Lip Cream 12 Plum It Up 4 gr (Pc(s)),24183.0,144.0,24039.0
01081,Emina Creamatte 02 Fuzzy Wuzzy 5.5 gr (Pc(s)),2572.0,288.0,2284.0
01100,Emina Creamatte 01 Chocolava 5.5 gr (Pc(s)),84.0,0.0,84.0
01101,Emina Creamatte 04 Frostbite 5.5 gr (Pc(s)),36.0,24.0,12.0
01103,Emina Creamatte 06 Jelly Bean 5.5 gr (Pc(s)),1620.0,432.0,1188.0
01104,Emina Creamatte 07 Tumbleweed 5.5 gr (Pc(s)),2076.0,60.0,2016.0
01105,Wardah Lipstick Longlasting 01 Fabulous Peach 2.3 g (Pc(s)),24.0,12.0,12.0
01107,Wardah Lipstick Longlasting 03 Simply Brown 2.3 g (Pc(s)),224.0,12.0,212.0
01112,Wardah Lipstick Longlasting 08 Red Velvet 2.3 g (Pc(s)),471.0,0.0,471.0
01113,Wardah Lipstick Longlasting 09 Vibrant Red 2.3 g (Pc(s)),329.0,0.0,329.0
01114,Wardah Lipstick Longlasting 10 Stylish Mocca 2.3 g (Pc(s)),313.0,0.0,313.0
01128,Wardah Intense Matte Lipstick 10 Miss Terracotta 2.3 g (Pc(s)),5.0,0.0,5.0
01129,Wardah Intense Matte Lipstick 11 Choco Town 2.3 g (Pc(s)),4.0,0.0,4.0
01131,MAKE OVER Ultra Hi-Matte Lipstick 001 King of Pink 2.3 g (Pc(s)),1.0,0.0,1.0
01135,MAKE OVER Ultra Hi-Matte Lipstick 005 Champagne Rose 2.3 g (Pc(s)),1.0,0.0,1.0
01136,MAKE OVER Ultra Hi-Matte Lipstick 006 Silky Blonde 2.3 g (Pc(s)),2.0,0.0,2.0
01142,MAKE OVER Ultra Hi-Matte Lipstick 012 Envy 2.3 g (Pc(s)),2.0,0.0,2.0
01150,Wardah C-Defense Energizing Creamy Wash 100 ml (Pc(s)),1686.0,210.0,1476.0
01204,MAKE OVER Velvet Mattifying Primer 20 ml,3400.0,180.0,3220.0
01211,Emina Brush Set (Set),5.0,0.0,5.0
01219,"MAKE OVER Liquid Eye Liner Black 1,7 ml (Pc(s))",9233.0,12.0,9221.0
01220,Wardah Exclusive Matte Lip Cream 13 Fruit Punch 4 gr (Pc(s)),29826.0,288.0,29538.0
01221,Wardah Exclusive Matte Lip Cream 14 My Honey Bee 4 gr (Pc(s)),84.0,0.0,84.0
01222,Wardah Exclusive Matte Lip Cream 15 Pinky Plumise 4 gr (Pc(s)),1.0,0.0,1.0
01223,Wardah Exclusive Matte Lip Cream 16 Heartbeet 4 gr (Pc(s)),36.0,0.0,36.0
01224,Wardah Exclusive Matte Lip Cream 17 Rosy Cheek 4 gr (Pc(s)),12089.0,288.0,11801.0
01225,Wardah Exclusive Matte Lip Cream 18 Saturdate Night 4 gr (Pc(s)),4893.0,576.0,4317.0
01226,Wardah C-Defense Energizing Creamy Wash 60 ml (Pc(s)),64410.0,1440.0,62970.0
01251,Emina Apricot Jam Face Scrub 60 ml (Pc(s)),3118.0,36.0,3082.0
01255,"MAKE OVER Intense Matte Lip Cream 016 Pixie 6,5 g (Pc(s))",1824.0,192.0,1632.0
01256,"MAKE OVER Intense Matte Lip Cream 017 Savvy 6,5 g (Pc(s))",159.0,12.0,147.0
01257,"MAKE OVER Intense Matte Lip Cream 018 Classic 6,5 g (Pc(s))",2016.0,0.0,2016.0
01258,"MAKE OVER Intense Matte Lip Cream 019 Vogue 6,5 g (Pc(s))",93.0,0.0,93.0
01262,MAKE OVER Eye Shadow Palette Smokey 10 g (Pc(s)),269.0,0.0,269.0
01263,MAKE OVER Eye Shadow Palette Nudes 10 g (Pc(s)),760.0,0.0,760.0
01266,Emina Grape Seed Olive Face Mask 60 ml (Pc(s)),27.0,0.0,27.0
01284,"MAKE OVER Intense Matte Lip Cream 012 Couture 6,5 g (Pc(s))",321.0,144.0,177.0
01407,Malaysia Wardah Nude Colours Eyeshadow Passionate 3.3 g (Pc(s)),120.0,0.0,120.0
01424,"MAKE OVER Intense Matte Lip Cream 010 Lux 6,5 g (Pc(s))",126.0,24.0,102.0
01439,Wardah Intense Matte Lipstick 16 Pecan Pie 2.3 g (Pc(s)),1.0,0.0,1.0
01442,Wardah Tester Intense Matte Lipstick 15 Out of Red! 2.3 g (Pc(s)),0.0,0.0,0.0
01443,Wardah Tester Intense Matte Lipstick 16 Pecan Pie 2.3 g (Pc(s)),0.0,0.0,0.0
01444,"MAKE OVER Intense Matte Lip Cream 009 Posh 6,5 g (Pc(s))",2520.0,120.0,2400.0
01445,"MAKE OVER Intense Matte Lip Cream 011 Pompous 6,5 g (Pc(s))",2064.0,0.0,2064.0
01463,MAKE OVER Micellar Water 185 ml,1260.0,21.0,1239.0
01491,"MAKE OVER Intense Matte Lip Cream 013 Dainty 6,5 g (Pc(s))",2244.0,96.0,2148.0
01492,"MAKE OVER Intense Matte Lip Cream 014 Coco 6,5 g (Pc(s))",195.0,96.0,99.0
01499,MAKE OVER Hyperblack Superstay Liner 1 g ,14648.0,576.0,14072.0
01507,MAKE OVER Brow Styler Eye Definer Mocha 0.13 g,8366.0,168.0,8198.0
01519,Wardah Perfect Bright Creamy Foam Brightening + Smoothing 100 ml (Pc(s)),27.0,0.0,27.0
01520,Wardah Perfect Bright Creamy Foam Brightening + Oil Control 60 ml (Pc(s)),0.0,0.0,0.0
01524,Wardah Perfect Bright Peel Off Mask 60 ml,3231.0,144.0,3087.0
01525,Wardah Nature Daily Mineral+ Clarifying Clay Mask 60 ml,29448.0,216.0,29232.0
01528,Wardah Everyday Fruity Sheer Lip Balm Strawberry 4 g,3666.0,192.0,3474.0
01529,Wardah Everyday Fruity Sheer Lip Balm Grape 4 g,4440.0,288.0,4152.0
01530,Wardah Everyday Moisture Lip Nutrition Honey 4 g,1.0,0.0,1.0
01531,Wardah Everyday Moisture Lip Nutrition Green Tea 4 g,2335.0,384.0,1951.0
01532,"Wardah Everyday Cheek and Lip Tint 01 Red, Set, Glow! 5.5 g",24.0,0.0,24.0
01534,Wardah Everyday Cheek and Lip Tint 03 Pink on Point! 5.5 g,7260.0,1536.0,5724.0
01554,Wardah Nature Daily Seaweed Cleansing Micellar Water 100 ml,33320.0,196.0,33124.0
01555,Wardah Nature Daily Seaweed Cleansing Micellar Water 240 ml,17758.0,180.0,17578.0
01558,MAKE OVER Color Stick Matte Crayon 103 Harper 2.6 g,30.0,0.0,30.0
01559,MAKE OVER Color Stick Matte Crayon 104 Blake 2.6 g,73.0,0.0,73.0
01560,MAKE OVER Color Stick Matte Crayon 105 Skye 2.6 g,127.0,0.0,127.0
01571,Wardah EyeXpert The Volume Expert Mascara 7 gr (Pc(s)),45031.0,720.0,44311.0
01572,Wardah Acnederm Pure Foaming Cleanser 60 ml (Pc(s)),83019.0,4680.0,78339.0
01573,Wardah Acnederm Pore Refining Toner 100 ml (Pc(s)),24408.0,340.0,24068.0
01574,Wardah Acnederm Day Moisturizer 40 ml (Pc(s)),22266.0,660.0,21606.0
01575,Wardah Acnederm Acne Spot Treatment Gel 15 ml (Pc(s)),34171.0,924.0,33247.0
01576,Wardah Acnederm Pore Blackhead Balm 20 g (Pc(s)),11356.0,48.0,11308.0
01577,Wardah Acnederm Face Powder 20 g (Pc(s)),13226.0,240.0,12986.0
01578,Wardah Acnederm Night Treatment Moisturizer 40 ml (Pc(s)),5428.0,870.0,4558.0
01579,MAKE OVER Powerstay Weightless Liquid Foundation N10 Marble 33 ml,20.0,0.0,20.0
01580,MAKE OVER Powerstay Weightless Liquid Foundation W22 Warm Ivory 33 ml,1.0,0.0,1.0
01581,MAKE OVER Powerstay Weightless Liquid Foundation C21 Pink Ivory 33 ml,25.0,0.0,25.0
01582,MAKE OVER Powerstay Weightless Liquid Foundation W33 Honey Beige 33 ml,18.0,0.0,18.0
01587,MAKE OVER Powerstay Matte Powder Foundation N10 Marble 12 g,23.0,0.0,23.0
01588,MAKE OVER Powerstay Matte Powder Foundation W22 Warm Ivory 12 g,3944.0,72.0,3872.0
01589,MAKE OVER Powerstay Matte Powder Foundation C21 Pink Ivory 12 g,1200.0,0.0,1200.0
01590,MAKE OVER Powerstay Matte Powder Foundation W33 Honey Beige 12 g,1460.0,96.0,1364.0
01591,MAKE OVER Powerstay Matte Powder Foundation N30 Natural Beige 12 g,6.0,0.0,6.0
01593,MAKE OVER Powerstay Matte Powder Foundation W41 Coral Sand 12 g,1113.0,96.0,1017.0
01595,MAKE OVER Powerstay Mattifying Transparent Powder 11 g,884.0,42.0,842.0
01606,Wardah Nature Daily Aloe Hydramild Moisturizer Cream 40 ml,17179.0,780.0,16399.0
01607,Wardah Nature Daily Witch Hazel Purifying Moisturizer Gel 40 ml ,11748.0,510.0,11238.0
01608,Wardah Nature Daily Seaweed Balancing Facial Wash 60 ml ,18766.0,252.0,18514.0
01610,Wardah Nature Daily Seaweed Balancing Facial Scrub 60 ml ,9337.0,216.0,9121.0
01615,Wardah Renew You Hydrafirm Sleeping Mask 30 g,1.0,0.0,1.0
01617,Wardah Nature Daily Aloe Hydramild Multifunction Gel 100 ml ,156.0,0.0,156.0
01619,Wardah Nature Daily Aloe Hydramild Facial Wash 60 ml ,33624.0,2412.0,31212.0
01620,Wardah Nature Daily Aloe Hydramild Facial Wash 100 ml ,10249.0,570.0,9679.0
01621,Wardah Nature Daily Mineral+ Clarifying Facial Foam 60 ml ,12178.0,180.0,11998.0
01623,MAKE OVER Cliquematte Lip Stylo 202 Hollywood 2 g,4012.0,12.0,4000.0
01624,MAKE OVER Cliquematte Lip Stylo 203 Crush 2 g,11296.0,0.0,11296.0
01626,MAKE OVER Cliquematte Lip Stylo 205 Jetsetter 2 g,5631.0,0.0,5631.0
01627,MAKE OVER Cliquematte Lip Stylo 206 Grandiose 2 g,2523.0,60.0,2463.0
01629,MAKE OVER Cliquematte Lip Stylo 208 Spotlight 2 g,2.0,0.0,2.0
01631,Wardah Nature Daily Mineral+ Clarifying Facial Foam 100 ml ,749.0,330.0,419.0
01632,Wardah Lightening Day Cream 30 g (Pc(s)),3.0,0.0,3.0
01638,Wardah Perfect Bright Moisturizer SPF 28 20 ml,288.0,288.0,0.0
01639,Emina Magic Potion 01 Scarlet 5.5 ml,24.0,0.0,24.0
01640,Emina Magic Potion 02 Sunglow 5.5 ml,8232.0,2112.0,6120.0
01641,Emina Magic Potion 03 Smitten 5.5 ml,7188.0,264.0,6924.0
01644,Emina Creamatte 08 Pumpkin Spice 5.5 gr ,288.0,0.0,288.0
01645,Emina Creamatte 09 Baby Fox 5.5 gr ,2460.0,288.0,2172.0
01646,Emina Creamatte 10 Starfish 5.5 gr ,1999.0,288.0,1711.0
01648,Emina Aqua Infused Sleeping Mask 30 g,11625.0,0.0,11625.0
01649,Emina Cranberry Juice Face Mask 60 ml ,4935.0,36.0,4899.0
01650,Emina Avocado Honey Face Mask 60 ml ,36.0,36.0,0.0
01651,MAKE OVER Silky Smooth Translucent Powder 06 Buttermilk 35 g,1614.0,238.0,1376.0
01652,MAKE OVER Silky Smooth Translucent Powder 07 Vanilla 35 g,1599.0,170.0,1429.0
01668,Wardah Lipstick Longlasting 17 Passionate Red 2.3 g,235.0,0.0,235.0
01673,MAKE OVER Powerstay Precision Liquid Liner Jet Black 2.7 g,608.0,20.0,588.0
01677,Emina Creamatte 12 Perky Plum 5.5 gr,2304.0,456.0,1848.0
01678,Emina Creamatte 13 Beet Bites 5.5 gr,65.0,12.0,53.0
01680,Emina Creamatte 15 Chocopuff 5.5 gr,2304.0,252.0,2052.0
01689,Wardah Instaperfect MATTE FIT Powder Foundation 13. Beige 13 g,5.0,0.0,5.0
01690,Wardah Instaperfect MATTE FIT Powder Foundation 14. CRÉME13 g,566.0,0.0,566.0
