Code,Product,Quantity on Hand,Reserved,Available
3662,Malaysia Wardah Crystal Secret Brightening Day Cream 30 g,7632,0,7632
3663,Malaysia Wardah Crystal Secret Bright Activating Night Cream 30 g,4464,0,4464
3664,Malaysia Wardah Crystal Secret Dark Spot & Brightening Serum 20 ml,10100,0,10100
3665,Malaysia Wardah Crystal Secret Pure Treatment Essence 100 ml,500,0,500
3668,Malaysia Wardah Crystal Secret Foaming Cleanser with Natural AHA+PHA 100 ml,14010,0,14010
3669,Malaysia Wardah Crystal Secret Exfoliating Toner with Natural AHA+PHA 125 ml,4760,0,4760
3672,Instaperfect QUICKMATTE Loose Powder 22 Light Ivory 9 g,8160,0,8160
3696,Malaysia Wardah Crystal Secret Pure Treatment Essence 30 ml,620,0,620
3707,Wardah Instaperfect BOOKMARK BROWFESSIONAL 3D Brow Mascara 01. BROWN 5.5 g,1,0,1
3710,Wardah Instaperfect BOOKMARK GLOSS CHIC Lip Crayon 02 Clue 2.7 g,8,0,8
3712,Malaysia Emina Bright Stuff Micellar Water 100 ml,3808,0,3808
3717,Tavi 5 % Natural PHA + BHA Retexture Toner 100 ml,529,0,529
3732,Wardah Renew You Facial Wash 100 ml (Pc(s)),65190,30,65160
3733,Crystallure Moisture Rich Cleansing Foam 100 ml,3000,0,3000
3734,Emina Ms. Pimple Acne Solution Exfoliating Toner 100 ml,11559,0,11559
3736,Emina Ms. Pimple Acne Solution Calming Gel 20 ml,41835,0,41835
3737,LABORE Sensitive Skin Care BiomeRepair Barrier Revive Cream 50 ml,310,0,310
3740,LABORE Sensitive Skin Care GentleBiome Mild Cleanser 100 ml,1404,0,1404
3742,LABORE Sensitive Skin Care GentleBiome Skin Nutrition Gel 50 ml,1332,0,1332
3744,LABORE Sensitive Skin Care On-The-Go Minis,1,0,1
3745,LABORE Sensitive Skin Care BiomeProtect Physical Sunscreen 10 ml,502,0,502
3746,LABORE Sensitive Skin Care BiomeRepair Barrier Revive Cream 10 ml,2074,0,2074
3747,LABORE Sensitive Skin Care GentleBiome Mild Cleanser 15 ml,4258,0,4258
3748,LABORE Sensitive Skin Care GentleBiome Mild Cleanser 225 ml,1539,0,1539
3760,MAKE OVER Hydrastay Lite Glow Cushion W12 Warm Marble 15 g,19,0,19
3761,MAKE OVER Hydrastay Lite Glow Cushion N20 Ivory 15 g,1992,0,1992
3762,MAKE OVER Hydrastay Lite Glow Cushion W21 Coral Ivory 15 g,1572,0,1572
3763,MAKE OVER Hydrastay Lite Glow Cushion C31 Pink Beige 15 g,1608,0,1608
3764,MAKE OVER Hydrastay Lite Glow Cushion W30 Creme Beige 15 g,83,0,83
3765,MAKE OVER Hydrastay Lite Glow Cushion W32 Warm Beige 15 g,2544,0,2544
3766,MAKE OVER Hydrastay Lite Glow Cushion C41 Cool Sand 15 g,143,0,143
3767,MAKE OVER Hydrastay Lite Glow Cushion N40 Sand 15 g,2469,0,2469
3768,MAKE OVER Hydrastay Lite Glow Cushion W50 Creme Tan 15 g,920,0,920
3769,MAKE OVER Hydrastay Lite Glow Cushion C51 Cool Tan 15 g,12,0,12
3770,MAKE OVER Hydrastay Lite Glow Cushion C62 Rich Cocoa 15 g,12,0,12
3774,MAKE OVER Powerstay Demi-Matte Cover Cushion W21 Coral Ivory 15 g,777,0,777
3777,MAKE OVER Powerstay Demi-Matte Cover Cushion W32 Warm Beige 15 g,42,0,42
3779,MAKE OVER Powerstay Demi-Matte Cover Cushion C41 Cool Sand 15 g,1,0,1
3780,MAKE OVER Powerstay Demi-Matte Cover Cushion W50 Creme Tan 15 g,161,0,161
3781,MAKE OVER Powerstay Demi-Matte Cover Cushion W60 Creme Cocoa 15 g,458,0,458
3782,MAKE OVER Powerstay Demi-Matte Cover Cushion C62 Rich Cocoa 15 g,960,0,960
3784,Kahf Oil and Acne Care Face Wash with Sticker Eye Catch 100 ml,132,0,132
3785,Kahf Skin Energizing and Brightening Face Wash with Sticker Eye Catch 100 ml,9,0,9
3786,Kahf Gentle Exfoliating Face Scrub with Sticker Eye Catch 100 ml,15,15,0
3799,Wardah Perfect Bright Creamy Foam Brightening + Smoothing with Hanger 6 x 20 ml,24730,0,24730
3813,Wardah Renew You Toner Essence 50 ml (Pc(s)),6900,0,6900
3814,Wardah Renew You Toner Essence 100 ml (Pc(s)),4,0,4
3815,Emina Ms. Pimple Acne Solution Face Serum 30 ml,52718,0,52718
3817,Wardah Renew You Eye Cream 10 g (Pc(s)),14846,0,14846
3818,Wardah Renew You Day Cream 30 g (Pc(s)),5712,0,5712
3832,Instaperfect Mattesetter Lip Matte Paint 10 Mosaic,3131,0,3131
3833,Instaperfect Mattesetter Lip Matte Paint 11 Kaleidoscope,11,0,11
3834,Instaperfect Mattesetter Lip Matte Paint 12 The Voyage,9,0,9
3836,Instaperfect Mattesetter Lip Matte Paint 14 Palace Queen,10,0,10
3837,Instaperfect Mattesetter Lip Matte Paint 15 1001 Nights,4303,0,4303
3840,Emina Poppin' Matte The 90's Edition 06 Roller Skate 4.5 g,426,0,426
3841,Emina Poppin' Matte The 90's Edition 07 Rubic Cubic 4.5 g,8334,0,8334
3842,Emina Poppin' Matte The 90's Edition 08 Lovely Tamagochan 4.5 g,42,0,42
3843,Emina Poppin' Matte The 90's Edition 09 Tossin' Tazos 4.5 g,11447,0,11447
3844,Emina Poppin' Matte The 90's Edition 10 Spin It Yo-yo 4.5 g,693,0,693
3886,Wardah Renew You Day Cream 9 g (Pc(s)),50340,0,50340
3893,Kahf Triple Action Oil and Comedo Defense Face Wash 100 ml,10705,0,10705
3909,Wardah Colorfit Last All Day Lip Paint 14. Royal London,12660,0,12660
3910,Wardah Colorfit Last All Day Lip Paint 15. Dazzling New York,12072,0,12072
4073,MAKE OVER Powerstay Demi-Matte Cover Cushion N10 Marble 15 g Relaunch,2,0,2
4074,MAKE OVER Powerstay Demi-Matte Cover Cushion W22 Warm Ivory 15 g Relaunch,11,0,11
4079,MAKE OVER Powerstay Demi-Matte Cover Cushion C21 Pink Ivory 15 g Relaunch,18,0,18
4080,MAKE OVER Powerstay Demi-Matte Cover Cushion W33 Honey Beige 15 g Relaunch,16,0,16
4164,Kahf Advancing Beard & Hair Serum 30 ml,48,0,48
4178,Twin Pack Malaysia Wardah Exclusive Liquid Foundation 01 Light Beige 20 ml,5941,0,5941
4179,Twin Pack Malaysia Wardah Exclusive Liquid Foundation 02 Sheer Pink 20 ml,8528,0,8528
4180,Twin Pack Malaysia Wardah Exclusive Two Way Cake 02 Light Beige 12 g,10845,0,10845
4181,Twin Pack Malaysia Wardah Exclusive Two Way Cake 04 Natural 12 g,10753,0,10753
4183,Wardah Perfect Bright Creamy Foam Brightening + Oil Control (Pc(s)) 100 ml,3798,0,3798
4196,Wardah Perfect Bright Creamy Foam Brightening + Smoothing 50 ml (Pc(s)),1656,0,1656
4197,Wardah Perfect Bright Creamy Foam Brightening + Oil Control 50 ml (Pc(s)),6,0,6
4258,Malaysia Wardah Acnederm Acne Treatment Serum 15 ml,9792,0,9792
4260,Malaysia Wardah Crystallure Moisture Rich Cleansing Foam 100 ml,1000,0,1000
4261,Malaysia Wardah Colorfit Last All Day Lip Paint 00. Alluring Jakarta,1008,0,1008
4262,Malaysia Wardah Colorfit Last All Day Lip Paint 13. Dubai Lux,1008,0,1008
4263,Malaysia Wardah Colorfit Last All Day Lip Paint 14. Royal London,1008,0,1008
4264,Malaysia Wardah Colorfit Last All Day Lip Paint 15. Dazzling New York,1008,0,1008
4265,Malaysia Wardah Colorfit Last All Day Lip Paint 16. Kuala Lumpur Joy,1008,0,1008
4266,Malaysia Wardah Colorfit Last All Day Lip Paint 17. Tokyo Breeze,1008,0,1008
4396,Make Over Big Box 2: THE ROYAL,68,0,68
4399,Instaperfect Step Up Eyetension Hampers,5,0,5
4403,Wardah Lightening Hampers Ramadan Untuk Mencerahkan,1,0,1
4418,Malaysia Emina Lip Mask Milky Matcha 9 g,2424,0,2424
4419,Malaysia Emina Lip Mask Vanilla Pretzel 9 g,3144,0,3144
4420,Malaysia Emina Lip Mask Orange Squash 9 g,1800,0,1800
4421,Malaysia Emina Watercolor Lip Serum 01 Dawn 2 g,1440,0,1440
4422,Malaysia Emina Watercolor Lip Serum 02 Mist 2 g,1440,0,1440
4423,Malaysia Emina Watercolor Lip Serum 03 Dusk 2 g,1728,0,1728
4424,Malaysia Emina Watercolor Lip Serum 04 Haze 2 g,2592,0,2592
4425,Malaysia Emina Poppin’ Matte 01 Lowkey,576,0,576
4426,Malaysia Emina Poppin’ Matte 02 To Be Honest,576,0,576
4427,Malaysia Emina Poppin’ Matte 03 Game On,576,0,576
4428,Malaysia Emina Poppin’ Matte 04 Snatched,2400,0,2400
4429,Malaysia Emina Poppin’ Matte 05 Easy Peasy,576,0,576
4432,Malaysia Emina Natura Pal Splash Serum 40 ml,7704,0,7704
4433,Malaysia Emina Natura Pal Toner Essence 100 ml,5600,0,5600
4434,Malaysia Emina Natura Pal Gel Moisturizer 20 ml,7200,0,7200
4539,Wardah Crystal Skin Package,108,0,108
4571,Malaysia Wardah Lightening Hampers Ramadan Untuk Mencerahkan,708,0,708
4575,Wardah Anti Dandruff Shampoo 170 ml,25680,0,25680
4576,Wardah Hairfall Treatment Shampoo 170 ml,10728,0,10728
4577,Wardah Colorfit Fresh Lip Ink Serum 01 Energy Shot 4 g,15191,0,15191
4578,Wardah Colorfit Fresh Lip Ink Serum 02 Smart Cookie 4 g,5041,0,5041
4579,Wardah Colorfit Fresh Lip Ink Serum 03 High Rise 4 g,16575,0,16575
4580,Wardah Colorfit Fresh Lip Ink Serum 04 Speedster 4 g,39081,0,39081
4581,Wardah Colorfit Fresh Lip Ink Serum 05 Soul Mover 4 g,22989,0,22989
4582,Wardah Colorfit Fresh Lip Ink Serum 06 Hyped Up 4 g,4565,0,4565
4583,Wardah Colorfit Fresh Lip Ink Serum 07 Busy Bee 4 g,2999,0,2999
4584,Wardah Colorfit Fresh Lip Ink Serum 08 Go Getter 4 g,1846,0,1846
4593,Wardah Nutri Shine Shampoo 170 ml,612,0,612
4594,Wardah Daily Fresh Shampoo 170 ml,1237,0,1237
4655,Malaysia Kahf Invigorating Waterfall Eau de Toilette 35 ml,176,0,176
4656,Malaysia Kahf Humbling Forest Eau de Toilette 35 ml,220,0,220
N117,Emina NFS Daily Matte Compact Powder 01 Light 4 g,2600,0,2600
N118,Emina NFS Daily Matte Compact Powder 02 Natural 4 g,2200,0,2200
N119,Emina NFS Natura Pal Splash Serum 5 ml,2016,0,2016
N12,Wardah NFS Crystal Secret Foaming Cleanser with Natural AHA+PHA 3 ml,1502,0,1502
N15,LABORE Sensitive Skin Care NFS BiomeProtect Physical Sunscreen 10 ml,151,0,151
N16,LABORE Sensitive Skin Care NFS BiomeRepair Barrier Revive Cream 10 ml,80,0,80
N17,LABORE Sensitive Skin Care NFS GentleBiome Mild Cleanser 15 ml,1180,0,1180
N34,Emina NFS Bright Stuff for Acne Prone Skin Face Wash 15 ml,28,0,28
N67,Emina NFS Sun Battle SPF 30 PA+++ 12 ml,23252,0,23252
N76,Sample Pajangan Wardah NFS UV Shield Sunscreen SPF 30,321,0,321
P1019,Wardah Tester Container Evd Lum Creamy Foundation Light Feel 04,1440,0,1440
P1505,Emina NFS Bright Stuff Face Wash 15 ml,14294,0,14294
P2028,Malaysia NFS Wardah UV Shield Aqua Fresh Essence SPF 50 5 ml,12628,0,12628
P528,Wardah Tester Hand & Body Lotion ETERNAL 200 ml (pc(s)),0,0,0
P622,Wardah Tester Container Evd Lum Face Powder 01 Light Beige 30 gr (Pc(s)),0,0,0
P623,Wardah Tester Container Evd Lum Face Powder 03 Ivory 30 gr (Pc(s)),0,0,0
P624,Wardah Tester Container Evd Lum Face Powder 04 Natural 30 gr (Pc(s)),0,0,0
P629,Wardah Tester Everyday BB Cream Light 30 ml (Pc(s)),0,0,0
P630,Wardah Tester Everyday BB Cream Natural 30 ml (Pc(s)),0,0,0
P631,Wardah Tester Lightening BB Cream Light 30 ml (Pc(s)),0,0,0
P635,Wardah Tester Container Blush On Seri C 4 gr (Pc(s)),0,0,0
P636,Wardah Tester Container Blush On Seri D 4 gr (Pc(s)),0,0,0
P655,Wardah Tester Container Evd Lum Liquid Foundation 03 Beige 40 ml (Pc(s)),0,0,0
P656,Wardah Tester Container Evd Lum Liquid Foundation 04 Natural 40 ml (Pc(s)),0,0,0
P657,Wardah Tester Container Evd Lum Liquid Foundation 01 Natural White 40 ml (Pc(s)),0,0,0
P833,Wardah Tester Lipstick Longlasting 02 Pink Sorbet 2.3 g (Pc(s)),0,0,0
P835,Wardah Tester Lipstick Longlasting 04 Antique Pink 2.3 g (Pc(s)),0,0,0
P837,Wardah Tester Lipstick Longlasting 06 Delicate Pink 2.3 g (Pc(s)),0,0,0
P838,Wardah Tester Lipstick Longlasting 07 Raspberry Hip 2.3 g (Pc(s)),0,0,0
P839,Wardah Tester Lipstick Longlasting 08 Red Velvet 2.3 g (Pc(s)),0,0,0
P840,Wardah Tester Lipstick Longlasting 09 Vibrant Red 2.3 g (Pc(s)),0,0,0
P841,Wardah Tester Lipstick Longlasting 10 Stylish Mocca 2.3 g (Pc(s)),0,0,0
P842,Wardah Tester Lipstick Longlasting 11 Cherrie Glam 2.3 g (Pc(s)),0,0,0
P848,Wardah Tester Intense Matte Lipstick 03 Peach Perfect 2.3 g (Pc(s)),0,0,0
P849,Wardah Tester Intense Matte Lipstick 04 Mauve Mellow 2.3 g (Pc(s)),0,0,0
P850,Wardah Tester Intense Matte Lipstick 05 Easy Brownie 2.3 g (Pc(s)),0,0,0
P854,Wardah Tester Intense Matte Lipstick 09 Vibrant-Red 2.3 g (Pc(s)),0,0,0
P855,Wardah Tester Intense Matte Lipstick 10 Miss Terracotta 2.3 g (Pc(s)),0,0,0
P856,Wardah Tester Intense Matte Lipstick 11 Choco Town 2.3 g (Pc(s)),0,0,0
P857,Wardah Tester Intense Matte Lipstick 12 Lady Burgundy 2.3 g (Pc(s)),0,0,0
P863,Wardah Tester White Secret Pure Treatment Essence 100 ml (Pc(s)),0,0,0
P864,Wardah Tester Renew You Treatment Essence 100 ml (Pc(s)),0,0,0
P923,Wardah Tester EyeXpert Aqua Lash Mascara 6 gr,0,0,0
P924,Wardah Tester EyeXpert Perfectcurl Mascara 7 gr,0,0,0
P931,Wardah Tester EyeXpert Eyeshadow Classic 3.3 gr,0,0,0
P932,Wardah Tester EyeXpert Eyeshadow Passionate 3.3 gr,0,0,0
P955,Wardah Tester White Secret Day Cream 30 gr (Pc(s)),0,0,0
P956,Wardah Tester Renew You Anti Aging Day Cream 30 gr (Pc(s)),0,0,0
P969,Wardah Tester Lightening BB Cake Powder 01 Light 11 gr (Pc(s)),0,0,0
P970,Wardah Tester Lightening BB Cake Powder 02 Sheer Pink 11 gr (Pc(s)),0,0,0
P971,Wardah Tester Lightening BB Cake Powder 03 Natural 11 gr (Pc(s)),0,0,0
T12,Wardah Tester Container Evd Lum Face Powder 02 Beige 30 gr (Pc(s)),0,0,0
T216,Wardah Tester Container Evd Lum Two Way Cake 01 Light Beige 12 g ,0,0,0
T217,Wardah Tester Container Evd Lum Two Way Cake 02 Beige 12 g ,0,0,0
T218,Wardah Tester Container Evd Lum Two Way Cake 03 Ivory 12 g,0,0,0
T219,Wardah Tester Container Evd Lum Two Way Cake 04 Light Ivory 12 g ,0,0,0
T228,Wardah Tester Container Lightening Two Way Cake Light Feel 01 Light Beige 12 g,0,0,0
T230,Wardah Tester Container Lightening Two Way Cake Light Feel 03 Sheer Pink 12 g,0,0,0
T232,Wardah Tester Exclusive Matte Lip Cream 13 Fruit Punch 4 gr ,0,0,0
T244,Wardah Tester Eyexpert Staylast Gel Eyeliner 2 g,0,0,0
T246,Wardah Tester Body Mist ETERNAL 200 ml (pc(s)),0,0,0
T247,Wardah Tester Body Mist FLAME 200 ml (Pc(s)),0,0,0
T248,Wardah Tester Body Mist INNOCENCE 200 ml (pc(s)),0,0,0
T249,Wardah Tester Body Mist SHINE 200 ml (pc(s)),0,0,0
T251,"Wardah Tester Eye Shadow H 3,3 gr",0,0,0
T252,"Wardah Tester Eye Shadow I 3,3 gr",0,0,0
T253,"Wardah Tester Eye Shadow J 3,3 gr",0,0,0
T254,"Wardah Tester Eye Shadow K 3,3 gr",0,0,0
T255,"Wardah Tester Eye Shadow L 3,3 gr",0,0,0
T256,"Wardah Tester Eye Shadow M 3,3 gr",0,0,0
T257,"Wardah Tester Eye Shadow N 3,3 gr",0,0,0
T258,"Wardah Tester Eye Shadow A 3,3 gr",0,0,0
T259,"Wardah Tester Eye Shadow B 3,3 gr",0,0,0
T260,"Wardah Tester Eye Shadow D 3,3 gr",0,0,0
T261,"Wardah Tester Eye Shadow E 3,3 gr",0,0,0
T262,"Wardah Tester Eye Shadow F 3,3 gr",0,0,0
T263,"Wardah Tester Eye Shadow G 3,3 gr",0,0,0
T27,"Wardah Tester Eyexpert Staylast Liquid Eyeliner 3,5 gr (Pc(s))",0,0,0
T290,Wardah Tester Exclusive Matte Lip Cream 14 My Honey Bee 4 gr,0,0,0
T293,Wardah Tester Exclusive Matte Lip Cream 17 Rosy Cheek 4 gr,0,0,0
T297,Wardah Tester EyeXpert Optimum Hi-Black Liner 1 gr (Pc(s)),0,0,0
T300,Wardah Tester EyeXpert Eye & Lip Makeup Remover 100 ml,0,0,0
T306,Wardah Tester White Secret Pure Brightening Cleanser 150 ml Pc(s)),0,0,0
T307,Wardah Tester C-Defense DD Cream Light 20 ml (Pc(s)),0,0,0
T308,Wardah Tester White Secret Exfoliating Lotion 150 ml (Pc(s)),0,0,0
T310,Wardah Tester White Secret Night Cream 30 gr (Pc(s)),0,0,0
T312,Wardah Tester C-Defense DD Cream Natural 20 ml (Pc(s)),0,0,0
T313,"Wardah Tester Eye Brow Black 1,14 gr (Pc(s))",0,0,0
T314,"Wardah Tester Eye Brow Brown 1,14 gr (Pc(s))",0,0,0
T315,"Wardah Tester Eye Liner Black 1,14 gr (Pc(s))",0,0,0
T317,"Wardah Tester Eye Shadow C 3,3 gr",0,0,0
T324,Wardah Tester Hand & Body Lotion INNOCENCE 200 ml (pc(s)),0,0,0
T537,Wardah Tester Lightening Two Way Cake Extra Cover 01 Light Beige 10 g,0,0,0
T538,Wardah Tester Lightening Two Way Cake Extra Cover 02 Golden Beige 10 g,0,0,0
T539,Wardah Tester Lightening Two Way Cake Extra Cover 03 Sheer Pink 10 g,0,0,0
T540,Wardah Tester Lightening Two Way Cake Extra Cover 04 Natural 10 g,0,0,0
T542,Wardah Tester Lightening Two Way Cake Light Feel 02 Golden Beige 12 g,0,0,0
T543,Wardah Tester Lightening Two Way Cake Light Feel 03 Sheer Pink 12 g,0,0,0
T544,Wardah Tester Lightening Two Way Cake Light Feel 04 Natural 12 g,0,0,0
T601,Wardah Tester Instaperfect GLOSS CHIC Lip Crayon 01 Rhythm 2.7 g,0,0,0
T750,TESTER Biodef Natural Protection Mint + Green Tea Body Wash 60 ml,1,0,1
T751,TESTER Biodef Natural Protection Mint + Yuzu Body Wash 60 ml,50,0,50
T85,Wardah Tester Hand & Body Lotion SHINE 200 ml (pc(s)),0,0,0
T86,Wardah Tester Hand & Body Lotion SPARKS 200 ml (pc(s)),0,0,0
TRAY-NFSPR0-MO,"Tray Set NFS Pressed Powder Make Over. PET 350mic. 166x56x12,6mm. Natural.",20000,0,20000
