DC,BRAND,CAT1,CAT4,ODOO CODE,CORPORATE CODE,BARCODE,ITEM NAME,GT PRICE,QOH,RESERVED (QTY),AVAILABLE (QTY),QOH (Rp),RESERVED (Rp),AVAILABLE (Rp),EXPIRED DATE
DC ACEH,MAKE OVER,LIP MAKE UP,MAKE OVER ULTRA HI-MATTE LIPSTICK,01138,L-UHRR008-MO2.3G,8993137696937,MAKE OVER ULTRA HI-MATTE LIPSTICK 008 RUNWAY REBEL 2.3 G (PC(S)),81981.99,1,0,1,81981.99,0,81981.99,
DC ACEH,MAKE OVER,EYE MAKE UP,MAKE OVER POWERSTAY EYE SHADOW PRIMER,02082,ES-PPR-MO,8993137701471,MAKE OVER POWERSTAY EYESHADOW PRIMER 7 G,73873.88,50,0,50,3693694,0,3693694,
DC ACEH,MAKE OVER,FACE MAKE UP,MAKE OVER POWERSTAY WEIGHTLESS LIQUID FOUNDATION,02424,F-LPWN50-MO,8993137707374,MAKE OVER POWERSTAY WEIGHTLESS LIQUID FOUNDATION N50 TAN 33 ML,145945.95,34,0,34,4962162.3,0,4962162.3,
DC ACEH,MAKE OVER,LIP MAKE UP,MAKE OVER LIP CREAM MATTE,02784,L-TSIMLCS-MO,8993137711395,MAKE OVER TITIES SAPOETRA INTENSE MATTE LIP CREAM SENNA 6.5 G,96396.4,4,0,4,385585.6,0,385585.6,
DC ACEH,MAKE OVER,EYE MAKE UP,MAKE OVER POWERSTAY EYE LINER LIQUID,01674,EL-PPLCB-MO2.7G,8993137700450,MAKE OVER POWERSTAY PRECISION LIQUID LINER COBALT BLUE 2.7 G,87387.39,18,0,18,1572973.02,0,1572973.02,
DC ACEH,MAKE OVER,LIP MAKE UP,MAKE OVER CLIQUEMATTE,01983,L-CQS209-MO2G,8993137701488,MAKE OVER CLIQUEMATTE LIP STYLO 209 ROYALE 2 G,101801.81,4,0,4,407207.24,0,407207.24,
DC ACEH,MAKE OVER,FACE MAKE UP,MAKE OVER POWERSTAY TWC,02306,TC-PMN50-MO,8993137707213,MAKE OVER POWERSTAY MATTE POWDER FOUNDATION N50 TAN 12 G,164864.87,46,0,46,7583784.02,0,7583784.02,
DC ACEH,MAKE OVER,FACE MAKE UP,MAKE OVER POWERSTAY TWC,02407,TC-PMN40-MO,8993137707763,MAKE OVER POWERSTAY MATTE POWDER FOUNDATION N40 SAND 12 G,164864.87,4,0,4,659459.48,0,659459.48,
DC ACEH,MAKE OVER,FACE MAKE UP,MAKE OVER POWERSTAY ILLUMINATOR,02400,PRM-PRI01-MO,8993137706643,MAKE OVER POWERSTAY RADIANT ILLUMINIZER LUMIERE 25 G,109909.91,14,0,14,1538738.74,0,1538738.74,
DC ACEH,MAKE OVER,FACE MAKE UP,MAKE OVER POWERSTAY WEIGHTLESS LIQUID FOUNDATION,01584,F-LPWW42-MO33ML,8993137699686,MAKE OVER POWERSTAY WEIGHTLESS LIQUID FOUNDATION W42 WARM SAND 33 ML,145945.95,1,0,1,145945.95,0,145945.95,
DC ACEH,MAKE OVER,LIP MAKE UP,MAKE OVER LIQUID LIP COLOR,00907,L-LPPI-MO5ML,8993137693370,MAKE OVER LIQUID LIP COLOR PENELOPE PINK 5 ML (PC(S)),69369.37,14,0,14,971171.18,0,971171.18,
DC ACEH,MAKE OVER,FACE MAKE UP,MAKE OVER BLUSH ON REFILL,00673,BO-SST09-MO3.5G,8993137692267,MAKE OVER BO 09 SUMMER TWIST REFILL PACK 3.5 G (PC(S)),41441.45,9,0,9,372973.05,0,372973.05,
DC ACEH,MAKE OVER,FACE MAKE UP,MAKE OVER BLUSH ON REFILL,00988,"BO-SPP10-MO3,5G",8993137693745,"MAKE OVER BO 10 PASSION PINK REFILL PACK 3,5 G (PC(S))",41441.45,20,0,20,828829,0,828829,
DC ACEH,MAKE OVER,LIP MAKE UP,MAKE OVER ULTRA SHINE LIPSTICK,00738,"L-USVB09-MO3,8G",8993137682763,"MAKE OVER ULTRA SHINE LIPSTICK 09 VENETIAN BROWN 3,8 G (PC(S))",69369.37,15,0,15,1040540.55,0,1040540.55,
DC ACEH,MAKE OVER,EYE MAKE UP,MAKE OVER POWERSTAY EYEBROW MASCARA,02022,EB-DMCC-MO,8993137702317,MAKE OVER POWERSTAY BROW DEFINER MASCARA 03 COFFEE CREAM 6.5 G,100900.91,7,0,7,706306.37,0,706306.37,
DC ACEH,MAKE OVER,LIP MAKE UP,MAKE OVER ULTRA SHINE LIPSTICK,00741,"L-USNF12-MO3,8G",8993137682794,"MAKE OVER ULTRA SHINE LIPSTICK 12 NUDIST FREAK 3,8 G (PC(S))",69369.37,2,0,2,138738.74,0,138738.74,
DC ACEH,MAKE OVER,LIP MAKE UP,MAKE OVER LIQUID LIP COLOR,00906,L-LRB-MO5ML,8993137693400,MAKE OVER LIQUID LIP COLOR RED BABYDOLL 5 ML (PC(S)),69369.37,1,0,1,69369.37,0,69369.37,
DC ACEH,WARDAH,FACE MOISTURIZER,WARDAH NATURE DAILY SHEET MASK,01972,MA-NDSGT-W,8993137702065,WARDAH NATURE DAILY SHEET MASK GREEN TEA 20 ML,14414.42,58,0,58,836036.36,0,836036.36,
DC ACEH,WARDAH,FACE MAKE UP,WARDAH LIGHTENING TWC LIGHT FEEL,02375,TC-R3LLF07-W,8993137704908,WARDAH LIGHTENING POWDER FOUNDATION LIGHT FEEL 07 HONEY BEIGE 12 G,46396.4,148,0,148,6866667.2,0,6866667.2,
DC AMBON,CRYSTALLURE,FACE MOISTURIZER,CRYSTALLURE OIL SERUM,02174,SRM-CSRO-W,8993137702409,CRYSTALLURE SUPREME REVITALIZING OIL SERUM 30 ML,209909.91,1,0,1,209909.91,0,209909.91,
DC AMBON,EMINA,FACE CLEANSER,EMINA DIRT-LESS IN SIGHT MAKE UP REMOVER,01016,MUR-DIS-EM50ML,8993137693585,EMINA DIRT-LESS IN SIGHT MAKE UP REMOVER 50 ML (PC(S)),22972.98,6,0,6,137837.88,0,137837.88,
DC AMBON,EMINA,FACE MAKE UP,EMINA CHEEK LIT PRESSED BLUSH,00779,BO-CLPPCCC-EM3.5GR,8993137691963,EMINA CHEEK LIT PRESSED BLUSH COTTON CANDY 3.5 GR (PC(S)),32882.89,12,0,12,394594.68,0,394594.68,
DC AMBON,EMINA,FACE MAKE UP,EMINA CHEEK LIT PRESSED BLUSH,00777,BO-CLPPB-EM3.5GR,8993137691994,EMINA CHEEK LIT PRESSED BLUSH BITTERSWEET 3.5 GR (PC(S)),32882.89,9,0,9,295946.01,0,295946.01,
DC AMBON,EMINA,FACE MAKE UP,EMINA CHEEK LIT CREAM BLUSH,01642,BO-CLCVI-EM10ML,8993137700030,EMINA CHEEK LIT CREAM BLUSH VIOLET 10 ML,27477.48,6,0,6,164864.88,0,164864.88,
DC AMBON,EMINA,LIP MAKE UP,EMINA SOULMATTE LIPSTICK,01213,L-SM02U-EM2.3G,8993137695268,EMINA SOULMATTE LIPSTICK 02 UNICORN 2.3 G (PC(S)),50450.46,1,0,1,50450.46,0,50450.46,
DC AMBON,EMINA,FACE MAKE UP,EMINA CHEEK LIT CREAM BLUSH,00775,BO-CLCPI-EM10ML,8993137691499,EMINA CHEEK LIT CREAM BLUSH PINK 10 ML (PC(S)),27477.48,17,0,17,467117.16,0,467117.16,
DC AMBON,EMINA,LIP MAKE UP,EMINA CREAMYTINT,02136,LT-CR02-EM,8993137704816,EMINA CREAMYTINT 02 PEACH CRUSH 3.6 G,38738.74,35,0,35,1355855.9,0,1355855.9,
DC AMBON,EMINA,FACE MAKE UP,EMINA BARE WITH ME MINERAL LOOSE POWDER,01888,B-RBMLP01-EM,8993137691345,EMINA BARE WITH ME MINERAL LOOSE POWDER 01 FAIR 8 G,47747.75,1,0,1,47747.75,0,47747.75,
DC AMBON,EMINA,FACE MAKE UP,EMINA DAILY MATTE LOOSE POWDER,01896,B-DMLP02-EM,8993137702027,EMINA DAILY MATTE LOOSE POWDER 02 NATURAL BEIGE 20 G,30180.19,7,0,7,211261.33,0,211261.33,
DC AMBON,EMINA,FACE MAKE UP,EMINA DAILY MATTE LOOSE POWDER,01895,B-DMLP01-EM,8993137702010,EMINA DAILY MATTE LOOSE POWDER 01 LIGHT BEIGE 20 G,30180.19,4,0,4,120720.76,0,120720.76,
DC AMBON,EMINA,EYE MAKE UP,EMINA EYE DO! CRAYON POUR LES YEUX,00827,EL-EDCPBL-EM0.2GR,8993137691581,EMINA EYE DO! CRAYON POUR LES YEUX BLACK 0.2 GR (PC(S)),54954.96,3,0,3,164864.88,0,164864.88,
DC AMBON,EMINA,FACE MAKE UP,EMINA BARE WITH ME MINERAL LOOSE POWDER,01889,B-RBMLP02-EM,8993137691352,EMINA BARE WITH ME MINERAL LOOSE POWDER 02 LIGHT BEIGE 8 G,47747.75,14,0,14,668468.5,0,668468.5,
DC AMBON,EMINA,FACE CLEANSER,EMINA DOUBLE BUBBLE FACE WASH,00912,FW-DBL-EM60ML,8993137692793,EMINA DOUBLE BUBBLE FACE WASH 60 ML (PC(S)),16216.22,2,0,2,32432.44,0,32432.44,
DC AMBON,EMINA,LIP MAKE UP,EMINA LIP CUSHION,02363,L-CUSH06-EM,8993137706902,EMINA LIP CUSHION 06. COFFEE PLEASE 9 G,49099.1,2,0,2,98198.2,0,98198.2,
DC AMBON,EMINA,FACE MAKE UP,EMINA BARE WITH ME MINERAL LOOSE POWDER,01890,B-RBMLP03-EM,8993137691369,EMINA BARE WITH ME MINERAL LOOSE POWDER 03 AMBER 8 G,47747.75,4,0,4,190991,0,190991,
DC AMBON,EMINA,FACE MAKE UP,EMINA BARE WITH ME MINERAL MILD FOUNDATION,02452,F-BWMM02-EM,8993137707855,EMINA BARE WITH ME MINERAL MILD FOUNDATION 02 NATURAL 30 ML,68918.92,66,0,66,4548648.72,0,4548648.72,
DC AMBON,EMINA,FACE MAKE UP,EMINA BARE WITH ME MINERAL MILD FOUNDATION,02453,F-BWMM03-EM,8993137707862,EMINA BARE WITH ME MINERAL MILD FOUNDATION 03 CARAMEL 30 ML,68918.92,2,0,2,137837.84,0,137837.84,
DC AMBON,EMINA,FACE MAKE UP,EMINA BARE WITH ME MINERAL MILD FOUNDATION,02454,F-BWMM04-EM,8993137707879,EMINA BARE WITH ME MINERAL MILD FOUNDATION 04 MOCCA 30 ML,68918.92,2,0,2,137837.84,0,137837.84,
DC AMBON,EMINA,FACE MOISTURIZER,EMINA FACE MASK,01649,FM-SL-EM60ML,8993137693530,EMINA CRANBERRY JUICE FACE MASK 60 ML,34234.24,2,0,2,68468.48,0,68468.48,
DC AMBON,EMINA,HAND CLEANSING,EMINA ALOE VERA HAND GEL,02468,HS-AVHGN2-EM,8993137710404,EMINA ALOE VERA HAND GEL 50 ML,14864.87,46,0,46,683784.02,0,683784.02,
DC AMBON,EMINA,LIP MAKE UP,EMINA LIQUID LIP SHINE,00793,L-LSCR-EM4.5ML,8993137692014,EMINA LIQUID LIP SHINE CERISE RED 4.5 ML (PC(S)),34234.24,1,0,1,34234.24,0,34234.24,
DC AMBON,EMINA,LIP MAKE UP,EMINA SOULMATTE LIPSTICK,01217,L-SM06R-EM2.3G,8993137695305,EMINA SOULMATTE LIPSTICK 06 RED QUEEN 2.3 G (PC(S)),50450.46,9,0,9,454054.14,0,454054.14,
DC AMBON,EMINA,LIP MAKE UP,EMINA SUGAR RUSH LIPSTICK,01602,L-SR10CC-EM3.8GR,8993137699891,EMINA SUGAR RUSH LIPSTICK 10 CARROT CAKE 3.8 GR (PC(S)),32882.89,2,0,2,65765.78,0,65765.78,
DC AMBON,EMINA,FACE MAKE UP,EMINA CHEEK LIT PRESSED BLUSH,00782,BO-CLPPTVB-EM3.5GR,8993137691956,EMINA CHEEK LIT PRESSED BLUSH VIOLET BERRY 3.5 GR (PC(S)),32882.89,37,0,37,1216666.93,0,1216666.93,
DC AMBON,MAKE OVER,FACE MAKE UP,MAKE OVER POWERSTAY TOTAL LIQUID CONCEALER,01994,CON-PTCL01-MO,8993137700764,MAKE OVER POWERSTAY TOTAL COVER LIQUID CONCEALER 01 LIGHT 6.5 ML,86486.49,4,0,4,345945.96,0,345945.96,
DC AMBON,MAKE OVER,FACE MOISTURIZER,MAKE OVER POWERSKIN TINTED MOISTURIZER,01968,M-PSRT20-MO,8993137702942,MAKE OVER POWERSKIN RADIANT TINTED MOISTURIZER 20 LIGHT BEIGE 40 ML,121621.63,10,0,10,1216216.3,0,1216216.3,
DC AMBON,MAKE OVER,FACE MOISTURIZER,MAKE OVER POWERSKIN TINTED MOISTURIZER,01970,M-PSRT40-MO,8993137702966,MAKE OVER POWERSKIN RADIANT TINTED MOISTURIZER 40 MEDIUM BEIGE 40 ML,121621.63,10,0,10,1216216.3,0,1216216.3,
DC AMBON,MAKE OVER,FACE MOISTURIZER,MAKE OVER POWERSKIN TINTED MOISTURIZER,01969,M-PSRT30-MO,8993137702959,MAKE OVER POWERSKIN RADIANT TINTED MOISTURIZER 30 BEIGE 40 ML,121621.63,10,0,10,1216216.3,0,1216216.3,
DC AMBON,MAKE OVER,LIP MAKE UP,MAKE OVER LIP CRAYON GLOSSY,01978,L-CSGC101-MO,8993137702577,MAKE OVER COLOR STICK GLOSS CRAYON 101 VERONICA 3 G,87387.39,2,0,2,174774.78,0,174774.78,
DC AMBON,MAKE OVER,FACE MAKE UP,MAKE OVER BLUSH ON MARBLE,00674,BO-CM-MO20G,8993137684217,MAKE OVER CHEEK MARBLES 20 G (PC(S)),170270.28,1,0,1,170270.28,0,170270.28,
DC AMBON,MAKE OVER,FACE MAKE UP,MAKE OVER POWERSTAY CREAMY FOUNDATION,02191,F-PTCMCN50-MO,8993137705011,MAKE OVER POWERSTAY TOTAL COVER MATTE CREAM FOUNDATION N50 TAN 12 G,121621.63,9,0,9,1094594.67,0,1094594.67,
DC AMBON,MAKE OVER,LIP MAKE UP,MAKE OVER LIQUID LIP COLOR,00906,L-LRB-MO5ML,8993137693400,MAKE OVER LIQUID LIP COLOR RED BABYDOLL 5 ML (PC(S)),69369.37,4,0,4,277477.48,0,277477.48,
DC AMBON,MAKE OVER,FACE MAKE UP,MAKE OVER TWC REFILL,00901,TC-RPC08-MO12G,8993137688246,MAKE OVER PERFECT COVER REFILL TWC 08 HONEY 12 G (PC(S)),90991.0,4,0,4,363964,0,363964,
DC AMBON,MAKE OVER,EYE MAKE UP,MAKE OVER EYE SHADOW TRIVIA,00627,ES-TN-MO6G,8993137682565,MAKE OVER TRIVIA EYE SHADOW NATURAL NUDE 6 G (PC(S)),78378.38,8,0,8,627027.04,0,627027.04,
DC AMBON,MAKE OVER,FACE CLEANSER,MAKE OVER MICELLAR WATER,01463,REM-MW-MO185ML,8993137699013,MAKE OVER MICELLAR WATER 185 ML,78378.38,3,0,3,235135.14,0,235135.14,
DC AMBON,MAKE OVER,FACE MAKE UP,MAKE OVER TWC,00886,TC-PC01-MO12G,8993137681629,MAKE OVER PERFECT COVER TWC 01 LACE 12 G (PC(S)),137837.84,4,0,4,551351.36,0,551351.36,
DC AMBON,MAKE OVER,LIP MAKE UP,MAKE OVER LIP CREAM MATTE,00984,"L-IMC006-MO6,5G",8993137693875,"MAKE OVER INTENSE MATTE LIP CREAM 006 COSMOPOLITAN 6,5 G (PC(S))",91891.9,1,0,1,91891.9,0,91891.9,
DC AMBON,MAKE OVER,FACE MAKE UP,MAKE OVER TWC,00900,TC-PC08-MO12G,8993137688222,MAKE OVER PERFECT COVER TWC 08 HONEY 12 G (PC(S)),137837.84,3,0,3,413513.52,0,413513.52,
DC AMBON,MAKE OVER,FACE MAKE UP,MAKE OVER POWERSTAY TWC,01589,TC-PMC21-MO12G,8993137699730,MAKE OVER POWERSTAY MATTE POWDER FOUNDATION C21 PINK IVORY 12 G,164864.87,5,0,5,824324.35,0,824324.35,
DC AMBON,PUTRI,HAIR MASK,PUTRI SPA HAIR MASK,00387,CB-P1RS-P720,8993137683883,PUTRI SPA SERIES RICH SPA SCALP & HAIR TREATMENT CREAM 720 ML (PC(S)),62792.8,16,0,16,1004684.8,0,1004684.8,
DC AMBON,PUTRI,HAIR STYLING,PUTRI WET JELLY,00400,WJ-P1WS-P100,8993137677318,PUTRI WET JELLY 100 ML (PC(S)),7747.75,2,0,2,15495.5,0,15495.5,
DC AMBON,WARDAH,LIP MAKE UP,WARDAH COLORFIT LIP MOUSSE WOMEN'S DAY SPECIAL EDITION,02997,L-CVM07LE-W,8993137713061,WARDAH COLORFIT VELVET MATTE LIP MOUSSE - WOMEN'S DAY SPECIAL EDITION 07 RED PIONEER 4 G,63513.52,1,0,1,63513.52,0,63513.52,
DC AMBON,WARDAH,LIP MAKE UP,WARDAH LIPSTICK LONG LASTING,01106,L-LL02-W2.3G,8993137694896,WARDAH LIPSTICK LONGLASTING 02 PINK SORBET 2.3 G (PC(S)),42342.35,4,0,4,169369.4,0,169369.4,
DC AMBON,WARDAH,LIP MAKE UP,WARDAH EXCLUSIVE LIPSTICK MOIST,02061,L-REMO35-W,8993137706360,WARDAH EXCLUSIVE MOIST LIPSTICK 35 GREAT BERRY 3.5 G,36936.94,6,0,6,221621.64,0,221621.64,
DC AMBON,WARDAH,BODY BUTTER,WARDAH SPA BODY BUTTER,00275,BUT-W0S-W100ML,8993137690065,WARDAH CREAMY BODY BUTTER WITH STRAWBERRY 100 ML (PC(S)),31981.99,2,0,2,63963.98,0,63963.98,
DC AMBON,WARDAH,FACE MAKE UP,WARDAH EVERYDAY CONCEALER,00125,"F-WODF-W4,5GR",8993137677776,"WARDAH DOUBLE FUNCTION KIT 4,5 GR",45945.95,1,0,1,45945.95,0,45945.95,
DC AMBON,WARDAH,BODY BUTTER,WARDAH SPA BODY BUTTER,00274,BUT-W0R-W100ML,8993137690737,WARDAH CREAMY BODY BUTTER WITH ROSE 100 ML (PC(S)),31981.99,1,0,1,31981.99,0,31981.99,
DC AMBON,WARDAH,FACE MOISTURIZER,WARDAH LIGHTENING NIGHT CREAM,01633,M-RLNC-W30G,8993137572194,WARDAH LIGHTENING NIGHT CREAM 30 G (PC(S)),39090.9,3,0,3,117272.7,0,117272.7,
DC AMBON,WARDAH,HAND CLEANSING,WARDAH NATURE DAILY ALOE HAND SANITIZER,02456,HS-AHHGELN2-W,8993137710848,WARDAH NATURE DAILY ALOE HYDRAMILD HAND GEL 50 ML,9909.91,352,0,352,3488288.32,0,3488288.32,
DC AMBON,WARDAH,FACE MAKE UP,WARDAH EXCLUSIVE REFILL CUSHION,02178,CUS-REFC03-W,8993137706278,WARDAH REFILL EXCLUSIVE FLAWLESS COVER CUSHION 03 SANDY BEIGE 15 G,85585.59,4,0,4,342342.36,0,342342.36,
DC AMBON,WARDAH,FACE MAKE UP,WARDAH EXCLUSIVE CUSHION,02027,CUS-EFC01-W,8993137705868,WARDAH EXCLUSIVE FLAWLESS COVER CUSHION 01 LIGHT BEIGE 15 G,120720.73,2,0,2,241441.46,0,241441.46,
DC AMBON,WARDAH,FACE MOISTURIZER,WARDAH NATURE DAILY CAPSULE MASK,02326,FM-NDAAB-W,8993137706667,WARDAH NATURE DAILY AMAZONIAN ACAI BERRY ANTIOXIDANT CAPSULE MASK 10 ML,18468.47,2,0,2,36936.94,0,36936.94,
DC AMBON,WARDAH,FACE CLEANSER,WARDAH LIGHTENING GENTLE WASH,01711,FW-RLGW-W60ML,8993137678759,WARDAH LIGHTENING GENTLE WASH 60 ML,13636.36,2,0,2,27272.72,0,27272.72,
DC AMBON,WARDAH,FACE MAKE UP,WARDAH EVERYDAY REFILL COMPACT POWDER,00212,B-W3RELCP04-W14G,8993137680264,WARDAH REFILL EVD LUM COMPACT POWDER 04 NATURAL 14 G (PC(S)),28378.38,54,0,54,1532432.52,0,1532432.52,
DC AMBON,WARDAH,LIP MAKE UP,WARDAH EXCLUSIVE LIP CREAM,01076,L-EMC10-W4GR,8993137694483,WARDAH EXCLUSIVE MATTE LIP CREAM 10 BERRY PRETTY 4 GR (PC(S)),54054.06,7,0,7,378378.42,0,378378.42,
DC AMBON,WARDAH,FACE MAKE UP,WARDAH EVERYDAY CREAMY FOUNDATION EXTRA COVER,00133,"F-W3ELCECN-W8,5G",8993137685450,"WARDAH EVD LUM CREAMY FOUNDATION EXTRA COVER 04 NATURAL 8,5 G (PC(S))",34234.24,6,0,6,205405.44,0,205405.44,
DC AMBON,WARDAH,LIP MAKE UP,WARDAH EXCLUSIVE LIP CREAM BLISTER,02158,L-EMC08MM-W,8993137694469,WARDAH EXCLUSIVE MATTE LIP CREAM BLISTER 08 PINKCREDIBLE 4 G,56756.76,48,0,48,2724324.48,0,2724324.48,
DC BALI,EMINA,LIP MAKE UP,EMINA CREAMATTE METALLIC,01925,L-CMME01-EM,8993137702676,EMINA CREAMATTE METALLIC EDITION 01 BERRY STARDUST 5.5 G,44144.15,5,0,5,220720.75,0,220720.75,
DC BALI,EMINA,LIP MAKE UP,EMINA CREAMATTE,01101,L-CM04-EM5.5GR,8993137694339,EMINA CREAMATTE 04 FROSTBITE 5.5 GR (PC(S)),41441.45,2,0,2,82882.9,0,82882.9,
DC BALI,EMINA,LIP MAKE UP,EMINA SUGAR RUSH LIPSTICK,02211,L-SR14MB-EM,8993137705554,EMINA SUGAR RUSH LIPSTICK 14 MOLTEN BROWNIE 3.8 G,32882.89,3,0,3,98648.67,0,98648.67,
DC BALI,EMINA,FACE MAKE UP,EMINA CHEEK LIT CREAM BLUSH,01642,BO-CLCVI-EM10ML,8993137700030,EMINA CHEEK LIT CREAM BLUSH VIOLET 10 ML,27477.48,2,0,2,54954.96,0,54954.96,
DC BALI,EMINA,LIP MAKE UP,EMINA CREAMATTE METALLIC,01927,L-CMME03-EM,8993137702690,EMINA CREAMATTE METALLIC EDITION 03 UNICORN GLOW 5.5 G,44144.15,6,0,6,264864.9,0,264864.9,
DC BALI,EMINA,LIP MAKE UP,EMINA SUGAR RUSH LIPSTICK,02210,L-SR13CC-EM,8993137705547,EMINA SUGAR RUSH LIPSTICK 13 CHOCO CHERRY 3.8 G,32882.89,2,0,2,65765.78,0,65765.78,
DC BALI,EMINA,LIP MAKE UP,EMINA SOULMATTE LIPSTICK,01213,L-SM02U-EM2.3G,8993137695268,EMINA SOULMATTE LIPSTICK 02 UNICORN 2.3 G (PC(S)),50450.46,3,0,3,151351.38,0,151351.38,
DC BALI,EMINA,LIP MAKE UP,EMINA SOULMATTE LIPSTICK,01662,L-SM07G-EM2.3G,8993137700290,EMINA SOULMATTE LIPSTICK 07 GUMMY 2.3 G,50450.46,5,0,5,252252.3,0,252252.3,
DC BALI,EMINA,LIP MAKE UP,EMINA SOULMATTE LIPSTICK,01214,L-SM03F-EM2.3G,8993137695275,EMINA SOULMATTE LIPSTICK 03 FAIRY FANTASY 2.3 G (PC(S)),50450.46,4,0,4,201801.84,0,201801.84,
DC BALI,EMINA,LIP MAKE UP,EMINA SUGAR RUSH LIPSTICK,01602,L-SR10CC-EM3.8GR,8993137699891,EMINA SUGAR RUSH LIPSTICK 10 CARROT CAKE 3.8 GR (PC(S)),32882.89,2,0,2,65765.78,0,65765.78,
DC BALI,EMINA,LIP MAKE UP,EMINA SUGAR RUSH LIPSTICK,02214,L-SR17AF-EM,8993137705585,EMINA SUGAR RUSH LIPSTICK 17 APPLE FONDUE 3.8 G,32882.89,1,0,1,32882.89,0,32882.89,
DC BALI,EMINA,LIP MAKE UP,EMINA SOULMATTE LIPSTICK,01665,L-SM10B-EM2.3G,8993137700320,EMINA SOULMATTE LIPSTICK 10 BLOODY MARY 2.3 G,50450.46,4,0,4,201801.84,0,201801.84,
DC BALI,EMINA,LIP MAKE UP,EMINA SOULMATTE LIPSTICK,01666,L-SM11B-EM2.3G,8993137700399,EMINA SOULMATTE LIPSTICK 11 BUTTERCUP 2.3 G,50450.46,3,0,3,151351.38,0,151351.38,
DC BALI,EMINA,FACE MAKE UP,EMINA SEBUM FIGHTER LOOSE POWDER,01923,B-SFLP-EM8G,8993137702034,EMINA SEBUM FIGHTER LOOSE POWDER 8 G,52252.26,4,0,4,209009.04,0,209009.04,
DC BALI,EMINA,LIP MAKE UP,EMINA LIP CUSHION,01917,L-CUSH02-EM,8993137702195,EMINA LIP CUSHION 02. BE CHERRY 9 G,49099.1,1,0,1,49099.1,0,49099.1,
DC BALI,EMINA,LIP MAKE UP,EMINA LIP CUSHION,02360,L-CUSH03-EM,8993137706872,EMINA LIP CUSHION 03. GET BERRY 9 G,49099.1,7,0,7,343693.7,0,343693.7,
DC BALI,EMINA,LIP MAKE UP,EMINA SOULMATTE LIPSTICK,01217,L-SM06R-EM2.3G,8993137695305,EMINA SOULMATTE LIPSTICK 06 RED QUEEN 2.3 G (PC(S)),50450.46,1,0,1,50450.46,0,50450.46,
DC BALI,EMINA,LIP MAKE UP,EMINA LIP CUSHION,02361,L-CUSH04-EM,8993137706889,EMINA LIP CUSHION 04. SAY CORAL 9 G,49099.1,7,0,7,343693.7,0,343693.7,
DC BALI,EMINA,LIP MAKE UP,EMINA SUGAR RUSH LIPSTICK,00960,L-SR03CB-EM3.8GR,8993137693448,EMINA SUGAR RUSH LIPSTICK 03 CHERRY BOMB 3.8 GR (PC(S)),32882.89,3,0,3,98648.67,0,98648.67,
DC BALI,EMINA,LIP MAKE UP,EMINA SOULMATTE LIPSTICK,01667,L-SM12C-EM2.3G,8993137700405,EMINA SOULMATTE LIPSTICK 12 CHOCO PIE 2.3 G,50450.46,5,0,5,252252.3,0,252252.3,
DC BALI,EMINA,FACE MOISTURIZER,EMINA ALOE VERA FACE MIST,02209,FMI-AV-EM,8993137705981,EMINA ALOE VERA FACE MIST 60 ML,33783.79,1,0,1,33783.79,0,33783.79,
DC BALI,EMINA,FACE MOISTURIZER,EMINA ALOE VERA GEL,02033,HBL-AVG-EM,8993137702201,EMINA ALOE VERA GEL 60 ML,24774.78,2,0,2,49549.56,0,49549.56,
DC BALI,EMINA,COLOGNE,EMINA BODY MIST,02093,BP-BMSSN2-EM,8993137704243,EMINA BODY MIST OCEAN MIST 10 ML,18468.47,1,0,1,18468.47,0,18468.47,
DC BALI,EMINA,LIP MAKE UP,EMINA SUGAR RUSH LIPSTICK,02213,L-SR16PD-EM,8993137705578,EMINA SUGAR RUSH LIPSTICK 16 PEACH DROPS 3.8 G,32882.89,5,0,5,164414.45,0,164414.45,
DC BALI,EMINA,LIP MAKE UP,EMINA LIP TINT ERASER,01804,REM-LTWO-EM10ML,8993137699402,EMINA LIP TINT ERASER 10 ML,36486.49,1,0,1,36486.49,0,36486.49,
DC BALI,EMINA,LIP MAKE UP,EMINA LIP CUSHION,02363,L-CUSH06-EM,8993137706902,EMINA LIP CUSHION 06. COFFEE PLEASE 9 G,49099.1,8,0,8,392792.8,0,392792.8,
DC BALI,EMINA,FACE CLEANSER,EMINA MS. PIMPLE FACE WASH,01913,FW-PHAS-EM50ML,8993137701990,EMINA MS. PIMPLE ACNE SOLUTION FACE WASH 50 ML,16216.22,1,0,1,16216.22,0,16216.22,
DC BALI,EMINA,LIP MAKE UP,EMINA SUGAR RUSH LIPSTICK,00958,L-SR01PV-EM3.8GR,8993137693424,EMINA SUGAR RUSH LIPSTICK 01 PINK VELVET 3.8 GR (PC(S)),32882.89,1,0,1,32882.89,0,32882.89,
DC BALI,EMINA,FACE MAKE UP,EMINA CITY CHIC CC CREAM,01903,CCC-CCL-EM20ML,8993137691321,EMINA CITY CHIC CC CREAM LIGHT 20 ML (PC(S)),48198.2,1,0,1,48198.2,0,48198.2,
DC BALI,EMINA,EYE MAKE UP,EMINA DOUBLE AGENT EYEBROW,00825,EB-DABR-EM0.3GR,8993137691703,EMINA DOUBLE AGENT EYEBROW BROWN 0.3 GR (PC(S)),73423.43,2,0,2,146846.86,0,146846.86,
DC BALI,EMINA,FACE MAKE UP,EMINA CHEEK LIT CREAM BLUSH,01643,BO-CLCNB-EM10ML,8993137700047,EMINA CHEEK LIT CREAM BLUSH NUDIE BROWN 10 ML,27477.48,4,0,4,109909.92,0,109909.92,
DC BALI,EMINA,FACE MOISTURIZER,EMINA MASQUERADE SHEET MASK,01794,FM-MPO-EM,8993137702638,EMINA MASQUERADE FACE MASK POMEGRANATE 23 G,12612.62,1,0,1,12612.62,0,12612.62,
DC BALI,EMINA,FACE MAKE UP,EMINA CHEEK LIT CREAM BLUSH,00776,BO-CLCPE-EM10ML,8993137691505,EMINA CHEEK LIT CREAM BLUSH PEACH 10 ML (PC(S)),27477.48,22,0,22,604504.56,0,604504.56,
DC BALI,EMINA,FACE MAKE UP,EMINA BARE WITH ME MINERAL LOOSE POWDER,01888,B-RBMLP01-EM,8993137691345,EMINA BARE WITH ME MINERAL LOOSE POWDER 01 FAIR 8 G,47747.75,1,0,1,47747.75,0,47747.75,
DC BALI,EMINA,LIP MAKE UP,EMINA LIP MASK,02026,LB-LM-EM,8993137703048,EMINA LIP MASK 9 G,32882.89,1,0,1,32882.89,0,32882.89,
DC BALI,EMINA,LIP MAKE UP,EMINA CREAMATTE,01679,L-CM14-EM5.5GR,8993137700580,EMINA CREAMATTE 14 GINGERALE 5.5 GR,41441.45,2,0,2,82882.9,0,82882.9,
DC BALI,EMINA,BODY LOTION,EMINA BODY SORBET,00966,HBL-KW-EM100ML,8993137694186,EMINA BODY SORBET KIWI 100 ML (PC(S)),38738.74,1,0,1,38738.74,0,38738.74,
DC BALI,EMINA,FACE MOISTURIZER,EMINA FACE MASK,01266,FM-GS-EM60ML,8993137693509,EMINA GRAPE SEED OLIVE FACE MASK 60 ML (PC(S)),34234.24,1,0,1,34234.24,0,34234.24,
DC BALI,INSTAPERFECT,LIP MAKE UP,INSTAPERFECT LIP CREAM,02000,L-IPMLMP09-W,8993137704397,WARDAH INSTAPERFECT MATTESETTER LIP MATTE PAINT 09. ICON 5.5 G,77927.93,1,0,1,77927.93,0,77927.93,
DC BALI,MAKE OVER,LIP MAKE UP,MAKE OVER CREAMY LUST LIPSTICK,01515,L-CLRT15-MO4G,8993137698214,MAKE OVER CREAMY LUST LIPSTICK 15 RED TANGO 4 G (PC(S)),69369.37,9,0,9,624324.33,0,624324.33,
DC BALI,MAKE OVER,FACE MAKE UP,MAKE OVER POWERSTAY ILLUMINATOR,02401,PRM-PRI02-MO,8993137706650,MAKE OVER POWERSTAY RADIANT ILLUMINIZER SUN KISSED 25 G,109909.91,1,0,1,109909.91,0,109909.91,
DC BALI,MAKE OVER,LIP MAKE UP,MAKE OVER LIP CREAM MATTE,01256,"L-IMC017-MO6,5G",8993137697620,"MAKE OVER INTENSE MATTE LIP CREAM 017 SAVVY 6,5 G (PC(S))",91891.9,5,0,5,459459.5,0,459459.5,
DC BALI,MAKE OVER,LIP MAKE UP,MAKE OVER LIQUID LIP COLOR,00906,L-LRB-MO5ML,8993137693400,MAKE OVER LIQUID LIP COLOR RED BABYDOLL 5 ML (PC(S)),69369.37,2,0,2,138738.74,0,138738.74,
DC BALI,MAKE OVER,FACE CLEANSER,MAKE OVER CLEANSING CREAM,00756,CLN-C-MO60ML,8993137683395,MAKE OVER CLEANSING CREAM 60 ML (PC(S)),50450.46,5,0,5,252252.3,0,252252.3,
DC BALI,MAKE OVER,FACE MAKE UP,MAKE OVER CREAMY FOUNDATION,00519,F-C1PC02-MO12G,8993137681773,MAKE OVER PERFECT COVER CREAMY FOUNDATION 02 CLASSIC CONGO 12 G (PC(S,115315.32,1,0,1,115315.32,0,115315.32,
DC BALI,MAKE OVER,FACE MOISTURIZER,MAKE OVER POWERSKIN TINTED MOISTURIZER,01970,M-PSRT40-MO,8993137702966,MAKE OVER POWERSKIN RADIANT TINTED MOISTURIZER 40 MEDIUM BEIGE 40 ML,121621.63,4,0,4,486486.52,0,486486.52,
DC BALI,MAKE OVER,LIP MAKE UP,MAKE OVER LIQUID LIP COLOR,00907,L-LPPI-MO5ML,8993137693370,MAKE OVER LIQUID LIP COLOR PENELOPE PINK 5 ML (PC(S)),69369.37,1,0,1,69369.37,0,69369.37,
DC BALI,MAKE OVER,FACE MAKE UP,MAKE OVER POWERSTAY TWC,02405,TC-PMN20-MO,8993137707756,MAKE OVER POWERSTAY MATTE POWDER FOUNDATION N20 IVORY 12 G,164864.87,10,0,10,1648648.7,0,1648648.7,
DC BALI,MAKE OVER,LIP MAKE UP,MAKE OVER CREAMY LUST LIPSTICK,01514,L-CLPC14-MO4G,8993137698207,MAKE OVER CREAMY LUST LIPSTICK 14 PINK COCKTAIL 4 G (PC(S)),69369.37,1,0,1,69369.37,0,69369.37,
DC BALI,MAKE OVER,LIP MAKE UP,MAKE OVER ULTRA HI-MATTE LIPSTICK,01132,L-UHPA002-MO2.3G,8993137696814,MAKE OVER ULTRA HI-MATTE LIPSTICK 002 PINK ALCATRAZ 2.3 G (PC(S)),81981.99,3,0,3,245945.97,0,245945.97,
DC BALI,MAKE OVER,LIP MAKE UP,MAKE OVER ULTRA SHINE LIPSTICK,00737,"L-USMT08-MO3,8G",8993137682756,"MAKE OVER ULTRA SHINE LIPSTICK 08 MOCHA TOFFEE 3,8 G (PC(S))",69369.37,3,0,3,208108.11,0,208108.11,
DC BALI,MAKE OVER,EYE MAKE UP,MAKE OVER EYE SHADOW TRIVIA,00634,ES-TLFS-MO6G,8993137690980,MAKE OVER TRIVIA EYE SHADOW LOVE AT FIRST SIGHT 6 G (PC(S)),78378.38,5,0,5,391891.9,0,391891.9,
DC BALI,MAKE OVER,EYE MAKE UP,MAKE OVER EYE SHADOW TRIVIA,00635,ES-TDOC-MO6G,8993137690959,MAKE OVER TRIVIA EYE SHADOW DOLLY CRUSH 6 G (PC(S)),78378.38,6,0,6,470270.28,0,470270.28,
DC BALI,MAKE OVER,LIP MAKE UP,MAKE OVER ULTRA SHINE LIPSTICK,00732,"L-USAA03-MO3,8G",8993137682701,"MAKE OVER ULTRA SHINE LIPSTICK 03 ARTFUL AMETHYST 3,8 G (PC(S))",69369.37,3,0,3,208108.11,0,208108.11,
DC BALI,MAKE OVER,LIP MAKE UP,MAKE OVER ULTRA HI-MATTE LIPSTICK,01145,L-UHFF015-MO2.3G,8993137696906,MAKE OVER ULTRA HI-MATTE LIPSTICK 015 FAME FATALE 2.3 G (PC(S)),81981.99,1,0,1,81981.99,0,81981.99,
DC BALI,MAKE OVER,EYE MAKE UP,MAKE OVER POWERSTAY EYE SHADOW PRIMER,02082,ES-PPR-MO,8993137701471,MAKE OVER POWERSTAY EYESHADOW PRIMER 7 G,73873.88,6,0,6,443243.28,0,443243.28,
DC BALI,MAKE OVER,LIP MAKE UP,MAKE OVER CREAMY LUST LIPSTICK,00684,L-CLCH09-MO4G,8993137682886,MAKE OVER CREAMY LUST LIPSTICK 09 CLOVER HAZE 4 G (PC(S)),69369.37,1,0,1,69369.37,0,69369.37,
DC BALI,MAKE OVER,EYE MAKE UP,MAKE OVER EYE SHADOW POWDER,00586,ES-PGA-MO2G,8993137682367,MAKE OVER POWDER EYE SHADOW GOLDEN ATTACK 2 G (PC(S)),69369.37,5,0,5,346846.85,0,346846.85,
DC BALI,MAKE OVER,EYE MAKE UP,MAKE OVER EYE SHADOW POWDER,00584,ES-PFP-MO2G,8993137682398,MAKE OVER POWDER EYE SHADOW FROZEN PINK 2 G (PC(S)),69369.37,2,0,2,138738.74,0,138738.74,
DC BALI,MAKE OVER,LIP MAKE UP,MAKE OVER ULTRA HI-MATTE LIPSTICK,01133,L-UHSR003-MO2.3G,8993137696821,MAKE OVER ULTRA HI-MATTE LIPSTICK 003 SOPHIST RED 2.3 G (PC(S)),81981.99,5,0,5,409909.95,0,409909.95,
DC BALI,MAKE OVER,LIP MAKE UP,MAKE OVER LIP CRAYON GLOSSY,01980,L-CSGC103-MO,8993137702591,MAKE OVER COLOR STICK GLOSS CRAYON 103 EMMA 3 G,87387.39,2,0,2,174774.78,0,174774.78,
DC BALI,MAKE OVER,LIP MAKE UP,MAKE OVER LIQUID LIP COLOR,00709,L-LH-MO5ML,8993137683289,MAKE OVER LIQUID LIP COLOR HAZELNUT 5 ML (PC(S)),69369.37,3,0,3,208108.11,0,208108.11,
DC BALI,MAKE OVER,EYE MAKE UP,MAKE OVER POWERSTAY EYE LINER LIQUID,01674,EL-PPLCB-MO2.7G,8993137700450,MAKE OVER POWERSTAY PRECISION LIQUID LINER COBALT BLUE 2.7 G,87387.39,3,0,3,262162.17,0,262162.17,
DC BALI,MAKE OVER,LIP MAKE UP,MAKE OVER LIQUID LIP COLOR,00705,L-LFP-MO5ML,8993137683326,MAKE OVER LIQUID LIP COLOR FLARE PINK 5 ML (PC(S)),69369.37,2,0,2,138738.74,0,138738.74,
DC BALI,MAKE OVER,FACE MAKE UP,MAKE OVER TWC,00887,TC-PC02-MO12G,8993137681636,MAKE OVER PERFECT COVER TWC 02 CORAL 12 G (PC(S)),137837.84,6,0,6,827027.04,0,827027.04,
