DC,BRAND,CAT1,CAT4,ODOO CODE,CORPORATE CODE,BARCODE,ITEM NAME,GT PRICE,QOH,RESERVED (QTY),AVAILABLE (QTY),QOH (Rp),RESERVED (Rp),AVAILABLE (Rp),EXPIRED DATE
DC RANTAU PRAPAT,INSTAPERFECT,LIP MAKE UP,INSTAPERFECT LIP CREAM,01755,L-IPMLMP04-W5.5G,8993137700962,WARDAH INSTAPERFECT MATTESETTER LIP MATTE PAINT 04. VIBE 5.5 G,77927.93,1,0,1,77927.93,0,77927.93,
DC RANTAU PRAPAT,INSTAPERFECT,LIP MAKE UP,INSTAPERFECT LIP CREAM,01752,L-IPMLMP01-W5.5G,8993137700931,WARDAH INSTAPERFECT MATTESETTER LIP MATTE PAINT 01. GLEE 5.5 G,77927.93,1,0,1,77927.93,0,77927.93,
DC RANTAU PRAPAT,MAKE OVER,FACE MAKE UP,MAKE OVER POWERSTAY CREAMY FOUNDATION,02194,F-PTCMCW42-MO,8993137704991,MAKE OVER POWERSTAY TOTAL COVER MATTE CREAM FOUNDATION W42 WARM SAND 12 G,121621.63,6,0,6,729729.78,0,729729.78,
DC RANTAU PRAPAT,MAKE OVER,LIP MAKE UP,MAKE OVER ULTRA HI-MATTE LIPSTICK,01139,L-UHF009-MO2.3G,8993137696890,MAKE OVER ULTRA HI-MATTE LIPSTICK 009 FOXY 2.3 G (PC(S)),81981.99,1,0,1,81981.99,0,81981.99,
DC RANTAU PRAPAT,MAKE OVER,LIP MAKE UP,MAKE OVER CLIQUEMATTE,01626,L-CQS205-MO2G,8993137699990,MAKE OVER CLIQUEMATTE LIP STYLO 205 JETSETTER 2 G,101801.81,2,0,2,203603.62,0,203603.62,
DC RANTAU PRAPAT,MAKE OVER,EYE MAKE UP,MAKE OVER EYE SHADOW TRIVIA,00636,ES-TMFT-MO6G,8993137690973,MAKE OVER TRIVIA EYE SHADOW MAGICAL FAIRY TALE 6 G (PC(S)),78378.38,1,0,1,78378.38,0,78378.38,
DC RANTAU PRAPAT,MAKE OVER,FACE MAKE UP,MAKE OVER POWERSTAY TWC,02306,TC-PMN50-MO,8993137707213,MAKE OVER POWERSTAY MATTE POWDER FOUNDATION N50 TAN 12 G,164864.87,7,0,7,1154054.09,0,1154054.09,
DC RANTAU PRAPAT,MAKE OVER,EYE MAKE UP,MAKE OVER EYE SHADOW POWDER,00585,ES-PGK-MO2G,8993137682480,MAKE OVER POWDER EYE SHADOW GOLD KNIGHT 2 G (PC(S)),69369.37,2,0,2,138738.74,0,138738.74,
DC RANTAU PRAPAT,MAKE OVER,LIP MAKE UP,MAKE OVER LIP CRAYON GLOSSY,01981,L-CSGC104-MO,8993137702607,MAKE OVER COLOR STICK GLOSS CRAYON 104 CHLOE 3 G,87387.39,2,0,2,174774.78,0,174774.78,
DC RANTAU PRAPAT,MAKE OVER,FACE MAKE UP,MAKE OVER POWERSTAY TWC,01590,TC-PMW33-MO12G,8993137699747,MAKE OVER POWERSTAY MATTE POWDER FOUNDATION W33 HONEY BEIGE 12 G,164864.87,1,0,1,164864.87,0,164864.87,
DC RANTAU PRAPAT,MAKE OVER,LIP MAKE UP,MAKE OVER ULTRA HI-MATTE LIPSTICK,01145,L-UHFF015-MO2.3G,8993137696906,MAKE OVER ULTRA HI-MATTE LIPSTICK 015 FAME FATALE 2.3 G (PC(S)),81981.99,2,0,2,163963.98,0,163963.98,
DC RANTAU PRAPAT,MAKE OVER,FACE MAKE UP,MAKE OVER LIQUID FOUNDATION,00527,F-LUC02-MO33ML,8993137681704,MAKE OVER ULTRA COVER LIQUID MATT FOUNDATION 02 PINK SHADE 33 ML (PC(S)),124324.33,1,0,1,124324.33,0,124324.33,
DC RANTAU PRAPAT,MAKE OVER,LIP MAKE UP,MAKE OVER CREAMY LUST LIPSTICK,00679,L-CLQR04-MO4G,8993137682831,MAKE OVER CREAMY LUST LIPSTICK 04 QUIRKY RED 4 G (PC(S)),69369.37,1,0,1,69369.37,0,69369.37,
DC RANTAU PRAPAT,MAKE OVER,EYE MAKE UP,MAKE OVER EYE SHADOW PALETTE,01263,ES-PNU-MO10G,8993137694223,MAKE OVER EYE SHADOW PALETTE NUDES 10 G (PC(S)),179279.28,3,0,3,537837.84,0,537837.84,
DC RANTAU PRAPAT,MAKE OVER,FACE MAKE UP,MAKE OVER POWERSTAY TWC,02407,TC-PMN40-MO,8993137707763,MAKE OVER POWERSTAY MATTE POWDER FOUNDATION N40 SAND 12 G,164864.87,3,0,3,494594.61,0,494594.61,
DC RANTAU PRAPAT,MAKE OVER,EYE MAKE UP,MAKE OVER EYE SHADOW TRIVIA,00627,ES-TN-MO6G,8993137682565,MAKE OVER TRIVIA EYE SHADOW NATURAL NUDE 6 G (PC(S)),78378.38,1,0,1,78378.38,0,78378.38,
DC RANTAU PRAPAT,MAKE OVER,FACE MAKE UP,MAKE OVER POWERSTAY CREAMY FOUNDATION,02195,F-PTCMCW52-MO,8993137705004,MAKE OVER POWERSTAY TOTAL COVER MATTE CREAM FOUNDATION W52 WARM TAN 12 G,121621.63,4,0,4,486486.52,0,486486.52,
DC RANTAU PRAPAT,MAKE OVER,FACE MAKE UP,MAKE OVER CREAMY FOUNDATION,00525,F-PC-MO3X12G,8993137683029,MAKE OVER CREAMY FOUNDATION PALETTE 3X12 G (PC(S)),225225.23,4,0,4,900900.92,0,900900.92,
DC RANTAU PRAPAT,MAKE OVER,FACE MAKE UP,MAKE OVER POWERSTAY WEIGHTLESS LIQUID FOUNDATION,01584,F-LPWW42-MO33ML,8993137699686,MAKE OVER POWERSTAY WEIGHTLESS LIQUID FOUNDATION W42 WARM SAND 33 ML,145945.95,3,0,3,437837.85,0,437837.85,
DC RANTAU PRAPAT,MAKE OVER,FACE MAKE UP,MAKE OVER POWERSTAY WEIGHTLESS LIQUID FOUNDATION,02424,F-LPWN50-MO,8993137707374,MAKE OVER POWERSTAY WEIGHTLESS LIQUID FOUNDATION N50 TAN 33 ML,145945.95,1,0,1,145945.95,0,145945.95,
DC RANTAU PRAPAT,MAKE OVER,FACE MAKE UP,MAKE OVER POWERSTAY ILLUMINATOR,02401,PRM-PRI02-MO,8993137706650,MAKE OVER POWERSTAY RADIANT ILLUMINIZER SUN KISSED 25 G,109909.91,1,0,1,109909.91,0,109909.91,
DC RANTAU PRAPAT,MAKE OVER,LIP MAKE UP,MAKE OVER LIQUID LIP COLOR,00911,L-LSPE-MO5ML,8993137693356,MAKE OVER LIQUID LIP COLOR SWEET PEACH 5 ML (PC(S)),69369.37,1,0,1,69369.37,0,69369.37,
DC RANTAU PRAPAT,MAKE OVER,LIP MAKE UP,MAKE OVER CLIQUEMATTE,01985,L-CQS211-MO2G,8993137701501,MAKE OVER CLIQUEMATTE LIP STYLO 211 TRUFFLES 2 G,101801.81,6,0,6,610810.86,0,610810.86,
DC RANTAU PRAPAT,MAKE OVER,LIP MAKE UP,MAKE OVER ULTRA HI-MATTE LIPSTICK,01140,L-UHS010-MO2.3G,8993137696913,MAKE OVER ULTRA HI-MATTE LIPSTICK 010 SMOOCH 2.3 G (PC(S)),81981.99,3,0,3,245945.97,0,245945.97,
DC RANTAU PRAPAT,MAKE OVER,LIP MAKE UP,MAKE OVER CREAMY LUST LIPSTICK,01515,L-CLRT15-MO4G,8993137698214,MAKE OVER CREAMY LUST LIPSTICK 15 RED TANGO 4 G (PC(S)),69369.37,3,0,3,208108.11,0,208108.11,
DC RANTAU PRAPAT,MAKE OVER,FACE MAKE UP,MAKE OVER LIQUID FOUNDATION,00529,F-LUC04-MO33ML,8993137681728,MAKE OVER ULTRA COVER LIQUID MATT FOUNDATION 04 AMBER ROSE 33 ML (PC(S)),124324.33,3,0,3,372972.99,0,372972.99,
DC RANTAU PRAPAT,MAKE OVER,FACE MAKE UP,MAKE OVER TWC,00892,TC-PC06-MO12G,8993137681674,MAKE OVER PERFECT COVER TWC 06 CAPPUCCINO 12 G (PC(S)),137837.84,1,0,1,137837.84,0,137837.84,
DC RANTAU PRAPAT,MAKE OVER,LIP MAKE UP,MAKE OVER ULTRA HI-MATTE LIPSTICK,01143,L-UHOP013-MO2.3G,8993137696920,MAKE OVER ULTRA HI-MATTE LIPSTICK 013 ORANGE POP 2.3 G (PC(S)),81981.99,4,0,4,327927.96,0,327927.96,
DC RANTAU PRAPAT,MAKE OVER,EYE MAKE UP,MAKE OVER EYE SHADOW TRIVIA,00626,ES-TIS-MO6G,8993137682602,MAKE OVER TRIVIA EYE SHADOW INDIAN SUMMER 6 G (PC(S)),78378.38,1,0,1,78378.38,0,78378.38,
DC RANTAU PRAPAT,MAKE OVER,FACE MAKE UP,MAKE OVER BLUSH ON,00664,BO-SKST09-MO6G,8993137692250,MAKE OVER BO SINGLE 09 SUMMER TWIST 6 G (PC(S)),78378.38,1,0,1,78378.38,0,78378.38,
DC RANTAU PRAPAT,MAKE OVER,FACE MAKE UP,MAKE OVER TWC,00886,TC-PC01-MO12G,8993137681629,MAKE OVER PERFECT COVER TWC 01 LACE 12 G (PC(S)),137837.84,1,0,1,137837.84,0,137837.84,
DC RANTAU PRAPAT,MAKE OVER,FACE MAKE UP,MAKE OVER LOOSE POWDER,00559,B-PT03-MO35G,8993137681858,MAKE OVER SILKY SMOOTH TRANSLUCENT POWDER 03 CHAMPAGNE 35 G (PC(S),106306.31,1,0,1,106306.31,0,106306.31,
DC RANTAU PRAPAT,MAKE OVER,FACE MOISTURIZER,MAKE OVER POWERSKIN TINTED MOISTURIZER,01969,M-PSRT30-MO,8993137702959,MAKE OVER POWERSKIN RADIANT TINTED MOISTURIZER 30 BEIGE 40 ML,121621.63,1,0,1,121621.63,0,121621.63,
DC RANTAU PRAPAT,MAKE OVER,EYE MAKE UP,MAKE OVER EYE SHADOW TRIVIA,00624,ES-TEB-MO6G,8993137682589,MAKE OVER TRIVIA EYE SHADOW EMPEROR BROWN 6 G (PC(S)),78378.38,1,0,1,78378.38,0,78378.38,
DC RANTAU PRAPAT,MAKE OVER,LIP MAKE UP,MAKE OVER LIP CREAM MATTE,00986,"L-IMC008-MO6,5G",8993137694094,"MAKE OVER INTENSE MATTE LIP CREAM 008 LIBERTINE 6,5 G (PC(S))",91891.9,1,0,1,91891.9,0,91891.9,
DC RANTAU PRAPAT,MAKE OVER,LIP MAKE UP,MAKE OVER LIP CREAM MATTE,00980,"L-IMC002-MO6,5G",8993137693837,"MAKE OVER INTENSE MATTE LIP CREAM 002 HEIRESS 6,5 G (PC(S))",91891.9,5,0,5,459459.5,0,459459.5,
DC RANTAU PRAPAT,MAKE OVER,FACE MAKE UP,MAKE OVER POWERSTAY CREAMY FOUNDATION,02191,F-PTCMCN50-MO,8993137705011,MAKE OVER POWERSTAY TOTAL COVER MATTE CREAM FOUNDATION N50 TAN 12 G,121621.63,1,0,1,121621.63,0,121621.63,
DC RANTAU PRAPAT,PUTRI,CONDITIONER,PUTRI CONDITIONER,00358,HC-P1F-P5,8993137170062,PUTRI PURE CLEAN HAIR CONDITIONER FLORAL 5 L (PC(S)),104684.69,12,0,12,1256216.28,0,1256216.28,
DC RANTAU PRAPAT,PUTRI,SHAMPOO,PUTRI SHAMPOO,00367,S-P1L-P2,8993137180528,PUTRI PURE CLEAN SHAMPOO LEMON 2 L (PC(S)),66936.94,9,0,9,602432.46,0,602432.46,
DC RANTAU PRAPAT,PUTRI,HAIR TEXTURE,PUTRI PROFESSIONAL COLD WAVE,00340,C-P1-P2,8993137684026,PUTRI COLD WAVE 2 L (PC(S)),78108.11,10,0,10,781081.1,0,781081.1,
DC RANTAU PRAPAT,PUTRI,SHAMPOO,PUTRI SHAMPOO,00363,S-P1A2-P5,8993137180450,PUTRI PURE CLEAN SHAMPOO APPLE 5 L (PC(S)),114684.69,10,0,10,1146846.9,0,1146846.9,
DC RANTAU PRAPAT,PUTRI,HAIR TEXTURE,PUTRI PROFESSIONAL PUSTREITE STEP 1,00347,LU-P1-P720,8993137147200,PUTRI PUSTREITE STEP 1 720 ML (PC(S)),47837.84,10,0,10,478378.4,0,478378.4,
DC RANTAU PRAPAT,PUTRI,BODY SCRUB,PUTRI SPA BODY SCRUB,00382,LW-P1-P150,8993137683906,PUTRI OLIVE BODY SCRUB 150 ML (PC(S)),18018.02,2,0,2,36036.04,0,36036.04,
DC RANTAU PRAPAT,PUTRI,SHAMPOO,PUTRI SHAMPOO,00368,S-P1L-P5,8993137180559,PUTRI PURE CLEAN SHAMPOO LEMON 5 L (PC(S)),114684.69,12,0,12,1376216.28,0,1376216.28,
DC RANTAU PRAPAT,WARDAH,HAND CLEANSING,WARDAH NATURE DAILY ALOE HAND SANITIZER,02458,HS-NDAHHGN2-W,8993137710602,WARDAH NATURE DAILY ALOE HYDRAMILD HAND SANITIZER 240 ML,25225.23,4,0,4,100900.92,0,100900.92,
DC RANTAU PRAPAT,WARDAH,FACE MAKE UP,WARDAH EXCLUSIVE REFILL CUSHION,02178,CUS-REFC03-W,8993137706278,WARDAH REFILL EXCLUSIVE FLAWLESS COVER CUSHION 03 SANDY BEIGE 15 G,85585.59,2,0,2,171171.18,0,171171.18,
DC RANTAU PRAPAT,WARDAH,FACE MAKE UP,WARDAH EXCLUSIVE LIQUID FOUNDATION,02034,F-RELF01-W,8993137678858,WARDAH EXCLUSIVE LIQUID FOUNDATION 01 LIGHT BEIGE 20 ML,71621.63,1,0,1,71621.63,0,71621.63,
DC RANTAU PRAPAT,WARDAH,FACE MAKE UP,WARDAH EXCLUSIVE LIQUID FOUNDATION,02035,F-RELF02-W,8993137678865,WARDAH EXCLUSIVE LIQUID FOUNDATION 02 SHEER PINK 20 ML,71621.63,2,0,2,143243.26,0,143243.26,
DC RANTAU PRAPAT,WARDAH,FACE MAKE UP,WARDAH LIGHTENING TWC LIGHT FEEL,00106,TC-W1LSPC3-W12GR,8993137685610,WARDAH LIGHTENING TWO WAY CAKE LIGHT FEEL 03 SHEER PINK 12 GR,46396.4,3,0,3,139189.2,0,139189.2,
DC RANTAU PRAPAT,WARDAH,FACE MAKE UP,WARDAH LIGHTENING TWC LIGHT FEEL,00107,TC-W1LNC4-W12GR,8993137685627,WARDAH LIGHTENING TWO WAY CAKE LIGHT FEEL 04 NATURAL 12 GR,46396.4,1,0,1,46396.4,0,46396.4,
DC RANTAU PRAPAT,WARDAH,FACE CLEANSER,WARDAH NATURE DAILY MICELLAR WATER,01554,REM-SBMW-W100ML,8993137698672,WARDAH NATURE DAILY SEAWEED CLEANSING MICELLAR WATER 100 ML,24774.78,2,0,2,49549.56,0,49549.56,
DC RANTAU PRAPAT,WARDAH,HAND CLEANSING,WARDAH NATURE DAILY ALOE HAND SANITIZER,02456,HS-AHHGELN2-W,8993137710848,WARDAH NATURE DAILY ALOE HYDRAMILD HAND GEL 50 ML,9909.91,1,0,1,9909.91,0,9909.91,
DC RANTAU PRAPAT,WARDAH,FACE MOISTURIZER,WARDAH NATURE DAILY SHEET MASK,01972,MA-NDSGT-W,8993137702065,WARDAH NATURE DAILY SHEET MASK GREEN TEA 20 ML,14414.42,2,0,2,28828.84,0,28828.84,
DC RANTAU PRAPAT,WARDAH,FACE MAKE UP,WARDAH LIGHTENING REFILL TWC LIGHT FEEL,02386,TC-RR3LLF07-W,8993137704939,WARDAH REFILL LIGHTENING POWDER FOUNDATION LIGHT FEEL 07 HONEY BEIGE 12 G,31531.54,7,0,7,220720.78,0,220720.78,
DC RANTAU PRAPAT,WARDAH,LIP MAKE UP,WARDAH LIPSTICK INTENSE MATTE,01122,L-IM04-W2.3G,8993137694797,WARDAH INTENSE MATTE LIPSTICK 04 MAUVE MELLOW 2.3 G (PC(S)),42342.35,2,0,2,84684.7,0,84684.7,
DC RANTAU PRAPAT,WARDAH,FACE MAKE UP,WARDAH BLUSH ON,00120,BO-W0D-W4GR,8993137680035,WARDAH BLUSH ON D 4 GR,39639.64,1,0,1,39639.64,0,39639.64,
DC RANTAU PRAPAT,WARDAH,LIP MAKE UP,WARDAH HYDROGLOSS,00164,"L-W1HYIPC1-W3,8GR",8993137572385,"WARDAH HYDROGLOSS 01 INVISIBLE PINK 3,8 GR",29279.28,1,0,1,29279.28,0,29279.28,
DC RANTAU PRAPAT,WARDAH,FACE MAKE UP,WARDAH LIGHTENING REFILL TWC EXTRA COVER,02100,TC-RR2LEC01-W,8993137691116,WARDAH REFILL LIGHTENING TWO WAY CAKE EXTRA COVER 01 LIGHT BEIGE 10 G,35135.14,2,0,2,70270.28,0,70270.28,
DC RANTAU PRAPAT,WARDAH,COLOGNE,WARDAH SCENTSATION BODY MIST,01776,BP-SJYBM-W100ML,8993137698153,WARDAH SCENTSATION JOYFUL BODY MIST 100 ML (PC(S)),31981.99,1,0,1,31981.99,0,31981.99,
DC RANTAU PRAPAT,WARDAH,EDT,WARDAH SCENTSATION EDT,01780,BP-SJYE-W35ML,8993137698399,WARDAH SCENTSATION JOYFUL EAU DE TOILETTE 35 ML (PC(S)),48198.2,1,0,1,48198.2,0,48198.2,
DC RANTAU PRAPAT,WARDAH,COLOGNE,WARDAH SCENTSATION BODY MIST,01778,BP-SPNBM-W100ML,8993137698160,WARDAH SCENTSATION PASSION BODY MIST 100 ML (PC(S)),31981.99,2,0,2,63963.98,0,63963.98,
DC RANTAU PRAPAT,WARDAH,FACE MAKE UP,WARDAH LIGHTENING TWC EXTRA COVER,01540,TC-RLEC03-W10G,8993137691024,WARDAH LIGHTENING TWO WAY CAKE EXTRA COVER 03 SHEER PINK 10 G,50900.91,3,0,3,152702.73,0,152702.73,
DC RANTAU PRAPAT,WARDAH,LIP MAKE UP,WARDAH COLORFIT LIP MOUSSE WOMEN'S DAY SPECIAL EDITION,02996,L-CVM06LE-W,8993137713054,WARDAH COLORFIT VELVET MATTE LIP MOUSSE - WOMEN'S DAY SPECIAL EDITION 06 FUCHSIA LOVER 4 G,63513.52,4,0,4,254054.08,0,254054.08,
DC RANTAU PRAPAT,WARDAH,FACE MOISTURIZER,WARDAH PERFECT BRIGHT MOISTURIZER SPF 28,02392,M-PBSPFB15-W,8993137692472,WARDAH BUNDLING PBM SPF 28 20 ML GRATIS NFS PBCF BRIGHTENING + OIL CONTROL 15 ML,22792.8,3,0,3,68378.4,0,68378.4,
DC RANTAU PRAPAT,WARDAH,LIP MAKE UP,WARDAH COLORFIT LIP MOUSSE WOMEN'S DAY SPECIAL EDITION,02993,L-CVM02LE-W,8993137713023,WARDAH COLORFIT VELVET MATTE LIP MOUSSE - WOMEN'S DAY SPECIAL EDITION 02 JOYFUL ORANGE 4 G,63513.52,2,0,2,127027.04,0,127027.04,
DC RANTAU PRAPAT,WARDAH,FACE CLEANSER,WARDAH LIGHTENING MILK CLEANSER,01709,CM-RL-W150ML,8993137678735,WARDAH LIGHTENING MILK CLEANSER 150 ML,25909.09,1,0,1,25909.09,0,25909.09,
DC RANTAU PRAPAT,WARDAH,FACE MAKE UP,WARDAH EXCLUSIVE CUSHION,02027,CUS-EFC01-W,8993137705868,WARDAH EXCLUSIVE FLAWLESS COVER CUSHION 01 LIGHT BEIGE 15 G,120720.73,1,0,1,120720.73,0,120720.73,
DC RANTAU PRAPAT,WARDAH,FACE MAKE UP,WARDAH EXCLUSIVE CUSHION,02028,CUS-EFC02-W,8993137705875,WARDAH EXCLUSIVE FLAWLESS COVER CUSHION 02 HONEY BEIGE 15 G,120720.73,1,0,1,120720.73,0,120720.73,
DC SEMARANG,EMINA,LIP MAKE UP,EMINA LIP CUSHION,02360,L-CUSH03-EM,8993137706872,EMINA LIP CUSHION 03. GET BERRY 9 G,49099.1,33,0,33,1620270.3,0,1620270.3,
DC SEMARANG,EMINA,COLOGNE,EMINA BODY MIST,02091,BP-BMRFN2-EM,8993137704229,EMINA BODY MIST RAIN FOREST 10 ML,18468.47,2,0,2,36936.94,0,36936.94,
DC SEMARANG,EMINA,LIP MAKE UP,EMINA LIP CUSHION,02362,L-CUSH05-EM,8993137706896,EMINA LIP CUSHION 05. SQUASH IT UP 9 G,49099.1,30,0,30,1472973,0,1472973,
DC SEMARANG,PUTRI,HAIR SPRAY,PUTRI HAIR SPRAY,00395,HSP-P1N1G1S-P200,8993137683951,PUTRI HAIR SPRAY NON AEROSOL STRONG (HIJAU) 200 ML (PC(S)),27837.84,5,0,5,139189.2,0,139189.2,
DC SEMARANG,PUTRI,HAIR TONIC,PUTRI HAIR TONIC,00310,HT-P1G1-P200D,8993137252034,"HAIR TONIC NORMAL TO OILY HAIR (GREEN), 200 MLD",22432.44,49,0,49,1099189.56,0,1099189.56,
DC SEMARANG,PUTRI,CONDITIONER,PUTRI CONDITIONER,00357,HC-P1F-P2,8993137170031,PUTRI PURE CLEAN HAIR CONDITIONER FLORAL 2 L (PC(S)),54594.6,2,0,2,109189.2,0,109189.2,
DC SEMARANG,WARDAH,BODY BUTTER,WARDAH SPA BODY BUTTER,00274,BUT-W0R-W100ML,8993137690737,WARDAH CREAMY BODY BUTTER WITH ROSE 100 ML (PC(S)),31981.99,259,0,259,8283335.41,0,8283335.41,
DC SEMARANG,WARDAH,LIP MAKE UP,WARDAH EXCLUSIVE LIP CREAM BLISTER,02157,L-EMC05MM-W,8993137693806,WARDAH EXCLUSIVE MATTE LIP CREAM BLISTER 05 SPEACHLESS 4 G,56756.76,36,0,36,2043243.36,0,2043243.36,
DC SEMARANG,WARDAH,FACE MAKE UP,WARDAH LIGHTENING BB CAKE,01244,TC-LPGBB01-W11GR,8993137693943,WARDAH LIGHTENING BB CAKE POWDER 01 LIGHT 11 GR (PC(S)),50900.91,1,0,1,50900.91,0,50900.91,
DC SEMARANG,WARDAH,LIP MAKE UP,WARDAH COLORFIT LIP MOUSSE,02115,L-CVM04-W,8993137705363,WARDAH COLORFIT VELVET MATTE LIP MOUSSE 04 PINK SWEETHEART 4 G,63513.52,3,0,3,190540.56,0,190540.56,
DC SEMARANG,WARDAH,EYE MAKE UP,WARDAH EYEXPERT EYEBROW PENCIL,00902,EB-W1BL-W,8993137681452,WARDAH EYE BROW BLACK,31981.99,45,0,45,1439189.55,0,1439189.55,
DC SEMARANG,WARDAH,BODY BUTTER,WARDAH SPA BODY BUTTER,00280,BUT-W3R-W150ML,8993137684811,WARDAH CREAMY BODY BUTTER WITH ROSE 150 ML (PC(S)),45045.05,328,0,328,14774776.4,0,14774776.4,
DC SOLO,EMINA,LIP MAKE UP,EMINA SOULMATTE LIPSTICK,01664,L-SM09H-EM2.3G,8993137700313,EMINA SOULMATTE LIPSTICK 09 HEATHER 2.3 G,50450.46,1,0,1,50450.46,0,50450.46,
DC SOLO,EMINA,FACE MAKE UP,EMINA CHEEK LIT CREAM BLUSH,00776,BO-CLCPE-EM10ML,8993137691505,EMINA CHEEK LIT CREAM BLUSH PEACH 10 ML (PC(S)),27477.48,102,0,102,2802702.96,0,2802702.96,
DC SOLO,INSTAPERFECT,FACE MAKE UP,INSTAPERFECT REFILL TWC,01991,TC-RIPMFPF14-W,8993137704465,WARDAH REFILL INSTAPERFECT MATTE FIT POWDER FOUNDATION 14. CRÉME13 G,73873.88,45,0,45,3324324.6,0,3324324.6,
DC SOLO,INSTAPERFECT,LIP MAKE UP,INSTAPERFECT LIP CRAYON MATTECENTRIC,01700,L-IPMC06-W3G,8993137700757,WARDAH INSTAPERFECT MATTECENTRIC LIP CRAYON 06 SOUL 3 G,78378.38,74,0,74,5800000.12,0,5800000.12,
DC SOLO,INSTAPERFECT,FACE MAKE UP,INSTAPERFECT REFILL TWC,01989,TC-RIPMFPF12-W,8993137704441,WARDAH REFILL INSTAPERFECT MATTE FIT POWDER FOUNDATION 12. IVORY 13 G,73873.88,53,0,53,3915315.64,0,3915315.64,
DC SOLO,MAKE OVER,LIP MAKE UP,MAKE OVER ULTRA SHINE LIPSTICK,00736,"L-USRA07-MO3,8G",8993137682749,"MAKE OVER ULTRA SHINE LIPSTICK 07 RED ALERT 3,8 G (PC(S))",69369.37,3,0,3,208108.11,0,208108.11,
DC SOLO,MAKE OVER,LIP MAKE UP,MAKE OVER CREAMY LUST LIPSTICK,00683,L-CLTB08-MO4G,8993137682879,MAKE OVER CREAMY LUST LIPSTICK 08 TWILIGHT BUFF 4 G (PC(S)),69369.37,13,0,13,901801.81,0,901801.81,
DC SOLO,MAKE OVER,LIP MAKE UP,MAKE OVER LIQUID LIP COLOR,00704,L-LDP-MO5ML,8993137683302,MAKE OVER LIQUID LIP COLOR DROP-DEAD PINK 5 ML (PC(S)),69369.37,5,0,5,346846.85,0,346846.85,
DC SOLO,MAKE OVER,FACE MOISTURIZER,MAKE OVER POWERSKIN TINTED MOISTURIZER,01970,M-PSRT40-MO,8993137702966,MAKE OVER POWERSKIN RADIANT TINTED MOISTURIZER 40 MEDIUM BEIGE 40 ML,121621.63,17,0,17,2067567.71,0,2067567.71,
DC SOLO,MAKE OVER,LIP MAKE UP,MAKE OVER ULTRA SHINE LIPSTICK,00733,"L-USRJ04-MO3,8G",8993137682718,"MAKE OVER ULTRA SHINE LIPSTICK 04 REDDISH JUNK 3,8 G (PC(S))",69369.37,15,0,15,1040540.55,0,1040540.55,
DC SOLO,MAKE OVER,FACE MAKE UP,MAKE OVER SHIMMERING POWDER,01918,B-SPB-MO13GR,8993137702218,MAKE OVER SHIMMERING POWDER BRONZED 13 GR,97297.3,1,0,1,97297.3,0,97297.3,
DC SOLO,MAKE OVER,EYE MAKE UP,MAKE OVER POWERSTAY EYE SHADOW PRIMER,02082,ES-PPR-MO,8993137701471,MAKE OVER POWERSTAY EYESHADOW PRIMER 7 G,73873.88,18,0,18,1329729.84,0,1329729.84,
DC SOLO,MAKE OVER,LIP MAKE UP,MAKE OVER ULTRA SHINE LIPSTICK,00742,"L-USEVK13-MO3,8G",8993137690997,"MAKE OVER ULTRA SHINE LIPSTICK 13 EVERLASTING KISS 3,8 G (PC(S))",69369.37,5,0,5,346846.85,0,346846.85,
DC SOLO,MAKE OVER,FACE MAKE UP,MAKE OVER POWERSTAY CREAMY FOUNDATION,02195,F-PTCMCW52-MO,8993137705004,MAKE OVER POWERSTAY TOTAL COVER MATTE CREAM FOUNDATION W52 WARM TAN 12 G,121621.63,27,0,27,3283784.01,0,3283784.01,
DC SOLO,MAKE OVER,LIP MAKE UP,MAKE OVER ULTRA HI-MATTE LIPSTICK,01146,L-UHS016-MO2.3G,8993137696951,MAKE OVER ULTRA HI-MATTE LIPSTICK 016 SILHOUTTE 2.3 G (PC(S)),81981.99,1,0,1,81981.99,0,81981.99,
DC SOLO,MAKE OVER,FACE MAKE UP,MAKE OVER POWERSTAY CREAMY FOUNDATION,02188,F-PTCMCC62-MO,8993137705028,MAKE OVER POWERSTAY TOTAL COVER MATTE CREAM FOUNDATION C62 RICH COCOA 12 G,121621.63,30,0,30,3648648.9,0,3648648.9,
DC SOLO,MAKE OVER,LIP MAKE UP,MAKE OVER CREAMY LUST LIPSTICK,00684,L-CLCH09-MO4G,8993137682886,MAKE OVER CREAMY LUST LIPSTICK 09 CLOVER HAZE 4 G (PC(S)),69369.37,2,0,2,138738.74,0,138738.74,
DC SOLO,MAKE OVER,LIP MAKE UP,MAKE OVER CREAMY LUST LIPSTICK,00681,L-CLGG06-MO4G,8993137682855,MAKE OVER CREAMY LUST LIPSTICK 06 GLORIUS GOLD 4 G (PC(S)),69369.37,2,0,2,138738.74,0,138738.74,
DC SOLO,MAKE OVER,LIP MAKE UP,MAKE OVER CREAMY LUST LIPSTICK,00682,L-CLMB07-MO4G,8993137682862,MAKE OVER CREAMY LUST LIPSTICK 07 MAUVE BROWN 4 G (PC(S)),69369.37,2,0,2,138738.74,0,138738.74,
DC SOLO,MAKE OVER,LIP MAKE UP,MAKE OVER CREAMY LUST LIPSTICK,01513,L-CLNPC13-MO4G,8993137698191,MAKE OVER CREAMY LUST LIPSTICK 13 NUDE PANNACOTTA 4 G (PC(S)),69369.37,2,0,2,138738.74,0,138738.74,
DC SOLO,MAKE OVER,EYE MAKE UP,MAKE OVER EYE SHADOW REFILL,00563,"ES-C-MOR3,5G",8993137684149,"MAKE OVER PMES COCOA REFILL PACK 3,5 G (PC(S))",45045.05,5,0,5,225225.25,0,225225.25,
DC SOLO,MAKE OVER,FACE MAKE UP,MAKE OVER BLUSH ON STICK,01834,BO-MMB01-MO9G,8993137700801,MAKE OVER MULTIFIX MATTE BLUSHER 01 ROSE HOUR 9 G,109909.91,5,0,5,549549.55,0,549549.55,
DC SOLO,MAKE OVER,EYE MAKE UP,MAKE OVER EYE SHADOW REFILL,00599,"ES-BS-MOR3,5G",8993137682336,"MAKE OVER SGES BLACK STILETTO REFILL PACK 3,5 G (PC(S))",45045.05,3,0,3,135135.15,0,135135.15,
DC SOLO,MAKE OVER,LIP MAKE UP,MAKE OVER CREAMY LUST LIPSTICK,00678,L-CLRP03-MO4G,8993137682824,MAKE OVER CREAMY LUST LIPSTICK 03 RAISIN PLUM 4 G (PC(S)),69369.37,3,0,3,208108.11,0,208108.11,
DC SOLO,MAKE OVER,FACE MAKE UP,MAKE OVER POWERSTAY MATTE CUSHION,02007,CUS-PDMCN50-MO,8993137705073,MAKE OVER POWERSTAY DEMI-MATTE COVER CUSHION N50 TAN 15 G,187387.39,9,0,9,1686486.51,0,1686486.51,
DC SOLO,MAKE OVER,FACE MAKE UP,MAKE OVER POWERSTAY TWC,02306,TC-PMN50-MO,8993137707213,MAKE OVER POWERSTAY MATTE POWDER FOUNDATION N50 TAN 12 G,164864.87,5,0,5,824324.35,0,824324.35,
DC SOLO,MAKE OVER,LIP MAKE UP,MAKE OVER ULTRA HI-MATTE LIPSTICK,01139,L-UHF009-MO2.3G,8993137696890,MAKE OVER ULTRA HI-MATTE LIPSTICK 009 FOXY 2.3 G (PC(S)),81981.99,8,0,8,655855.92,0,655855.92,
DC SOLO,MAKE OVER,LIP MAKE UP,MAKE OVER LIQUID LIP COLOR,00907,L-LPPI-MO5ML,8993137693370,MAKE OVER LIQUID LIP COLOR PENELOPE PINK 5 ML (PC(S)),69369.37,6,0,6,416216.22,0,416216.22,
DC SOLO,MAKE OVER,LIP MAKE UP,MAKE OVER CLIQUEMATTE,01986,L-CQS212-MO2G,8993137701518,MAKE OVER CLIQUEMATTE LIP STYLO 212 CHECKMATE 2 G,101801.81,4,0,4,407207.24,0,407207.24,
DC SOLO,MAKE OVER,LIP MAKE UP,MAKE OVER CLIQUEMATTE,01985,L-CQS211-MO2G,8993137701501,MAKE OVER CLIQUEMATTE LIP STYLO 211 TRUFFLES 2 G,101801.81,3,0,3,305405.43,0,305405.43,
DC SOLO,PUTRI,CREAMBATH,PUTRI SPA BOTANICAL GARDEN,00372,CB-P1BG-P720,8993137683807,PUTRI SS BOTANICAL GARDEN SPA WLEO 720 ML (PC(S)),62792.8,1,0,1,62792.8,0,62792.8,
DC SOLO,PUTRI,HAIR STYLING,PUTRI STYLING GLAZE,00398,SGL-P1-P200,8993137222013,PUTRI STYLING GLAZE 200 ML (PC(S)),21351.36,32,0,32,683243.52,0,683243.52,
DC SOLO,PUTRI,CONDITIONER,PUTRI CONDITIONER,00358,HC-P1F-P5,8993137170062,PUTRI PURE CLEAN HAIR CONDITIONER FLORAL 5 L (PC(S)),104684.69,2,0,2,209369.38,0,209369.38,
DC SOLO,PUTRI,CONDITIONER,PUTRI CONDITIONER,00353,HC-P1A2-P5,8993137170055,PUTRI PURE CLEAN HAIR CONDITIONER APPLE 5 L (PC(S)),104684.69,3,0,3,314054.07,0,314054.07,
DC SOLO,PUTRI,BODY SCRUB,PUTRI SPA BODY SCRUB,00384,LW-P1-P720,8993137247207,PUTRI OLIVE BODY SCRUB 720 ML (PC(S)),54054.06,3,0,3,162162.18,0,162162.18,
DC SOLO,PUTRI,SHAMPOO,PUTRI SHAMPOO,00363,S-P1A2-P5,8993137180450,PUTRI PURE CLEAN SHAMPOO APPLE 5 L (PC(S)),114684.69,1,0,1,114684.69,0,114684.69,
DC SOLO,PUTRI,BODY SCRUB,PUTRI SPA BODY SCRUB,00382,LW-P1-P150,8993137683906,PUTRI OLIVE BODY SCRUB 150 ML (PC(S)),18018.02,6,0,6,108108.12,0,108108.12,
DC SOLO,WARDAH,FACE CLEANSER,WARDAH LIGHTENING MILK CLEANSER,01709,CM-RL-W150ML,8993137678735,WARDAH LIGHTENING MILK CLEANSER 150 ML,25909.09,27,0,27,699545.43,0,699545.43,
DC SOLO,WARDAH,FACE MAKE UP,WARDAH EVERYDAY CREAMY FOUNDATION EXTRA COVER,00130,"F-W3ELCECSP-W8,5G",8993137685429,"WARDAH EVD LUM CREAMY FOUNDATION EXTRA COVER 01 SHEER PINK 8,5 G (PC(S))",34234.24,3,0,3,102702.72,0,102702.72,
DC SOLO,WARDAH,LIP MAKE UP,WARDAH LIPSTICK LONG LASTING,01668,L-LL17-W2.3G,8993137700412,WARDAH LIPSTICK LONGLASTING 17 PASSIONATE RED 2.3 G,42342.35,2,0,2,84684.7,0,84684.7,
DC SOLO,WARDAH,LIP MAKE UP,WARDAH LIPSTICK INTENSE MATTE,01438,L-IM15-W2.3G,8993137698597,WARDAH INTENSE MATTE LIPSTICK 15 OUT OF RED! 2.3 G (PC(S)),42342.35,3,0,3,127027.05,0,127027.05,
DC SOLO,WARDAH,LIP MAKE UP,WARDAH LIPSTICK INTENSE MATTE,01437,L-IM14-W2.3G,8993137698580,WARDAH INTENSE MATTE LIPSTICK 14 ACTIVE CERISE 2.3 G (PC(S)),42342.35,12,0,12,508108.2,0,508108.2,
DC SOLO,WARDAH,FACE MAKE UP,WARDAH LIGHTENING TWC EXTRA COVER,01540,TC-RLEC03-W10G,8993137691024,WARDAH LIGHTENING TWO WAY CAKE EXTRA COVER 03 SHEER PINK 10 G,50900.91,2,0,2,101801.82,0,101801.82,
DC SOLO,WARDAH,FACE MOISTURIZER,WARDAH NATURE DAILY SHEET MASK,01972,MA-NDSGT-W,8993137702065,WARDAH NATURE DAILY SHEET MASK GREEN TEA 20 ML,14414.42,443,0,443,6385588.06,0,6385588.06,
DC SOLO,WARDAH,LIP MAKE UP,WARDAH LIP PALETTE,00174,L-W0PPP-W10G,8993137680653,WARDAH LIP PALETTE PINKY PEACH 10 G (PC(S)),62612.62,2,0,2,125225.24,0,125225.24,
DC SOLO,WARDAH,EYE MAKE UP,WARDAH EYEXPERT EYEBROW PENCIL,00902,EB-W1BL-W,8993137681452,WARDAH EYE BROW BLACK,31981.99,20,0,20,639639.8,0,639639.8,
DC SOLO,WARDAH,FACE MOISTURIZER,WARDAH NATURE DAILY ALOE HYDRAMILD SERUM,01618,SRM-AH-W5X5ML,8993137695145,WARDAH NATURE DAILY ALOE HYDRAMILD SERUM 5 X 5ML,41441.45,2,0,2,82882.9,0,82882.9,
DC SOLO,WARDAH,FACE MOISTURIZER,WARDAH PERFECT BRIGHT MOISTURIZER SPF 28,02392,M-PBSPFB15-W,8993137692472,WARDAH BUNDLING PBM SPF 28 20 ML GRATIS NFS PBCF BRIGHTENING + OIL CONTROL 15 ML,22792.8,9,0,9,205135.2,0,205135.2,
DC SOLO,WARDAH,EYE MAKE UP,WARDAH EYE SHADOW,00930,"ES-W0L-W3,3GR",8993137680141,"WARDAH EYE SHADOW L 3,3 GR (PC(S))",42342.35,2,0,2,84684.7,0,84684.7,
DC SOLO,WARDAH,EYE MAKE UP,WARDAH EYE SHADOW,00932,"ES-W0N-W3,3GR",8993137680165,"WARDAH EYE SHADOW N 3,3 GR (PC(S))",42342.35,29,0,29,1227928.15,0,1227928.15,
DC SOLO,WARDAH,FACE MOISTURIZER,WARDAH LIGHTENING NIGHT CREAM,01633,M-RLNC-W30G,8993137572194,WARDAH LIGHTENING NIGHT CREAM 30 G (PC(S)),39090.9,2,0,2,78181.8,0,78181.8,
DC SOLO,WARDAH,FACE MOISTURIZER,WARDAH WHITE SECRET DAY CREAM,03134,M-RWSDCN2-W,8993137692298,WARDAH CRYSTAL SECRET BRIGHTENING DAY CREAM 30 G,87387.39,1,0,1,87387.39,0,87387.39,
DC SOLO,WARDAH,PACKAGE PERSONAL CARE,WARDAH PAKET HAJI PACKAGE,00288,PH-HU-W,8993137677363,PAKET HAJI DAN UMROH WARDAH (PC(S)),123873.88,3,0,3,371621.64,0,371621.64,
DC SUKABUMI,EMINA,HAND CLEANSING,EMINA ALOE VERA HAND GEL,02468,HS-AVHGN2-EM,8993137710404,EMINA ALOE VERA HAND GEL 50 ML,14864.87,4,0,4,59459.48,0,59459.48,
DC SUKABUMI,MAKE OVER,FACE MAKE UP,MAKE OVER POWERSTAY WEIGHTLESS LIQUID FOUNDATION,02424,F-LPWN50-MO,8993137707374,MAKE OVER POWERSTAY WEIGHTLESS LIQUID FOUNDATION N50 TAN 33 ML,145945.95,11,0,11,1605405.45,0,1605405.45,
DC SUKABUMI,MAKE OVER,FACE MAKE UP,MAKE OVER POWERSTAY ILLUMINATOR,02400,PRM-PRI01-MO,8993137706643,MAKE OVER POWERSTAY RADIANT ILLUMINIZER LUMIERE 25 G,109909.91,24,0,24,2637837.84,0,2637837.84,
